[I 2023-07-20 17:54:45,201] A new study created in memory with name: no-name-f90b0418-127c-41bd-9466-9587785fb437
[I 2023-07-20 18:41:12,514] Trial 0 finished with value: 0.9165596696711311 and parameters: {'max_depth': 9, 'max_features': 0.7482920440979423, 'n_estimators': 100, 'criterion': 'gini', 'min_samples_split': 5}. Best is trial 0 with value: 0.9165596696711311.
[I 2023-07-20 20:01:37,597] Trial 1 finished with value: 0.9144719444217058 and parameters: {'max_depth': 8, 'max_features': 0.457090726807603, 'n_estimators': 320, 'criterion': 'entropy', 'min_samples_split': 453}. Best is trial 0 with value: 0.9165596696711311.
[I 2023-07-20 21:16:00,255] Trial 2 finished with value: 0.9132888256947886 and parameters: {'max_depth': 5, 'max_features': 0.703420759160562, 'n_estimators': 270, 'criterion': 'gini', 'min_samples_split': 274}. Best is trial 0 with value: 0.9165596696711311.
[I 2023-07-20 23:18:26,337] Trial 3 finished with value: 0.9195810156716971 and parameters: {'max_depth': 15, 'max_features': 0.38208176034331853, 'n_estimators': 380, 'criterion': 'entropy', 'min_samples_split': 2}. Best is trial 3 with value: 0.9195810156716971.
[I 2023-07-21 00:12:06,809] Trial 4 finished with value: 0.9137341859081358 and parameters: {'max_depth': 6, 'max_features': 0.8903282530864718, 'n_estimators': 140, 'criterion': 'entropy', 'min_samples_split': 135}. Best is trial 3 with value: 0.9195810156716971.
[I 2023-07-21 03:08:03,163] Trial 5 finished with value: 0.9153887074675826 and parameters: {'max_depth': 8, 'max_features': 0.7178508349134253, 'n_estimators': 440, 'criterion': 'log_loss', 'min_samples_split': 195}. Best is trial 3 with value: 0.9195810156716971.
[I 2023-07-21 04:10:07,054] Trial 6 finished with value: 0.9154645864940957 and parameters: {'max_depth': 8, 'max_features': 0.8103513956063396, 'n_estimators': 140, 'criterion': 'entropy', 'min_samples_split': 10}. Best is trial 3 with value: 0.9195810156716971.
[I 2023-07-21 04:41:20,335] Trial 7 finished with value: 0.9124654241282728 and parameters: {'max_depth': 6, 'max_features': 0.11743026208326737, 'n_estimators': 370, 'criterion': 'log_loss', 'min_samples_split': 2}. Best is trial 3 with value: 0.9195810156716971.
[I 2023-07-21 05:53:59,510] Trial 8 finished with value: 0.9153935234424825 and parameters: {'max_depth': 11, 'max_features': 0.23205571741522915, 'n_estimators': 340, 'criterion': 'gini', 'min_samples_split': 137}. Best is trial 3 with value: 0.9195810156716971.
[I 2023-07-21 06:28:54,629] Trial 9 finished with value: 0.9124653404041261 and parameters: {'max_depth': 9, 'max_features': 0.14495811305147846, 'n_estimators': 310, 'criterion': 'log_loss', 'min_samples_split': 68}. Best is trial 3 with value: 0.9195810156716971.
[I 2023-07-21 06:59:15,704] Trial 10 finished with value: 0.9152374742799635 and parameters: {'max_depth': 14, 'max_features': 0.2237272337316138, 'n_estimators': 150, 'criterion': 'gini', 'min_samples_split': 624}. Best is trial 3 with value: 0.9195810156716971.
[I 2023-07-21 09:52:20,130] Trial 11 finished with value: 0.9155862444458887 and parameters: {'max_depth': 8, 'max_features': 0.7757308928225399, 'n_estimators': 390, 'criterion': 'gini', 'min_samples_split': 15}. Best is trial 3 with value: 0.9195810156716971.
[I 2023-07-21 11:45:17,105] Trial 12 finished with value: 0.9145885834174603 and parameters: {'max_depth': 7, 'max_features': 0.9062975963764601, 'n_estimators': 270, 'criterion': 'gini', 'min_samples_split': 3}. Best is trial 3 with value: 0.9195810156716971.
[I 2023-07-21 14:04:48,441] Trial 13 finished with value: 0.9214752413908341 and parameters: {'max_depth': 15, 'max_features': 0.5049209201319464, 'n_estimators': 330, 'criterion': 'log_loss', 'min_samples_split': 63}. Best is trial 13 with value: 0.9214752413908341.
[I 2023-07-21 15:00:43,916] Trial 14 finished with value: 0.9131649697479135 and parameters: {'max_depth': 5, 'max_features': 0.6554304222586514, 'n_estimators': 230, 'criterion': 'entropy', 'min_samples_split': 552}. Best is trial 13 with value: 0.9214752413908341.
[I 2023-07-21 16:00:52,314] Trial 15 finished with value: 0.9127422797993093 and parameters: {'max_depth': 11, 'max_features': 0.11423911856190067, 'n_estimators': 480, 'criterion': 'entropy', 'min_samples_split': 4}. Best is trial 13 with value: 0.9214752413908341.
[I 2023-07-21 17:13:03,155] Trial 16 finished with value: 0.9227872399964696 and parameters: {'max_depth': 15, 'max_features': 0.7271363453409101, 'n_estimators': 120, 'criterion': 'log_loss', 'min_samples_split': 153}. Best is trial 16 with value: 0.9227872399964696.
[I 2023-07-21 17:23:34,102] Trial 17 finished with value: 0.9124520797049256 and parameters: {'max_depth': 6, 'max_features': 0.11789212045581604, 'n_estimators': 110, 'criterion': 'log_loss', 'min_samples_split': 50}. Best is trial 16 with value: 0.9227872399964696.
[I 2023-07-21 18:51:26,568] Trial 18 finished with value: 0.9185657816571655 and parameters: {'max_depth': 11, 'max_features': 0.8578278031236451, 'n_estimators': 150, 'criterion': 'log_loss', 'min_samples_split': 58}. Best is trial 16 with value: 0.9227872399964696.
[I 2023-07-21 19:46:08,702] Trial 19 finished with value: 0.9131231068747988 and parameters: {'max_depth': 5, 'max_features': 0.8205694054125547, 'n_estimators': 190, 'criterion': 'log_loss', 'min_samples_split': 193}. Best is trial 16 with value: 0.9227872399964696.
