[I 2023-07-21 20:07:21,577] Trial 20 finished with value: 0.9141161918752363 and parameters: {'max_depth': 11, 'max_features': 0.2228097030946165, 'n_estimators': 120, 'criterion': 'gini', 'min_samples_split': 7}. Best is trial 16 with value: 0.9227872399964696.
[W 2023-07-21 20:18:07,673] Trial 21 failed with parameters: {'max_depth': 12, 'max_features': 0.6037452838487282, 'n_estimators': 100, 'criterion': 'entropy', 'min_samples_split': 6} because of the following error: KeyboardInterrupt().
Traceback (most recent call last):
  File "/opt/conda/envs/rapids/lib/python3.10/site-packages/optuna/study/_optimize.py", line 200, in _run_trial
    value_or_values = func(trial)
  File "/rapids/notebooks/host/code/hpo_cpu.py", line 149, in <lambda>
    lambda trial: train_randomforest(
  File "/rapids/notebooks/host/code/hpo_cpu.py", line 120, in train_randomforest
    trained_model.fit(X_train, y_train)
  File "/opt/conda/envs/rapids/lib/python3.10/site-packages/sklearn/ensemble/_forest.py", line 473, in fit
    trees = Parallel(
  File "/opt/conda/envs/rapids/lib/python3.10/site-packages/sklearn/utils/parallel.py", line 63, in __call__
    return super().__call__(iterable_with_config)
  File "/opt/conda/envs/rapids/lib/python3.10/site-packages/joblib/parallel.py", line 1098, in __call__
    self.retrieve()
  File "/opt/conda/envs/rapids/lib/python3.10/site-packages/joblib/parallel.py", line 975, in retrieve
    self._output.extend(job.get(timeout=self.timeout))
  File "/opt/conda/envs/rapids/lib/python3.10/multiprocessing/pool.py", line 768, in get
    self.wait(timeout)
  File "/opt/conda/envs/rapids/lib/python3.10/multiprocessing/pool.py", line 765, in wait
    self._event.wait(timeout)
  File "/opt/conda/envs/rapids/lib/python3.10/threading.py", line 607, in wait
    signaled = self._cond.wait(timeout)
  File "/opt/conda/envs/rapids/lib/python3.10/threading.py", line 320, in wait
    waiter.acquire()
KeyboardInterrupt
[W 2023-07-21 20:18:07,685] Trial 21 failed with value None.
Process Dask Worker process (from Nanny):
Traceback (most recent call last):
  File "/opt/conda/envs/rapids/lib/python3.10/multiprocessing/process.py", line 314, in _bootstrap
    self.run()
  File "/opt/conda/envs/rapids/lib/python3.10/multiprocessing/process.py", line 108, in run
    self._target(*self._args, **self._kwargs)
  File "/opt/conda/envs/rapids/lib/python3.10/site-packages/distributed/process.py", line 202, in _run
    target(*args, **kwargs)
  File "/opt/conda/envs/rapids/lib/python3.10/site-packages/distributed/nanny.py", line 990, in _run
    asyncio.run(run())
  File "/opt/conda/envs/rapids/lib/python3.10/asyncio/runners.py", line 44, in run
    return loop.run_until_complete(main)
  File "/opt/conda/envs/rapids/lib/python3.10/asyncio/base_events.py", line 636, in run_until_complete
    self.run_forever()
  File "/opt/conda/envs/rapids/lib/python3.10/asyncio/base_events.py", line 603, in run_forever
    self._run_once()
  File "/opt/conda/envs/rapids/lib/python3.10/asyncio/base_events.py", line 1871, in _run_once
    event_list = self._selector.select(timeout)
  File "/opt/conda/envs/rapids/lib/python3.10/selectors.py", line 469, in select
    fd_event_list = self._selector.poll(timeout, max_ev)
KeyboardInterrupt
Process Dask Worker process (from Nanny):
Traceback (most recent call last):
  File "/opt/conda/envs/rapids/lib/python3.10/multiprocessing/process.py", line 314, in _bootstrap
    self.run()
  File "/opt/conda/envs/rapids/lib/python3.10/multiprocessing/process.py", line 108, in run
    self._target(*self._args, **self._kwargs)
  File "/opt/conda/envs/rapids/lib/python3.10/site-packages/distributed/process.py", line 202, in _run
    target(*args, **kwargs)
  File "/opt/conda/envs/rapids/lib/python3.10/site-packages/distributed/nanny.py", line 990, in _run
    asyncio.run(run())
  File "/opt/conda/envs/rapids/lib/python3.10/asyncio/runners.py", line 44, in run
    return loop.run_until_complete(main)
  File "/opt/conda/envs/rapids/lib/python3.10/asyncio/base_events.py", line 636, in run_until_complete
    self.run_forever()
  File "/opt/conda/envs/rapids/lib/python3.10/asyncio/base_events.py", line 603, in run_forever
    self._run_once()
  File "/opt/conda/envs/rapids/lib/python3.10/asyncio/base_events.py", line 1871, in _run_once
    event_list = self._selector.select(timeout)
  File "/opt/conda/envs/rapids/lib/python3.10/selectors.py", line 469, in select
    fd_event_list = self._selector.poll(timeout, max_ev)
KeyboardInterrupt
Process Dask Worker process (from Nanny):
Traceback (most recent call last):
  File "/opt/conda/envs/rapids/lib/python3.10/multiprocessing/process.py", line 314, in _bootstrap
    self.run()
  File "/opt/conda/envs/rapids/lib/python3.10/multiprocessing/process.py", line 108, in run
    self._target(*self._args, **self._kwargs)
  File "/opt/conda/envs/rapids/lib/python3.10/site-packages/distributed/process.py", line 202, in _run
    target(*args, **kwargs)
  File "/opt/conda/envs/rapids/lib/python3.10/site-packages/distributed/nanny.py", line 990, in _run
    asyncio.run(run())
  File "/opt/conda/envs/rapids/lib/python3.10/asyncio/runners.py", line 44, in run
    return loop.run_until_complete(main)
  File "/opt/conda/envs/rapids/lib/python3.10/asyncio/base_events.py", line 636, in run_until_complete
    self.run_forever()
  File "/opt/conda/envs/rapids/lib/python3.10/asyncio/base_events.py", line 603, in run_forever
    self._run_once()
  File "/opt/conda/envs/rapids/lib/python3.10/asyncio/base_events.py", line 1871, in _run_once
    event_list = self._selector.select(timeout)
  File "/opt/conda/envs/rapids/lib/python3.10/selectors.py", line 469, in select
    fd_event_list = self._selector.poll(timeout, max_ev)
KeyboardInterrupt
Process Dask Worker process (from Nanny):
Process Dask Worker process (from Nanny):
Traceback (most recent call last):
  File "/opt/conda/envs/rapids/lib/python3.10/multiprocessing/process.py", line 314, in _bootstrap
    self.run()
  File "/opt/conda/envs/rapids/lib/python3.10/multiprocessing/process.py", line 108, in run
    self._target(*self._args, **self._kwargs)
  File "/opt/conda/envs/rapids/lib/python3.10/site-packages/distributed/process.py", line 202, in _run
    target(*args, **kwargs)
  File "/opt/conda/envs/rapids/lib/python3.10/site-packages/distributed/nanny.py", line 990, in _run
    asyncio.run(run())
  File "/opt/conda/envs/rapids/lib/python3.10/asyncio/runners.py", line 44, in run
    return loop.run_until_complete(main)
  File "/opt/conda/envs/rapids/lib/python3.10/asyncio/base_events.py", line 636, in run_until_complete
    self.run_forever()
  File "/opt/conda/envs/rapids/lib/python3.10/asyncio/base_events.py", line 603, in run_forever
    self._run_once()
  File "/opt/conda/envs/rapids/lib/python3.10/asyncio/base_events.py", line 1871, in _run_once
    event_list = self._selector.select(timeout)
  File "/opt/conda/envs/rapids/lib/python3.10/selectors.py", line 469, in select
    fd_event_list = self._selector.poll(timeout, max_ev)
KeyboardInterrupt
Traceback (most recent call last):
  File "/opt/conda/envs/rapids/lib/python3.10/multiprocessing/process.py", line 314, in _bootstrap
    self.run()
  File "/opt/conda/envs/rapids/lib/python3.10/multiprocessing/process.py", line 108, in run
    self._target(*self._args, **self._kwargs)
  File "/opt/conda/envs/rapids/lib/python3.10/site-packages/distributed/process.py", line 202, in _run
    target(*args, **kwargs)
  File "/opt/conda/envs/rapids/lib/python3.10/site-packages/distributed/nanny.py", line 990, in _run
    asyncio.run(run())
  File "/opt/conda/envs/rapids/lib/python3.10/asyncio/runners.py", line 44, in run
    return loop.run_until_complete(main)
  File "/opt/conda/envs/rapids/lib/python3.10/asyncio/base_events.py", line 636, in run_until_complete
    self.run_forever()
  File "/opt/conda/envs/rapids/lib/python3.10/asyncio/base_events.py", line 603, in run_forever
    self._run_once()
  File "/opt/conda/envs/rapids/lib/python3.10/asyncio/base_events.py", line 1871, in _run_once
    event_list = self._selector.select(timeout)
  File "/opt/conda/envs/rapids/lib/python3.10/selectors.py", line 469, in select
    fd_event_list = self._selector.poll(timeout, max_ev)
KeyboardInterrupt
Process Dask Worker process (from Nanny):
Traceback (most recent call last):
  File "/opt/conda/envs/rapids/lib/python3.10/multiprocessing/process.py", line 314, in _bootstrap
    self.run()
  File "/opt/conda/envs/rapids/lib/python3.10/multiprocessing/process.py", line 108, in run
    self._target(*self._args, **self._kwargs)
  File "/opt/conda/envs/rapids/lib/python3.10/site-packages/distributed/process.py", line 202, in _run
    target(*args, **kwargs)
  File "/opt/conda/envs/rapids/lib/python3.10/site-packages/distributed/nanny.py", line 990, in _run
    asyncio.run(run())
  File "/opt/conda/envs/rapids/lib/python3.10/asyncio/runners.py", line 44, in run
    return loop.run_until_complete(main)
  File "/opt/conda/envs/rapids/lib/python3.10/asyncio/base_events.py", line 636, in run_until_complete
    self.run_forever()
  File "/opt/conda/envs/rapids/lib/python3.10/asyncio/base_events.py", line 603, in run_forever
    self._run_once()
  File "/opt/conda/envs/rapids/lib/python3.10/asyncio/base_events.py", line 1871, in _run_once
    event_list = self._selector.select(timeout)
  File "/opt/conda/envs/rapids/lib/python3.10/selectors.py", line 469, in select
    fd_event_list = self._selector.poll(timeout, max_ev)
KeyboardInterrupt
Process Dask Worker process (from Nanny):
Traceback (most recent call last):
  File "/opt/conda/envs/rapids/lib/python3.10/multiprocessing/process.py", line 314, in _bootstrap
    self.run()
  File "/opt/conda/envs/rapids/lib/python3.10/multiprocessing/process.py", line 108, in run
    self._target(*self._args, **self._kwargs)
  File "/opt/conda/envs/rapids/lib/python3.10/site-packages/distributed/process.py", line 202, in _run
    target(*args, **kwargs)
  File "/opt/conda/envs/rapids/lib/python3.10/site-packages/distributed/nanny.py", line 990, in _run
    asyncio.run(run())
  File "/opt/conda/envs/rapids/lib/python3.10/asyncio/runners.py", line 44, in run
    return loop.run_until_complete(main)
  File "/opt/conda/envs/rapids/lib/python3.10/asyncio/base_events.py", line 636, in run_until_complete
    self.run_forever()
  File "/opt/conda/envs/rapids/lib/python3.10/asyncio/base_events.py", line 603, in run_forever
    self._run_once()
  File "/opt/conda/envs/rapids/lib/python3.10/asyncio/base_events.py", line 1871, in _run_once
    event_list = self._selector.select(timeout)
  File "/opt/conda/envs/rapids/lib/python3.10/selectors.py", line 469, in select
    fd_event_list = self._selector.poll(timeout, max_ev)
KeyboardInterrupt
Process Dask Worker process (from Nanny):
Traceback (most recent call last):
  File "/opt/conda/envs/rapids/lib/python3.10/multiprocessing/process.py", line 314, in _bootstrap
    self.run()
  File "/opt/conda/envs/rapids/lib/python3.10/multiprocessing/process.py", line 108, in run
    self._target(*self._args, **self._kwargs)
  File "/opt/conda/envs/rapids/lib/python3.10/site-packages/distributed/process.py", line 202, in _run
    target(*args, **kwargs)
  File "/opt/conda/envs/rapids/lib/python3.10/site-packages/distributed/nanny.py", line 990, in _run
    asyncio.run(run())
  File "/opt/conda/envs/rapids/lib/python3.10/asyncio/runners.py", line 44, in run
    return loop.run_until_complete(main)
  File "/opt/conda/envs/rapids/lib/python3.10/asyncio/base_events.py", line 636, in run_until_complete
    self.run_forever()
  File "/opt/conda/envs/rapids/lib/python3.10/asyncio/base_events.py", line 603, in run_forever
    self._run_once()
  File "/opt/conda/envs/rapids/lib/python3.10/asyncio/base_events.py", line 1871, in _run_once
    event_list = self._selector.select(timeout)
  File "/opt/conda/envs/rapids/lib/python3.10/selectors.py", line 469, in select
    fd_event_list = self._selector.poll(timeout, max_ev)
KeyboardInterrupt
Process Dask Worker process (from Nanny):
Traceback (most recent call last):
  File "/opt/conda/envs/rapids/lib/python3.10/multiprocessing/process.py", line 314, in _bootstrap
    self.run()
  File "/opt/conda/envs/rapids/lib/python3.10/multiprocessing/process.py", line 108, in run
    self._target(*self._args, **self._kwargs)
  File "/opt/conda/envs/rapids/lib/python3.10/site-packages/distributed/process.py", line 202, in _run
    target(*args, **kwargs)
  File "/opt/conda/envs/rapids/lib/python3.10/site-packages/distributed/nanny.py", line 990, in _run
    asyncio.run(run())
  File "/opt/conda/envs/rapids/lib/python3.10/asyncio/runners.py", line 44, in run
    return loop.run_until_complete(main)
  File "/opt/conda/envs/rapids/lib/python3.10/asyncio/base_events.py", line 636, in run_until_complete
    self.run_forever()
  File "/opt/conda/envs/rapids/lib/python3.10/asyncio/base_events.py", line 603, in run_forever
    self._run_once()
  File "/opt/conda/envs/rapids/lib/python3.10/asyncio/base_events.py", line 1871, in _run_once
    event_list = self._selector.select(timeout)
  File "/opt/conda/envs/rapids/lib/python3.10/selectors.py", line 469, in select
    fd_event_list = self._selector.poll(timeout, max_ev)
KeyboardInterrupt
Process Dask Worker process (from Nanny):
Traceback (most recent call last):
  File "/opt/conda/envs/rapids/lib/python3.10/multiprocessing/process.py", line 314, in _bootstrap
    self.run()
  File "/opt/conda/envs/rapids/lib/python3.10/multiprocessing/process.py", line 108, in run
    self._target(*self._args, **self._kwargs)
  File "/opt/conda/envs/rapids/lib/python3.10/site-packages/distributed/process.py", line 202, in _run
    target(*args, **kwargs)
  File "/opt/conda/envs/rapids/lib/python3.10/site-packages/distributed/nanny.py", line 990, in _run
    asyncio.run(run())
  File "/opt/conda/envs/rapids/lib/python3.10/asyncio/runners.py", line 44, in run
    return loop.run_until_complete(main)
  File "/opt/conda/envs/rapids/lib/python3.10/asyncio/base_events.py", line 636, in run_until_complete
    self.run_forever()
  File "/opt/conda/envs/rapids/lib/python3.10/asyncio/base_events.py", line 603, in run_forever
    self._run_once()
  File "/opt/conda/envs/rapids/lib/python3.10/asyncio/base_events.py", line 1871, in _run_once
    event_list = self._selector.select(timeout)
  File "/opt/conda/envs/rapids/lib/python3.10/selectors.py", line 469, in select
    fd_event_list = self._selector.poll(timeout, max_ev)
KeyboardInterrupt
Process Dask Worker process (from Nanny):
Traceback (most recent call last):
  File "/opt/conda/envs/rapids/lib/python3.10/multiprocessing/process.py", line 314, in _bootstrap
    self.run()
  File "/opt/conda/envs/rapids/lib/python3.10/multiprocessing/process.py", line 108, in run
    self._target(*self._args, **self._kwargs)
  File "/opt/conda/envs/rapids/lib/python3.10/site-packages/distributed/process.py", line 202, in _run
    target(*args, **kwargs)
  File "/opt/conda/envs/rapids/lib/python3.10/site-packages/distributed/nanny.py", line 990, in _run
    asyncio.run(run())
  File "/opt/conda/envs/rapids/lib/python3.10/asyncio/runners.py", line 44, in run
    return loop.run_until_complete(main)
  File "/opt/conda/envs/rapids/lib/python3.10/asyncio/base_events.py", line 636, in run_until_complete
    self.run_forever()
  File "/opt/conda/envs/rapids/lib/python3.10/asyncio/base_events.py", line 603, in run_forever
    self._run_once()
  File "/opt/conda/envs/rapids/lib/python3.10/asyncio/base_events.py", line 1871, in _run_once
    event_list = self._selector.select(timeout)
  File "/opt/conda/envs/rapids/lib/python3.10/selectors.py", line 469, in select
    fd_event_list = self._selector.poll(timeout, max_ev)
KeyboardInterrupt
Process Dask Worker process (from Nanny):
Traceback (most recent call last):
  File "/opt/conda/envs/rapids/lib/python3.10/multiprocessing/process.py", line 314, in _bootstrap
    self.run()
  File "/opt/conda/envs/rapids/lib/python3.10/multiprocessing/process.py", line 108, in run
    self._target(*self._args, **self._kwargs)
  File "/opt/conda/envs/rapids/lib/python3.10/site-packages/distributed/process.py", line 202, in _run
    target(*args, **kwargs)
  File "/opt/conda/envs/rapids/lib/python3.10/site-packages/distributed/nanny.py", line 990, in _run
    asyncio.run(run())
  File "/opt/conda/envs/rapids/lib/python3.10/asyncio/runners.py", line 44, in run
    return loop.run_until_complete(main)
  File "/opt/conda/envs/rapids/lib/python3.10/asyncio/base_events.py", line 636, in run_until_complete
    self.run_forever()
  File "/opt/conda/envs/rapids/lib/python3.10/asyncio/base_events.py", line 603, in run_forever
    self._run_once()
  File "/opt/conda/envs/rapids/lib/python3.10/asyncio/base_events.py", line 1871, in _run_once
    event_list = self._selector.select(timeout)
  File "/opt/conda/envs/rapids/lib/python3.10/selectors.py", line 469, in select
    fd_event_list = self._selector.poll(timeout, max_ev)
KeyboardInterrupt
Process Dask Worker process (from Nanny):
Traceback (most recent call last):
  File "/opt/conda/envs/rapids/lib/python3.10/multiprocessing/process.py", line 314, in _bootstrap
    self.run()
  File "/opt/conda/envs/rapids/lib/python3.10/multiprocessing/process.py", line 108, in run
    self._target(*self._args, **self._kwargs)
  File "/opt/conda/envs/rapids/lib/python3.10/site-packages/distributed/process.py", line 202, in _run
    target(*args, **kwargs)
  File "/opt/conda/envs/rapids/lib/python3.10/site-packages/distributed/nanny.py", line 990, in _run
    asyncio.run(run())
  File "/opt/conda/envs/rapids/lib/python3.10/asyncio/runners.py", line 44, in run
    return loop.run_until_complete(main)
  File "/opt/conda/envs/rapids/lib/python3.10/asyncio/base_events.py", line 636, in run_until_complete
    self.run_forever()
  File "/opt/conda/envs/rapids/lib/python3.10/asyncio/base_events.py", line 603, in run_forever
    self._run_once()
  File "/opt/conda/envs/rapids/lib/python3.10/asyncio/base_events.py", line 1871, in _run_once
    event_list = self._selector.select(timeout)
  File "/opt/conda/envs/rapids/lib/python3.10/selectors.py", line 469, in select
    fd_event_list = self._selector.poll(timeout, max_ev)
KeyboardInterrupt
Process Dask Worker process (from Nanny):
Traceback (most recent call last):
  File "/opt/conda/envs/rapids/lib/python3.10/multiprocessing/process.py", line 314, in _bootstrap
    self.run()
  File "/opt/conda/envs/rapids/lib/python3.10/multiprocessing/process.py", line 108, in run
    self._target(*self._args, **self._kwargs)
  File "/opt/conda/envs/rapids/lib/python3.10/site-packages/distributed/process.py", line 202, in _run
    target(*args, **kwargs)
  File "/opt/conda/envs/rapids/lib/python3.10/site-packages/distributed/nanny.py", line 990, in _run
    asyncio.run(run())
  File "/opt/conda/envs/rapids/lib/python3.10/asyncio/runners.py", line 44, in run
    return loop.run_until_complete(main)
  File "/opt/conda/envs/rapids/lib/python3.10/asyncio/base_events.py", line 636, in run_until_complete
    self.run_forever()
  File "/opt/conda/envs/rapids/lib/python3.10/asyncio/base_events.py", line 603, in run_forever
    self._run_once()
  File "/opt/conda/envs/rapids/lib/python3.10/asyncio/base_events.py", line 1871, in _run_once
    event_list = self._selector.select(timeout)
  File "/opt/conda/envs/rapids/lib/python3.10/selectors.py", line 469, in select
    fd_event_list = self._selector.poll(timeout, max_ev)
KeyboardInterrupt
Process Dask Worker process (from Nanny):
Traceback (most recent call last):
  File "/opt/conda/envs/rapids/lib/python3.10/multiprocessing/process.py", line 314, in _bootstrap
    self.run()
  File "/opt/conda/envs/rapids/lib/python3.10/multiprocessing/process.py", line 108, in run
    self._target(*self._args, **self._kwargs)
  File "/opt/conda/envs/rapids/lib/python3.10/site-packages/distributed/process.py", line 202, in _run
    target(*args, **kwargs)
  File "/opt/conda/envs/rapids/lib/python3.10/site-packages/distributed/nanny.py", line 990, in _run
    asyncio.run(run())
  File "/opt/conda/envs/rapids/lib/python3.10/asyncio/runners.py", line 44, in run
    return loop.run_until_complete(main)
  File "/opt/conda/envs/rapids/lib/python3.10/asyncio/base_events.py", line 636, in run_until_complete
    self.run_forever()
  File "/opt/conda/envs/rapids/lib/python3.10/asyncio/base_events.py", line 603, in run_forever
    self._run_once()
  File "/opt/conda/envs/rapids/lib/python3.10/asyncio/base_events.py", line 1871, in _run_once
    event_list = self._selector.select(timeout)
  File "/opt/conda/envs/rapids/lib/python3.10/selectors.py", line 469, in select
    fd_event_list = self._selector.poll(timeout, max_ev)
KeyboardInterrupt
Process Dask Worker process (from Nanny):
Traceback (most recent call last):
  File "/opt/conda/envs/rapids/lib/python3.10/multiprocessing/process.py", line 314, in _bootstrap
    self.run()
  File "/opt/conda/envs/rapids/lib/python3.10/multiprocessing/process.py", line 108, in run
    self._target(*self._args, **self._kwargs)
  File "/opt/conda/envs/rapids/lib/python3.10/site-packages/distributed/process.py", line 202, in _run
    target(*args, **kwargs)
  File "/opt/conda/envs/rapids/lib/python3.10/site-packages/distributed/nanny.py", line 990, in _run
    asyncio.run(run())
  File "/opt/conda/envs/rapids/lib/python3.10/asyncio/runners.py", line 44, in run
    return loop.run_until_complete(main)
  File "/opt/conda/envs/rapids/lib/python3.10/asyncio/base_events.py", line 636, in run_until_complete
    self.run_forever()
  File "/opt/conda/envs/rapids/lib/python3.10/asyncio/base_events.py", line 603, in run_forever
    self._run_once()
  File "/opt/conda/envs/rapids/lib/python3.10/asyncio/base_events.py", line 1871, in _run_once
    event_list = self._selector.select(timeout)
  File "/opt/conda/envs/rapids/lib/python3.10/selectors.py", line 469, in select
    fd_event_list = self._selector.poll(timeout, max_ev)
Keyboar