[I 2023-08-04 11:15:36,504] Trial 60 finished with value: 0.9123104949728662 and parameters: {'max_depth': 8, 'max_features': 0.22870524543228946, 'n_estimators': 460, 'criterion': 'entropy', 'min_samples_split': 94}. Best is trial 23 with value: 0.9225092310002317.
2023-08-04 11:15:37,783 - distributed.utils_perf - WARNING - full garbage collections took 10% CPU time recently (threshold: 10%)
2023-08-04 11:15:39,064 - distributed.utils_perf - WARNING - full garbage collections took 11% CPU time recently (threshold: 10%)
2023-08-04 11:15:40,810 - distributed.utils_perf - WARNING - full garbage collections took 12% CPU time recently (threshold: 10%)
2023-08-04 11:15:45,864 - distributed.utils_perf - WARNING - full garbage collections took 12% CPU time recently (threshold: 10%)
2023-08-04 11:16:21,839 - distributed.utils_perf - WARNING - full garbage collections took 12% CPU time recently (threshold: 10%)
2023-08-04 11:16:59,899 - distributed.utils_perf - WARNING - full garbage collections took 11% CPU time recently (threshold: 10%)
2023-08-04 11:17:37,059 - distributed.utils_perf - WARNING - full garbage collections took 11% CPU time recently (threshold: 10%)
2023-08-04 11:18:11,360 - distributed.utils_perf - WARNING - full garbage collections took 10% CPU time recently (threshold: 10%)
2023-08-04 11:19:30,459 - distributed.utils_perf - WARNING - full garbage collections took 11% CPU time recently (threshold: 10%)
2023-08-04 11:20:11,448 - distributed.utils_perf - WARNING - full garbage collections took 11% CPU time recently (threshold: 10%)
2023-08-04 11:20:47,262 - distributed.utils_perf - WARNING - full garbage collections took 11% CPU time recently (threshold: 10%)
2023-08-04 11:21:22,291 - distributed.utils_perf - WARNING - full garbage collections took 10% CPU time recently (threshold: 10%)
2023-08-04 11:22:50,087 - distributed.utils_perf - WARNING - full garbage collections took 10% CPU time recently (threshold: 10%)
2023-08-04 11:23:32,441 - distributed.utils_perf - WARNING - full garbage collections took 10% CPU time recently (threshold: 10%)
2023-08-04 11:24:11,553 - distributed.utils_perf - WARNING - full garbage collections took 10% CPU time recently (threshold: 10%)
[I 2023-08-04 12:09:32,445] Trial 61 finished with value: 0.9222631861201173 and parameters: {'max_depth': 15, 'max_features': 0.5914637237286565, 'n_estimators': 310, 'criterion': 'entropy', 'min_samples_split': 2}. Best is trial 23 with value: 0.9225092310002317.
[I 2023-08-04 12:25:27,088] Trial 62 finished with value: 0.9136776577111311 and parameters: {'max_depth': 6, 'max_features': 0.7710734734367465, 'n_estimators': 110, 'criterion': 'entropy', 'min_samples_split': 136}. Best is trial 23 with value: 0.9225092310002317.
[I 2023-08-04 12:48:45,806] Trial 63 finished with value: 0.9155947068637476 and parameters: {'max_depth': 12, 'max_features': 0.2697731208597798, 'n_estimators': 280, 'criterion': 'entropy', 'min_samples_split': 6}. Best is trial 23 with value: 0.9225092310002317.
2023-08-04 13:05:00,567 - distributed.utils_perf - WARNING - full garbage collections took 10% CPU time recently (threshold: 10%)
2023-08-04 13:05:05,555 - distributed.utils_perf - WARNING - full garbage collections took 10% CPU time recently (threshold: 10%)
2023-08-04 13:05:10,451 - distributed.utils_perf - WARNING - full garbage collections took 10% CPU time recently (threshold: 10%)
2023-08-04 13:06:02,871 - distributed.utils_perf - WARNING - full garbage collections took 10% CPU time recently (threshold: 10%)
2023-08-04 13:07:19,205 - distributed.utils_perf - WARNING - full garbage collections took 10% CPU time recently (threshold: 10%)
2023-08-04 13:10:26,325 - distributed.utils_perf - WARNING - full garbage collections took 10% CPU time recently (threshold: 10%)
2023-08-04 13:10:31,254 - distributed.utils_perf - WARNING - full garbage collections took 10% CPU time recently (threshold: 10%)
2023-08-04 13:11:24,136 - distributed.utils_perf - WARNING - full garbage collections took 10% CPU time recently (threshold: 10%)
2023-08-04 13:12:38,733 - distributed.utils_perf - WARNING - full garbage collections took 10% CPU time recently (threshold: 10%)
[I 2023-08-04 13:15:47,386] Trial 64 finished with value: 0.9135265350313156 and parameters: {'max_depth': 7, 'max_features': 0.3359557753956207, 'n_estimators': 400, 'criterion': 'gini', 'min_samples_split': 41}. Best is trial 23 with value: 0.9225092310002317.
2023-08-04 13:15:50,872 - distributed.utils_perf - WARNING - full garbage collections took 10% CPU time recently (threshold: 10%)
2023-08-04 13:15:53,501 - distributed.utils_perf - WARNING - full garbage collections took 10% CPU time recently (threshold: 10%)
2023-08-04 13:15:58,251 - distributed.utils_perf - WARNING - full garbage collections took 10% CPU time recently (threshold: 10%)
2023-08-04 13:16:45,215 - distributed.utils_perf - WARNING - full garbage collections took 10% CPU time recently (threshold: 10%)
2023-08-04 13:17:26,479 - distributed.utils_perf - WARNING - full garbage collections took 10% CPU time recently (threshold: 10%)
[I 2023-08-04 13:46:12,870] Trial 65 finished with value: 0.9146694511470471 and parameters: {'max_depth': 7, 'max_features': 0.8187438202841891, 'n_estimators': 220, 'criterion': 'entropy', 'min_samples_split': 362}. Best is trial 23 with value: 0.9225092310002317.
[I 2023-08-04 14:36:17,331] Trial 66 finished with value: 0.9163344630944807 and parameters: {'max_depth': 9, 'max_features': 0.774872479653529, 'n_estimators': 300, 'criterion': 'entropy', 'min_samples_split': 280}. Best is trial 23 with value: 0.9225092310002317.
2023-08-04 14:54:53,264 - distributed.utils_perf - WARNING - full garbage collections took 10% CPU time recently (threshold: 10%)
2023-08-04 14:56:15,015 - distributed.utils_perf - WARNING - full garbage collections took 10% CPU time recently (threshold: 10%)
2023-08-04 14:57:46,091 - distributed.utils_perf - WARNING - full garbage collections took 10% CPU time recently (threshold: 10%)
2023-08-04 14:58:07,234 - distributed.utils_perf - WARNING - full garbage collections took 10% CPU time recently (threshold: 10%)
[I 2023-08-04 15:04:03,187] Trial 67 finished with value: 0.9132800753184596 and parameters: {'max_depth': 5, 'max_features': 0.7384485261081656, 'n_estimators': 290, 'criterion': 'gini', 'min_samples_split': 9}. Best is trial 23 with value: 0.9225092310002317.
2023-08-04 15:06:33,363 - distributed.utils_perf - WARNING - full garbage collections took 10% CPU time recently (threshold: 10%)
2023-08-04 15:07:10,798 - distributed.utils_perf - WARNING - full garbage collections took 10% CPU time recently (threshold: 10%)
2023-08-04 15:10:16,585 - distributed.utils_perf - WARNING - full garbage collections took 10% CPU time recently (threshold: 10%)
2023-08-04 15:10:47,621 - distributed.utils_perf - WARNING - full garbage collections took 10% CPU time recently (threshold: 10%)
2023-08-04 15:10:49,441 - distributed.utils_perf - WARNING - full garbage collections took 10% CPU time recently (threshold: 10%)
2023-08-04 15:10:50,599 - distributed.utils_perf - WARNING - full garbage collections took 10% CPU time recently (threshold: 10%)
2023-08-04 15:10:53,353 - distributed.utils_perf - WARNING - full garbage collections took 10% CPU time recently (threshold: 10%)
2023-08-04 15:10:57,805 - distributed.utils_perf - WARNING - full garbage collections took 10% CPU time recently (threshold: 10%)
2023-08-04 15:11:32,607 - distributed.utils_perf - WARNING - full garbage collections took 11% CPU time recently (threshold: 10%)
2023-08-04 15:12:30,533 - distributed.utils_perf - WARNING - full garbage collections took 11% CPU time recently (threshold: 10%)
2023-08-04 15:12:53,032 - distributed.utils_perf - WARNING - full garbage collections took 10% CPU time recently (threshold: 10%)
2023-08-04 15:13:00,382 - distributed.utils_perf - WARNING - full garbage collections took 11% CPU time recently (threshold: 10%)
2023-08-04 15:13:02,280 - distributed.utils_perf - WARNING - full garbage collections took 12% CPU time recently (threshold: 10%)
2023-08-04 15:13:03,452 - distributed.utils_perf - WARNING - full garbage collections took 12% CPU time recently (threshold: 10%)
2023-08-04 15:13:06,333 - distributed.utils_perf - WARNING - full garbage collections took 12% CPU time recently (threshold: 10%)
2023-08-04 15:13:10,769 - distributed.utils_perf - WARNING - full garbage collections took 12% CPU time recently (threshold: 10%)
2023-08-04 15:13:45,287 - distributed.utils_perf - WARNING - full garbage collections took 13% CPU time recently (threshold: 10%)
2023-08-04 15:14:41,351 - distributed.utils_perf - WARNING - full garbage collections took 13% CPU time recently (threshold: 10%)
2023-08-04 15:15:05,556 - distributed.utils_perf - WARNING - full garbage collections took 12% CPU time recently (threshold: 10%)
2023-08-04 15:15:11,759 - distributed.utils_perf - WARNING - full garbage collections took 12% CPU time recently (threshold: 10%)
[I 2023-08-04 15:15:12,476] Trial 68 finished with value: 0.9123510556409187 and parameters: {'max_depth': 5, 'max_features': 0.4857569457974079, 'n_estimators': 140, 'criterion': 'entropy', 'min_samples_split': 139}. Best is trial 23 with value: 0.9225092310002317.
2023-08-04 15:15:13,729 - distributed.utils_perf - WARNING - full garbage collections took 12% CPU time recently (threshold: 10%)
2023-08-04 15:15:15,007 - distributed.utils_perf - WARNING - full garbage collections took 12% CPU time recently (threshold: 10%)
2023-08-04 15:15:16,118 - distributed.utils_perf - WARNING - full garbage collections took 12% CPU time recently (threshold: 10%)
2023-08-04 15:15:21,008 - distributed.utils_perf - WARNING - full garbage collections took 12% CPU time recently (threshold: 10%)
2023-08-04 15:15:26,160 - distributed.utils_perf - WARNING - full garbage collections took 12% CPU time recently (threshold: 10%)
2023-08-04 15:16:27,691 - distributed.utils_perf - WARNING - full garbage collections took 12% CPU time recently (threshold: 10%)
2023-08-04 15:17:09,363 - distributed.utils_perf - WARNING - full garbage collections took 12% CPU time recently (threshold: 10%)
2023-08-04 15:18:35,263 - distributed.utils_perf - WARNING - full garbage collections took 12% CPU time recently (threshold: 10%)
2023-08-04 15:19:12,339 - distributed.utils_perf - WARNING - full garbage collections took 11% CPU time recently (threshold: 10%)
2023-08-04 15:20:34,044 - distributed.utils_perf - WARNING - full garbage collections took 11% CPU time recently (threshold: 10%)
2023-08-04 15:21:15,143 - distributed.utils_perf - WARNING - full garbage collections took 11% CPU time recently (threshold: 10%)
2023-08-04 15:22:26,353 - distributed.utils_perf - WARNING - full garbage collections took 10% CPU time recently (threshold: 10%)
2023-08-04 15:23:18,609 - distributed.utils_perf - WARNING - full garbage collections took 10% CPU time recently (threshold: 10%)
2023-08-04 15:24:27,141 - distributed.utils_perf - WARNING - full garbage collections took 10% CPU time recently (threshold: 10%)
2023-08-04 15:24:46,909 - distributed.utils_perf - WARNING - full garbage collections took 10% CPU time recently (threshold: 10%)
2023-08-04 15:25:06,727 - distributed.utils_perf - WARNING - full garbage collections took 10% CPU time recently (threshold: 10%)
2023-08-04 15:26:40,057 - distributed.utils_perf - WARNING - full garbage collections took 10% CPU time recently (threshold: 10%)
[I 2023-08-04 16:07:21,040] Trial 69 finished with value: 0.9185118746082714 and parameters: {'max_depth': 13, 'max_features': 0.40820870785916785, 'n_estimators': 440, 'criterion': 'entropy', 'min_samples_split': 88}. Best is trial 23 with value: 0.9225092310002317.
2023-08-04 16:11:09,902 - distributed.utils_perf - WARNING - full garbage collections took 10% CPU time recently (threshold: 10%)
2023-08-04 16:11:16,419 - distributed.utils_perf - WARNING - full garbage collections took 10% CPU time recently (threshold: 10%)
2023-08-04 16:12:13,078 - distributed.utils_perf - WARNING - full garbage collections took 10% CPU time recently (threshold: 10%)
2023-08-04 16:12:16,126 - distributed.utils_perf - WARNING - full garbage collections took 10% CPU time recently (threshold: 10%)
2023-08-04 16:12:17,781 - distributed.utils_perf - WARNING - full garbage collections took 10% CPU time recently (threshold: 10%)
2023-08-04 16:12:19,046 - distributed.utils_perf - WARNING - full garbage collections took 11% CPU time recently (threshold: 10%)
2023-08-04 16:12:23,040 - distributed.utils_perf - WARNING - full garbage collections took 11% CPU time recently (threshold: 10%)
2023-08-04 16:12:28,777 - distributed.utils_perf - WARNING - full garbage collections took 11% CPU time recently (threshold: 10%)
2023-08-04 16:13:11,472 - distributed.utils_perf - WARNING - full garbage collections took 11% CPU time recently (threshold: 10%)
2023-08-04 16:13:28,110 - distributed.utils_perf - WARNING - full garbage collections took 11% CPU time recently (threshold: 10%)
[I 2023-08-04 16:13:29,910] Trial 70 finished with value: 0.9119575398603723 and parameters: {'max_depth': 6, 'max_features': 0.17054820986945318, 'n_estimators': 100, 'criterion': 'entropy', 'min_samples_split': 3}. Best is trial 23 with value: 0.9225092310002317.
2023-08-04 16:13:30,837 - distributed.utils_perf - WARNING - full garbage collections took 11% CPU time recently (threshold: 10%)
2023-08-04 16:13:32,178 - distributed.utils_perf - WARNING - full garbage collections took 12% CPU time recently (threshold: 10%)
2023-08-04 16:13:33,444 - distributed.utils_perf - WARNING - full garbage collections took 12% CPU time recently (threshold: 10%)
2023-08-04 16:13:35,845 - distributed.utils_perf - WARNING - full garbage collections took 13% CPU time recently (threshold: 10%)
2023-08-04 16:13:40,687 - distributed.utils_perf - WARNING - full garbage collections took 13% CPU time recently (threshold: 10%)
2023-08-04 16:14:26,231 - distributed.utils_perf - WARNING - full garbage collections took 14% CPU time recently (threshold: 10%)
2023-08-04 16:15:08,709 - distributed.utils_perf - WARNING - full garbage collections took 14% CPU time recently (threshold: 10%)
2023-08-04 16:16:23,691 - distributed.utils_perf - WARNING - full garbage collections took 13% CPU time recently (threshold: 10%)
2023-08-04 16:17:33,001 - distributed.utils_perf - WARNING - full garbage collections took 12% CPU time recently (threshold: 10%)
2023-08-04 16:17:53,371 - distributed.utils_perf - WARNING - full garbage collections took 12% CPU time recently (threshold: 10%)
2023-08-04 16:18:13,216 - distributed.utils_perf - WARNING - full garbage collections took 12% CPU time recently (threshold: 10%)
2023-08-04 16:18:38,195 - distributed.utils_perf - WARNING - full garbage collections took 11% CPU time recently (threshold: 10%)
2023-08-04 16:18:42,064 - distributed.utils_perf - WARNING - full garbage collections took 11% CPU time recently (threshold: 10%)
2023-08-04 16:18:43,729 - distributed.utils_perf - WARNING - full garbage collections took 11% CPU time recently (threshold: 10%)
2023-08-04 16:18:45,127 - distributed.utils_perf - WARNING - full garbage collections took 12% CPU time recently (threshold: 10%)
2023-08-04 16:18:49,535 - distributed.utils_perf - WARNING - full garbage collections took 12% CPU time recently (threshold: 10%)
2023-08-04 16:18:55,021 - distributed.utils_perf - WARNING - full garbage collections took 12% CPU time recently (threshold: 10%)
2023-08-04 16:19:39,028 - distributed.utils_perf - WARNING - full garbage collections took 12% CPU time recently (threshold: 10%)
2023-08-04 16:20:20,376 - distributed.utils_perf - WARNING - full garbage collections took 11% CPU time recently (threshold: 10%)
2023-08-04 16:21:38,892 - distributed.utils_perf - WARNING - full garbage collections took 11% CPU time recently (threshold: 10%)
2023-08-04 16:22:14,544 - distributed.utils_perf - WARNING - full garbage collections took 11% CPU time recently (threshold: 10%)
2023-08-04 16:23:09,985 - distributed.utils_perf - WARNING - full garbage collections took 11% CPU time recently (threshold: 10%)
2023-08-04 16:23:30,151 - distributed.utils_perf - WARNING - full garbage collections took 10% CPU time recently (threshold: 10%)
2023-08-04 16:23:51,104 - distributed.utils_perf - WARNING - full garbage collections took 10% CPU time recently (threshold: 10%)
2023-08-04 16:24:08,779 - distributed.utils_perf - WARNING - full garbage collections took 10% CPU time recently (threshold: 10%)
2023-08-04 16:24:11,625 - distributed.utils_perf - WARNING - full garbage collections took 10% CPU time recently (threshold: 10%)
2023-08-04 16:24:16,153 - distributed.utils_perf - WARNING - full garbage collections took 10% CPU time recently (threshold: 10%)
2023-08-04 16:25:00,212 - distributed.utils_perf - WARNING - full garbage collections took 10% CPU time recently (threshold: 10%)
2023-08-04 16:25:39,263 - distributed.utils_perf - WARNING - full garbage collections took 10% CPU time recently (threshold: 10%)
[I 2023-08-04 16:40:14,908] Trial 71 finished with value: 0.9132547182395596 and parameters: {'max_depth': 5, 'max_features': 0.7793753332514206, 'n_estimators': 260, 'criterion': 'gini', 'min_samples_split': 28}. Best is trial 23 with value: 0.9225092310002317.
[I 2023-08-04 17:29:00,296] Trial 72 finished with value: 0.9164632473458756 and parameters: {'max_depth': 10, 'max_features': 0.5266035339059747, 'n_estimators': 420, 'criterion': 'entropy', 'min_samples_split': 2}. Best is trial 23 with value: 0.9225092310002317.
[I 2023-08-04 17:53:15,275] Trial 73 finished with value: 0.9144323713957678 and parameters: {'max_depth': 13, 'max_features': 0.21307724302396494, 'n_estimators': 350, 'criterion': 'entropy', 'min_samples_split': 2}. Best is trial 23 with value: 0.9225092310002317.
[I 2023-08-04 19:40:31,458] Trial 74 finished with value: 0.9240477087189687 and parameters: {'max_depth': 15, 'max_features': 0.9148618303325002, 'n_estimators': 420, 'criterion': 'gini', 'min_samples_split': 4}. Best is trial 74 with value: 0.9240477087189687.
[I 2023-08-04 20:32:06,030] Trial 75 finished with value: 0.914616762700423 and parameters: {'max_depth': 7, 'max_features': 0.660246312069929, 'n_estimators': 470, 'criterion': 'gini', 'min_samples_split': 175}. Best is trial 74 with value: 0.9240477087189687.
[I 2023-08-04 21:01:14,914] Trial 76 finished with value: 0.9200612740400846 and parameters: {'max_depth': 15, 'max_features': 0.4607863591340088, 'n_estimators': 200, 'criterion': 'gini', 'min_samples_split': 296}. Best is trial 74 with value: 0.9240477087189687.
2023-08-04 21:11:24,877 - distributed.utils_perf - WARNING - full garbage collections took 10% CPU time recently (threshold: 10%)
2023-08-04 21:11:27,085 - distributed.utils_perf - WARNING - full garbage collections took 10% CPU time recently (threshold: 10%)
2023-08-04 21:11:31,335 - distributed.utils_perf - WARNING - full garbage collections took 10% CPU time recently (threshold: 10%)
2023-08-04 21:11:39,702 - distributed.utils_perf - WARNING - full garbage collections took 10% CPU time recently (threshold: 10%)
2023-08-04 21:16:32,262 - distributed.utils_perf - WARNING - full garbage collections took 10% CPU time recently (threshold: 10%)
2023-08-04 21:16:36,743 - distributed.utils_perf - WARNING - full garbage collections took 10% CPU time recently (threshold: 10%)
2023-08-04 21:16:41,983 - distributed.utils_perf - WARNING - full garbage collections took 11% CPU time recently (threshold: 10%)
2023-08-04 21:17:29,573 - distributed.utils_perf - WARNING - full garbage collections took 11% CPU time recently (threshold: 10%)
2023-08-04 21:19:24,840 - distributed.utils_perf - WARNING - full garbage collections took 10% CPU time recently (threshold: 10%)
2023-08-04 21:21:05,080 - distributed.utils_perf - WARNING - full garbage collections took 10% CPU time recently (threshold: 10%)
2023-08-04 21:21:32,026 - distributed.utils_perf - WARNING - full garbage collections took 10% CPU time recently (threshold: 10%)
2023-08-04 21:21:33,275 - distributed.utils_perf - WARNING - full garbage collections took 10% CPU time recently (threshold: 10%)
2023-08-04 21:21:37,703 - distributed.utils_perf - WARNING - full garbage collections took 10% CPU time recently (threshold: 10%)
2023-08-04 21:21:43,464 - distributed.utils_perf - WARNING - full garbage collections took 11% CPU time recently (threshold: 10%)
2023-08-04 21:22:28,011 - distributed.utils_perf - WARNING - full garbage collections took 10% CPU time recently (threshold: 10%)
2023-08-04 21:23:50,068 - distributed.utils_perf - WARNING - full garbage collections took 10% CPU time recently (threshold: 10%)
2023-08-04 21:25:44,948 - distributed.utils_perf - WARNING - full garbage collections took 10% CPU time recently (threshold: 10%)
