[I 2023-08-02 20:25:02,979] A new study created in memory with name: no-name-a7993cdd-fe0a-483f-a026-e552e9463b21
[I 2023-08-02 20:43:24,807] Trial 0 finished with value: 0.9165534054870713 and parameters: {'max_depth': 9, 'max_features': 0.7482920440979423, 'n_estimators': 100, 'criterion': 'gini', 'min_samples_split': 3}. Best is trial 0 with value: 0.9165534054870713.
[I 2023-08-02 21:04:47,638] Trial 1 finished with value: 0.9139851336573394 and parameters: {'max_depth': 7, 'max_features': 0.411004654338743, 'n_estimators': 260, 'criterion': 'gini', 'min_samples_split': 129}. Best is trial 0 with value: 0.9165534054870713.
[I 2023-08-02 21:23:24,992] Trial 2 finished with value: 0.9145999327667773 and parameters: {'max_depth': 7, 'max_features': 0.8903056927518509, 'n_estimators': 110, 'criterion': 'gini', 'min_samples_split': 57}. Best is trial 0 with value: 0.9165534054870713.
[I 2023-08-02 21:44:34,347] Trial 3 finished with value: 0.9129097210644179 and parameters: {'max_depth': 6, 'max_features': 0.2782913401763909, 'n_estimators': 420, 'criterion': 'gini', 'min_samples_split': 135}. Best is trial 0 with value: 0.9165534054870713.
[I 2023-08-02 22:18:05,154] Trial 4 finished with value: 0.921711563208856 and parameters: {'max_depth': 14, 'max_features': 0.9051459971534626, 'n_estimators': 130, 'criterion': 'entropy', 'min_samples_split': 453}. Best is trial 4 with value: 0.921711563208856.
[I 2023-08-02 22:56:52,502] Trial 5 finished with value: 0.9132006898755882 and parameters: {'max_depth': 6, 'max_features': 0.478996862504547, 'n_estimators': 490, 'criterion': 'entropy', 'min_samples_split': 12}. Best is trial 4 with value: 0.921711563208856.
[I 2023-08-02 23:23:19,858] Trial 6 finished with value: 0.91974113734914 and parameters: {'max_depth': 12, 'max_features': 0.8511631047076356, 'n_estimators': 100, 'criterion': 'entropy', 'min_samples_split': 195}. Best is trial 4 with value: 0.921711563208856.
[I 2023-08-02 23:45:48,392] Trial 7 finished with value: 0.9154218589211112 and parameters: {'max_depth': 8, 'max_features': 0.8103513956063396, 'n_estimators': 140, 'criterion': 'entropy', 'min_samples_split': 10}. Best is trial 4 with value: 0.921711563208856.
[I 2023-08-02 23:52:55,524] Trial 8 finished with value: 0.9130837245388495 and parameters: {'max_depth': 8, 'max_features': 0.2170257149064499, 'n_estimators': 100, 'criterion': 'gini', 'min_samples_split': 8}. Best is trial 4 with value: 0.921711563208856.
2023-08-02 23:53:42,625 - distributed.utils_perf - WARNING - full garbage collections took 10% CPU time recently (threshold: 10%)
2023-08-02 23:55:19,297 - distributed.utils_perf - WARNING - full garbage collections took 10% CPU time recently (threshold: 10%)
2023-08-02 23:55:55,994 - distributed.utils_perf - WARNING - full garbage collections took 10% CPU time recently (threshold: 10%)
2023-08-02 23:56:00,244 - distributed.utils_perf - WARNING - full garbage collections took 10% CPU time recently (threshold: 10%)
2023-08-02 23:56:01,852 - distributed.utils_perf - WARNING - full garbage collections took 11% CPU time recently (threshold: 10%)
2023-08-02 23:56:03,007 - distributed.utils_perf - WARNING - full garbage collections took 11% CPU time recently (threshold: 10%)
2023-08-02 23:56:07,686 - distributed.utils_perf - WARNING - full garbage collections took 11% CPU time recently (threshold: 10%)
2023-08-02 23:56:12,554 - distributed.utils_perf - WARNING - full garbage collections took 11% CPU time recently (threshold: 10%)
2023-08-02 23:56:59,338 - distributed.utils_perf - WARNING - full garbage collections took 11% CPU time recently (threshold: 10%)
2023-08-02 23:58:52,179 - distributed.utils_perf - WARNING - full garbage collections took 10% CPU time recently (threshold: 10%)
2023-08-02 23:59:06,170 - distributed.utils_perf - WARNING - full garbage collections took 10% CPU time recently (threshold: 10%)
2023-08-02 23:59:09,990 - distributed.utils_perf - WARNING - full garbage collections took 10% CPU time recently (threshold: 10%)
2023-08-02 23:59:11,184 - distributed.utils_perf - WARNING - full garbage collections took 10% CPU time recently (threshold: 10%)
2023-08-02 23:59:12,505 - distributed.utils_perf - WARNING - full garbage collections took 10% CPU time recently (threshold: 10%)
2023-08-02 23:59:17,100 - distributed.utils_perf - WARNING - full garbage collections took 10% CPU time recently (threshold: 10%)
2023-08-02 23:59:22,280 - distributed.utils_perf - WARNING - full garbage collections took 10% CPU time recently (threshold: 10%)
2023-08-03 00:00:38,223 - distributed.utils_perf - WARNING - full garbage collections took 11% CPU time recently (threshold: 10%)
2023-08-03 00:02:00,960 - distributed.utils_perf - WARNING - full garbage collections took 10% CPU time recently (threshold: 10%)
2023-08-03 00:02:11,560 - distributed.utils_perf - WARNING - full garbage collections took 10% CPU time recently (threshold: 10%)
2023-08-03 00:02:15,425 - distributed.utils_perf - WARNING - full garbage collections took 10% CPU time recently (threshold: 10%)
2023-08-03 00:02:16,590 - distributed.utils_perf - WARNING - full garbage collections took 10% CPU time recently (threshold: 10%)
2023-08-03 00:02:18,697 - distributed.utils_perf - WARNING - full garbage collections took 10% CPU time recently (threshold: 10%)
2023-08-03 00:02:23,249 - distributed.utils_perf - WARNING - full garbage collections took 10% CPU time recently (threshold: 10%)
2023-08-03 00:02:29,788 - distributed.utils_perf - WARNING - full garbage collections took 10% CPU time recently (threshold: 10%)
2023-08-03 00:03:49,199 - distributed.utils_perf - WARNING - full garbage collections took 10% CPU time recently (threshold: 10%)
2023-08-03 00:05:10,193 - distributed.utils_perf - WARNING - full garbage collections took 10% CPU time recently (threshold: 10%)
2023-08-03 00:05:20,237 - distributed.utils_perf - WARNING - full garbage collections took 10% CPU time recently (threshold: 10%)
2023-08-03 00:05:22,139 - distributed.utils_perf - WARNING - full garbage collections took 10% CPU time recently (threshold: 10%)
2023-08-03 00:05:23,144 - distributed.utils_perf - WARNING - full garbage collections took 10% CPU time recently (threshold: 10%)
2023-08-03 00:05:25,215 - distributed.utils_perf - WARNING - full garbage collections took 10% CPU time recently (threshold: 10%)
2023-08-03 00:05:29,674 - distributed.utils_perf - WARNING - full garbage collections took 10% CPU time recently (threshold: 10%)
2023-08-03 00:05:43,312 - distributed.utils_perf - WARNING - full garbage collections took 10% CPU time recently (threshold: 10%)
2023-08-03 00:07:02,454 - distributed.utils_perf - WARNING - full garbage collections took 10% CPU time recently (threshold: 10%)
2023-08-03 00:08:19,021 - distributed.utils_perf - WARNING - full garbage collections took 10% CPU time recently (threshold: 10%)
2023-08-03 00:08:27,906 - distributed.utils_perf - WARNING - full garbage collections took 10% CPU time recently (threshold: 10%)
[I 2023-08-03 00:08:28,634] Trial 9 finished with value: 0.9125725470121011 and parameters: {'max_depth': 10, 'max_features': 0.14802629060537237, 'n_estimators': 330, 'criterion': 'entropy', 'min_samples_split': 142}. Best is trial 4 with value: 0.921711563208856.
2023-08-03 00:08:29,645 - distributed.utils_perf - WARNING - full garbage collections took 10% CPU time recently (threshold: 10%)
2023-08-03 00:08:30,982 - distributed.utils_perf - WARNING - full garbage collections took 10% CPU time recently (threshold: 10%)
2023-08-03 00:08:31,925 - distributed.utils_perf - WARNING - full garbage collections took 10% CPU time recently (threshold: 10%)
2023-08-03 00:08:35,924 - distributed.utils_perf - WARNING - full garbage collections took 10% CPU time recently (threshold: 10%)
2023-08-03 00:08:41,291 - distributed.utils_perf - WARNING - full garbage collections took 10% CPU time recently (threshold: 10%)
2023-08-03 00:09:27,952 - distributed.utils_perf - WARNING - full garbage collections took 11% CPU time recently (threshold: 10%)
2023-08-03 00:10:43,087 - distributed.utils_perf - WARNING - full garbage collections took 11% CPU time recently (threshold: 10%)
2023-08-03 00:11:24,489 - distributed.utils_perf - WARNING - full garbage collections took 10% CPU time recently (threshold: 10%)
2023-08-03 00:12:50,684 - distributed.utils_perf - WARNING - full garbage collections took 10% CPU time recently (threshold: 10%)
2023-08-03 00:14:26,249 - distributed.utils_perf - WARNING - full garbage collections took 10% CPU time recently (threshold: 10%)
2023-08-03 00:14:27,300 - distributed.utils_perf - WARNING - full garbage collections took 10% CPU time recently (threshold: 10%)
2023-08-03 00:14:29,493 - distributed.utils_perf - WARNING - full garbage collections took 10% CPU time recently (threshold: 10%)
2023-08-03 00:14:33,598 - distributed.utils_perf - WARNING - full garbage collections took 10% CPU time recently (threshold: 10%)
2023-08-03 00:14:40,255 - distributed.utils_perf - WARNING - full garbage collections took 10% CPU time recently (threshold: 10%)
2023-08-03 00:16:57,192 - distributed.utils_perf - WARNING - full garbage collections took 10% CPU time recently (threshold: 10%)
[I 2023-08-03 00:38:23,681] Trial 10 finished with value: 0.9135472742900529 and parameters: {'max_depth': 6, 'max_features': 0.4726503890376115, 'n_estimators': 380, 'criterion': 'gini', 'min_samples_split': 49}. Best is trial 4 with value: 0.921711563208856.
[I 2023-08-03 01:49:09,890] Trial 11 finished with value: 0.9187308786599594 and parameters: {'max_depth': 12, 'max_features': 0.5634002008524778, 'n_estimators': 480, 'criterion': 'entropy', 'min_samples_split': 4}. Best is trial 4 with value: 0.921711563208856.
[I 2023-08-03 02:20:07,481] Trial 12 finished with value: 0.9136098182175824 and parameters: {'max_depth': 6, 'max_features': 0.8266521598385714, 'n_estimators': 260, 'criterion': 'entropy', 'min_samples_split': 14}. Best is trial 4 with value: 0.921711563208856.
[I 2023-08-03 03:46:42,261] Trial 13 finished with value: 0.920644276523206 and parameters: {'max_depth': 13, 'max_features': 0.7533981868154063, 'n_estimators': 460, 'criterion': 'entropy', 'min_samples_split': 15}. Best is trial 4 with value: 0.921711563208856.
[I 2023-08-03 04:25:40,131] Trial 14 finished with value: 0.9145813673757559 and parameters: {'max_depth': 7, 'max_features': 0.9062975963764601, 'n_estimators': 270, 'criterion': 'gini', 'min_samples_split': 85}. Best is trial 4 with value: 0.921711563208856.
[I 2023-08-03 05:03:53,183] Trial 15 finished with value: 0.913768192212598 and parameters: {'max_depth': 6, 'max_features': 0.9545403328363641, 'n_estimators': 280, 'criterion': 'gini', 'min_samples_split': 7}. Best is trial 4 with value: 0.921711563208856.
[I 2023-08-03 05:27:31,155] Trial 16 finished with value: 0.9217127688471397 and parameters: {'max_depth': 14, 'max_features': 0.6163115380050572, 'n_estimators': 100, 'criterion': 'gini', 'min_samples_split': 46}. Best is trial 16 with value: 0.9217127688471397.
[I 2023-08-03 06:26:39,635] Trial 17 finished with value: 0.9188593597652307 and parameters: {'max_depth': 14, 'max_features': 0.42154278400224976, 'n_estimators': 470, 'criterion': 'gini', 'min_samples_split': 632}. Best is trial 16 with value: 0.9217127688471397.
[I 2023-08-03 07:07:03,131] Trial 18 finished with value: 0.9199639843811326 and parameters: {'max_depth': 12, 'max_features': 0.9975905654063324, 'n_estimators': 170, 'criterion': 'entropy', 'min_samples_split': 139}. Best is trial 16 with value: 0.9217127688471397.
[I 2023-08-03 07:47:28,991] Trial 19 finished with value: 0.9132641177677916 and parameters: {'max_depth': 5, 'max_features': 0.7799167473422197, 'n_estimators': 400, 'criterion': 'gini', 'min_samples_split': 3}. Best is trial 16 with value: 0.9217127688471397.
2023-08-03 07:51:38,586 - distributed.utils_perf - WARNING - full garbage collections took 10% CPU time recently (threshold: 10%)
2023-08-03 07:51:39,715 - distributed.utils_perf - WARNING - full garbage collections took 10% CPU time recently (threshold: 10%)
2023-08-03 07:51:44,894 - distributed.utils_perf - WARNING - full garbage collections took 10% CPU time recently (threshold: 10%)
2023-08-03 07:51:49,760 - distributed.utils_perf - WARNING - full garbage collections took 10% CPU time recently (threshold: 10%)
2023-08-03 07:52:36,591 - distributed.utils_perf - WARNING - full garbage collections took 10% CPU time recently (threshold: 10%)
2023-08-03 07:52:39,427 - distributed.utils_perf - WARNING - full garbage collections took 10% CPU time recently (threshold: 10%)
[I 2023-08-03 07:52:39,683] Trial 20 finished with value: 0.9124343373081377 and parameters: {'max_depth': 5, 'max_features': 0.12358988818994736, 'n_estimators': 110, 'criterion': 'entropy', 'min_samples_split': 50}. Best is trial 16 with value: 0.9217127688471397.
2023-08-03 07:52:40,967 - distributed.utils_perf - WARNING - full garbage collections took 10% CPU time recently (threshold: 10%)
2023-08-03 07:52:42,026 - distributed.utils_perf - WARNING - full garbage collections took 10% CPU time recently (threshold: 10%)
2023-08-03 07:52:44,414 - distributed.utils_perf - WARNING - full garbage collections took 10% CPU time recently (threshold: 10%)
2023-08-03 07:52:49,364 - distributed.utils_perf - WARNING - full garbage collections took 10% CPU time recently (threshold: 10%)
2023-08-03 07:53:24,911 - distributed.utils_perf - WARNING - full garbage collections took 10% CPU time recently (threshold: 10%)
2023-08-03 07:54:02,534 - distributed.utils_perf - WARNING - full garbage collections took 10% CPU time recently (threshold: 10%)
2023-08-03 07:54:38,954 - distributed.utils_perf - WARNING - full garbage collections took 10% CPU time recently (threshold: 10%)
2023-08-03 07:55:14,694 - distributed.utils_perf - WARNING - full garbage collections took 10% CPU time recently (threshold: 10%)
2023-08-03 07:55:52,881 - distributed.utils_perf - WARNING - full garbage collections took 10% CPU time recently (threshold: 10%)
2023-08-03 07:56:51,985 - distributed.utils_perf - WARNING - full garbage collections took 10% CPU time recently (threshold: 10%)
2023-08-03 07:57:12,868 - distributed.utils_perf - WARNING - full garbage collections took 10% CPU time recently (threshold: 10%)
2023-08-03 07:57:32,227 - distributed.utils_perf - WARNING - full garbage collections took 11% CPU time recently (threshold: 10%)
2023-08-03 07:57:52,883 - distributed.utils_perf - WARNING - full garbage collections took 10% CPU time recently (threshold: 10%)
2023-08-03 07:58:11,166 - distributed.utils_perf - WARNING - full garbage collections took 10% CPU time recently (threshold: 10%)
[I 2023-08-03 08:25:02,395] Trial 21 finished with value: 0.918371204909976 and parameters: {'max_depth': 11, 'max_features': 0.8578278031236451, 'n_estimators': 150, 'criterion': 'entropy', 'min_samples_split': 821}. Best is trial 16 with value: 0.9217127688471397.
2023-08-03 08:41:57,127 - distributed.utils_perf - WARNING - full garbage collections took 10% CPU time recently (threshold: 10%)
2023-08-03 08:43:36,389 - distributed.utils_perf - WARNING - full garbage collections took 10% CPU time recently (threshold: 10%)
[I 2023-08-03 08:44:57,865] Trial 22 finished with value: 0.9127167383048503 and parameters: {'max_depth': 11, 'max_features': 0.11678256043564872, 'n_estimators': 420, 'criterion': 'entropy', 'min_samples_split': 19}. Best is trial 16 with value: 0.9217127688471397.
2023-08-03 08:45:08,838 - distributed.utils_perf - WARNING - full garbage collections took 10% CPU time recently (threshold: 10%)
2023-08-03 08:45:57,310 - distributed.utils_perf - WARNING - full garbage collections took 10% CPU time recently (threshold: 10%)
2023-08-03 08:46:39,225 - distributed.utils_perf - WARNING - full garbage collections took 10% CPU time recently (threshold: 10%)
[I 2023-08-03 09:57:09,874] Trial 23 finished with value: 0.9225092310002317 and parameters: {'max_depth': 14, 'max_features': 0.7724094784634662, 'n_estimators': 320, 'criterion': 'gini', 'min_samples_split': 3}. Best is trial 23 with value: 0.9225092310002317.
[I 2023-08-03 10:05:25,883] Trial 24 finished with value: 0.9126248520448021 and parameters: {'max_depth': 5, 'max_features': 0.19674471619548362, 'n_estimators': 190, 'criterion': 'gini', 'min_samples_split': 2}. Best is trial 23 with value: 0.9225092310002317.
2023-08-03 10:06:25,183 - distributed.utils_perf - WARNING - full garbage collections took 10% CPU time recently (threshold: 10%)
2023-08-03 10:07:07,555 - distributed.utils_perf - WARNING - full garbage collections took 10% CPU time recently (threshold: 10%)
2023-08-03 10:08:29,219 - distributed.utils_perf - WARNING - full garbage collections took 10% CPU time recently (threshold: 10%)
2023-08-03 10:09:06,909 - distributed.utils_perf - WARNING - full garbage collections took 11% CPU time recently (threshold: 10%)
2023-08-03 10:10:36,228 - distributed.utils_perf - WARNING - full garbage collections took 11% CPU time recently (threshold: 10%)
2023-08-03 10:11:22,852 - distributed.utils_perf - WARNING - full garbage collections took 11% CPU time recently (threshold: 10%)
2023-08-03 10:12:13,117 - distributed.utils_perf - WARNING - full garbage collections took 10% CPU time recently (threshold: 10%)
2023-08-03 10:12:34,542 - distributed.utils_perf - WARNING - full garbage collections took 10% CPU time recently (threshold: 10%)
2023-08-03 10:13:02,041 - distributed.utils_perf - WARNING - full garbage collections took 10% CPU time recently (threshold: 10%)
2023-08-03 10:13:06,323 - distributed.utils_perf - WARNING - full garbage collections took 10% CPU time recently (threshold: 10%)
2023-08-03 10:13:08,766 - distributed.utils_perf - WARNING - full garbage collections took 10% CPU time recently (threshold: 10%)
2023-08-03 10:13:13,588 - distributed.utils_perf - WARNING - full garbage collections took 10% CPU time recently (threshold: 10%)
2023-08-03 10:14:36,807 - distributed.utils_perf - WARNING - full garbage collections took 10% CPU time recently (threshold: 10%)
[I 2023-08-03 10:44:44,013] Trial 25 finished with value: 0.913043667797494 and parameters: {'max_depth': 5, 'max_features': 0.9705486970002448, 'n_estimators': 330, 'criterion': 'entropy', 'min_samples_split': 189}. Best is trial 23 with value: 0.9225092310002317.
[I 2023-08-03 11:38:13,111] Trial 26 finished with value: 0.9146280327328645 and parameters: {'max_depth': 7, 'max_features': 0.623223034545932, 'n_estimators': 490, 'criterion': 'gini', 'min_samples_split': 37}. Best is trial 23 with value: 0.9225092310002317.
[I 2023-08-03 12:10:00,632] Trial 27 finished with value: 0.9184984259215743 and parameters: {'max_depth': 11, 'max_features': 0.8460828095951608, 'n_estimators': 160, 'criterion': 'entropy', 'min_samples_split': 35}. Best is trial 23 with value: 0.9225092310002317.
[I 2023-08-03 12:43:41,791] Trial 28 finished with value: 0.9180414756327646 and parameters: {'max_depth': 11, 'max_features': 0.6119662933778331, 'n_estimators': 230, 'criterion': 'gini', 'min_samples_split': 18}. Best is trial 23 with value: 0.9225092310002317.
[I 2023-08-03 13:53:36,984] Trial 29 finished with value: 0.9188151071684846 and parameters: {'max_depth': 11, 'max_features': 0.7708009878158518, 'n_estimators': 370, 'criterion': 'gini', 'min_samples_split': 17}. Best is trial 23 with value: 0.9225092310002317.
[I 2023-08-03 14:24:58,641] Trial 30 finished with value: 0.9149241943665105 and parameters: {'max_depth': 11, 'max_features': 0.28915660892335565, 'n_estimators': 400, 'criterion': 'entropy', 'min_samples_split': 281}. Best is trial 23 with value: 0.9225092310002317.
[I 2023-08-03 15:00:12,424] Trial 31 finished with value: 0.9146260611160775 and parameters: {'max_depth': 7, 'max_features': 0.6755147927919462, 'n_estimators': 310, 'criterion': 'gini', 'min_samples_split': 2}. Best is trial 23 with value: 0.9225092310002317.
[I 2023-08-03 16:40:12,905] Trial 32 finished with value: 0.9211922054595508 and parameters: {'max_depth': 13, 'max_features': 0.7949602265889221, 'n_estimators': 470, 'criterion': 'gini', 'min_samples_split': 7}. Best is trial 23 with value: 0.9225092310002317.
[I 2023-08-03 18:22:49,584] Trial 33 finished with value: 0.9186718099129705 and parameters: {'max_depth': 11, 'max_features': 0.9541146886188547, 'n_estimators': 480, 'criterion': 'entropy', 'min_samples_split': 97}. Best is trial 23 with value: 0.9225092310002317.
[I 2023-08-03 18:59:17,938] Trial 34 finished with value: 0.915579872031033 and parameters: {'max_depth': 9, 'max_features': 0.5373916003872188, 'n_estimators': 340, 'criterion': 'entropy', 'min_samples_split': 590}. Best is trial 23 with value: 0.9225092310002317.
[I 2023-08-03 19:32:39,311] Trial 35 finished with value: 0.9163700937363478 and parameters: {'max_depth': 9, 'max_features': 0.9669362755966406, 'n_estimators': 170, 'criterion': 'entropy', 'min_samples_split': 40}. Best is trial 23 with value: 0.9225092310002317.
[I 2023-08-03 20:22:22,041] Trial 36 finished with value: 0.9130443261537147 and parameters: {'max_depth': 5, 'max_features': 0.9531731900959128, 'n_estimators': 430, 'criterion': 'entropy', 'min_samples_split': 13}. Best is trial 23 with value: 0.9225092310002317.
[I 2023-08-03 20:50:51,656] Trial 37 finished with value: 0.9137803352758536 and parameters: {'max_depth': 6, 'max_features': 0.8285416229139239, 'n_estimators': 240, 'criterion': 'gini', 'min_samples_split': 455}. Best is trial 23 with value: 0.9225092310002317.
[I 2023-08-03 21:57:22,512] Trial 38 finished with value: 0.9224188020824533 and parameters: {'max_depth': 14, 'max_features': 0.9148530868377843, 'n_estimators': 280, 'criterion': 'entropy', 'min_samples_split': 10}. Best is trial 23 with value: 0.9225092310002317.
