[I 2023-08-03 22:15:44,216] Trial 39 finished with value: 0.917271341976796 and parameters: {'max_depth': 10, 'max_features': 0.6391992768812905, 'n_estimators': 100, 'criterion': 'gini', 'min_samples_split': 286}. Best is trial 23 with value: 0.9225092310002317.
[I 2023-08-03 23:07:52,863] Trial 40 finished with value: 0.9154231772381329 and parameters: {'max_depth': 8, 'max_features': 0.9035998376726362, 'n_estimators': 330, 'criterion': 'entropy', 'min_samples_split': 80}. Best is trial 23 with value: 0.9225092310002317.
2023-08-03 23:23:27,778 - distributed.utils_perf - WARNING - full garbage collections took 10% CPU time recently (threshold: 10%)
2023-08-03 23:23:28,982 - distributed.utils_perf - WARNING - full garbage collections took 10% CPU time recently (threshold: 10%)
2023-08-03 23:23:32,084 - distributed.utils_perf - WARNING - full garbage collections took 10% CPU time recently (threshold: 10%)
2023-08-03 23:23:36,680 - distributed.utils_perf - WARNING - full garbage collections took 10% CPU time recently (threshold: 10%)
2023-08-03 23:24:20,819 - distributed.utils_perf - WARNING - full garbage collections took 10% CPU time recently (threshold: 10%)
2023-08-03 23:25:34,795 - distributed.utils_perf - WARNING - full garbage collections took 10% CPU time recently (threshold: 10%)
2023-08-03 23:27:05,685 - distributed.utils_perf - WARNING - full garbage collections took 10% CPU time recently (threshold: 10%)
2023-08-03 23:28:27,718 - distributed.utils_perf - WARNING - full garbage collections took 10% CPU time recently (threshold: 10%)
2023-08-03 23:28:30,373 - distributed.utils_perf - WARNING - full garbage collections took 10% CPU time recently (threshold: 10%)
2023-08-03 23:28:35,155 - distributed.utils_perf - WARNING - full garbage collections took 10% CPU time recently (threshold: 10%)
2023-08-03 23:29:21,396 - distributed.utils_perf - WARNING - full garbage collections took 10% CPU time recently (threshold: 10%)
2023-08-03 23:30:39,840 - distributed.utils_perf - WARNING - full garbage collections took 10% CPU time recently (threshold: 10%)
[I 2023-08-03 23:33:36,094] Trial 41 finished with value: 0.9127558839858707 and parameters: {'max_depth': 5, 'max_features': 0.478174312001019, 'n_estimators': 370, 'criterion': 'gini', 'min_samples_split': 860}. Best is trial 23 with value: 0.9225092310002317.
2023-08-03 23:33:44,739 - distributed.utils_perf - WARNING - full garbage collections took 10% CPU time recently (threshold: 10%)
2023-08-03 23:33:49,916 - distributed.utils_perf - WARNING - full garbage collections took 10% CPU time recently (threshold: 10%)
2023-08-03 23:34:51,782 - distributed.utils_perf - WARNING - full garbage collections took 10% CPU time recently (threshold: 10%)
2023-08-03 23:35:28,088 - distributed.utils_perf - WARNING - full garbage collections took 10% CPU time recently (threshold: 10%)
[I 2023-08-04 00:37:28,408] Trial 42 finished with value: 0.916744127224421 and parameters: {'max_depth': 9, 'max_features': 0.9764051845224903, 'n_estimators': 340, 'criterion': 'gini', 'min_samples_split': 89}. Best is trial 23 with value: 0.9225092310002317.
[I 2023-08-04 01:27:06,271] Trial 43 finished with value: 0.9154724734853531 and parameters: {'max_depth': 8, 'max_features': 0.6281500065904746, 'n_estimators': 400, 'criterion': 'gini', 'min_samples_split': 140}. Best is trial 23 with value: 0.9225092310002317.
[I 2023-08-04 02:13:43,733] Trial 44 finished with value: 0.9199355627153482 and parameters: {'max_depth': 14, 'max_features': 0.3904128971530718, 'n_estimators': 370, 'criterion': 'gini', 'min_samples_split': 22}. Best is trial 23 with value: 0.9225092310002317.
2023-08-04 02:40:55,306 - distributed.utils_perf - WARNING - full garbage collections took 10% CPU time recently (threshold: 10%)
[I 2023-08-04 02:46:50,043] Trial 45 finished with value: 0.915167760137412 and parameters: {'max_depth': 9, 'max_features': 0.38564555136244927, 'n_estimators': 350, 'criterion': 'entropy', 'min_samples_split': 123}. Best is trial 23 with value: 0.9225092310002317.
2023-08-04 02:46:59,537 - distributed.utils_perf - WARNING - full garbage collections took 10% CPU time recently (threshold: 10%)
2023-08-04 02:47:33,821 - distributed.utils_perf - WARNING - full garbage collections took 10% CPU time recently (threshold: 10%)
2023-08-04 02:48:12,236 - distributed.utils_perf - WARNING - full garbage collections took 10% CPU time recently (threshold: 10%)
[I 2023-08-04 03:08:54,816] Trial 46 finished with value: 0.9141130324568418 and parameters: {'max_depth': 7, 'max_features': 0.4840309084132295, 'n_estimators': 240, 'criterion': 'entropy', 'min_samples_split': 535}. Best is trial 23 with value: 0.9225092310002317.
[I 2023-08-04 03:31:02,718] Trial 47 finished with value: 0.9171158139433289 and parameters: {'max_depth': 12, 'max_features': 0.343187435826782, 'n_estimators': 200, 'criterion': 'gini', 'min_samples_split': 276}. Best is trial 23 with value: 0.9225092310002317.
[I 2023-08-04 04:26:06,047] Trial 48 finished with value: 0.9185797601204942 and parameters: {'max_depth': 11, 'max_features': 0.75982827275876, 'n_estimators': 310, 'criterion': 'gini', 'min_samples_split': 31}. Best is trial 23 with value: 0.9225092310002317.
2023-08-04 04:36:56,400 - distributed.utils_perf - WARNING - full garbage collections took 10% CPU time recently (threshold: 10%)
2023-08-04 04:36:58,564 - distributed.utils_perf - WARNING - full garbage collections took 11% CPU time recently (threshold: 10%)
2023-08-04 04:37:03,236 - distributed.utils_perf - WARNING - full garbage collections took 11% CPU time recently (threshold: 10%)
2023-08-04 04:37:09,353 - distributed.utils_perf - WARNING - full garbage collections took 11% CPU time recently (threshold: 10%)
2023-08-04 04:38:37,916 - distributed.utils_perf - WARNING - full garbage collections took 10% CPU time recently (threshold: 10%)
2023-08-04 04:39:25,835 - distributed.utils_perf - WARNING - full garbage collections took 10% CPU time recently (threshold: 10%)
2023-08-04 04:39:34,865 - distributed.utils_perf - WARNING - full garbage collections took 10% CPU time recently (threshold: 10%)
[I 2023-08-04 04:39:36,712] Trial 49 finished with value: 0.9122949409742407 and parameters: {'max_depth': 8, 'max_features': 0.16138841357503372, 'n_estimators': 250, 'criterion': 'entropy', 'min_samples_split': 5}. Best is trial 23 with value: 0.9225092310002317.
2023-08-04 04:39:37,797 - distributed.utils_perf - WARNING - full garbage collections took 10% CPU time recently (threshold: 10%)
2023-08-04 04:39:39,072 - distributed.utils_perf - WARNING - full garbage collections took 10% CPU time recently (threshold: 10%)
2023-08-04 04:39:40,307 - distributed.utils_perf - WARNING - full garbage collections took 10% CPU time recently (threshold: 10%)
2023-08-04 04:39:45,449 - distributed.utils_perf - WARNING - full garbage collections took 10% CPU time recently (threshold: 10%)
2023-08-04 04:39:52,211 - distributed.utils_perf - WARNING - full garbage collections took 10% CPU time recently (threshold: 10%)
2023-08-04 04:40:58,017 - distributed.utils_perf - WARNING - full garbage collections took 10% CPU time recently (threshold: 10%)
2023-08-04 04:41:37,307 - distributed.utils_perf - WARNING - full garbage collections took 10% CPU time recently (threshold: 10%)
[I 2023-08-04 06:07:33,546] Trial 50 finished with value: 0.9214669668098413 and parameters: {'max_depth': 13, 'max_features': 0.8874654804603083, 'n_estimators': 380, 'criterion': 'gini', 'min_samples_split': 31}. Best is trial 23 with value: 0.9225092310002317.
2023-08-04 06:25:27,991 - distributed.utils_perf - WARNING - full garbage collections took 10% CPU time recently (threshold: 10%)
2023-08-04 06:26:34,434 - distributed.utils_perf - WARNING - full garbage collections took 10% CPU time recently (threshold: 10%)
2023-08-04 06:27:54,403 - distributed.utils_perf - WARNING - full garbage collections took 10% CPU time recently (threshold: 10%)
[I 2023-08-04 06:28:58,976] Trial 51 finished with value: 0.9128880992809112 and parameters: {'max_depth': 8, 'max_features': 0.30253596203267613, 'n_estimators': 340, 'criterion': 'entropy', 'min_samples_split': 556}. Best is trial 23 with value: 0.9225092310002317.
2023-08-04 06:30:42,290 - distributed.utils_perf - WARNING - full garbage collections took 10% CPU time recently (threshold: 10%)
2023-08-04 06:30:48,985 - distributed.utils_perf - WARNING - full garbage collections took 10% CPU time recently (threshold: 10%)
2023-08-04 06:30:50,903 - distributed.utils_perf - WARNING - full garbage collections took 10% CPU time recently (threshold: 10%)
2023-08-04 06:30:52,034 - distributed.utils_perf - WARNING - full garbage collections took 10% CPU time recently (threshold: 10%)
2023-08-04 06:30:54,756 - distributed.utils_perf - WARNING - full garbage collections took 10% CPU time recently (threshold: 10%)
2023-08-04 06:30:59,397 - distributed.utils_perf - WARNING - full garbage collections took 10% CPU time recently (threshold: 10%)
2023-08-04 06:31:32,074 - distributed.utils_perf - WARNING - full garbage collections took 10% CPU time recently (threshold: 10%)
2023-08-04 06:32:24,360 - distributed.utils_perf - WARNING - full garbage collections took 10% CPU time recently (threshold: 10%)
2023-08-04 06:32:38,197 - distributed.utils_perf - WARNING - full garbage collections took 10% CPU time recently (threshold: 10%)
2023-08-04 06:32:41,329 - distributed.utils_perf - WARNING - full garbage collections took 10% CPU time recently (threshold: 10%)
2023-08-04 06:32:42,626 - distributed.utils_perf - WARNING - full garbage collections took 10% CPU time recently (threshold: 10%)
2023-08-04 06:32:43,953 - distributed.utils_perf - WARNING - full garbage collections took 11% CPU time recently (threshold: 10%)
2023-08-04 06:32:48,487 - distributed.utils_perf - WARNING - full garbage collections took 11% CPU time recently (threshold: 10%)
2023-08-04 06:32:53,727 - distributed.utils_perf - WARNING - full garbage collections took 11% CPU time recently (threshold: 10%)
2023-08-04 06:34:08,856 - distributed.utils_perf - WARNING - full garbage collections took 10% CPU time recently (threshold: 10%)
2023-08-04 06:34:29,730 - distributed.utils_perf - WARNING - full garbage collections took 10% CPU time recently (threshold: 10%)
2023-08-04 06:34:32,969 - distributed.utils_perf - WARNING - full garbage collections took 10% CPU time recently (threshold: 10%)
2023-08-04 06:34:34,490 - distributed.utils_perf - WARNING - full garbage collections took 11% CPU time recently (threshold: 10%)
2023-08-04 06:34:35,869 - distributed.utils_perf - WARNING - full garbage collections took 12% CPU time recently (threshold: 10%)
2023-08-04 06:34:39,854 - distributed.utils_perf - WARNING - full garbage collections took 12% CPU time recently (threshold: 10%)
2023-08-04 06:34:44,327 - distributed.utils_perf - WARNING - full garbage collections took 12% CPU time recently (threshold: 10%)
2023-08-04 06:35:25,149 - distributed.utils_perf - WARNING - full garbage collections took 11% CPU time recently (threshold: 10%)
2023-08-04 06:36:13,640 - distributed.utils_perf - WARNING - full garbage collections took 11% CPU time recently (threshold: 10%)
2023-08-04 06:36:22,631 - distributed.utils_perf - WARNING - full garbage collections took 11% CPU time recently (threshold: 10%)
2023-08-04 06:36:25,537 - distributed.utils_perf - WARNING - full garbage collections took 11% CPU time recently (threshold: 10%)
2023-08-04 06:36:26,661 - distributed.utils_perf - WARNING - full garbage collections took 11% CPU time recently (threshold: 10%)
2023-08-04 06:36:28,746 - distributed.utils_perf - WARNING - full garbage collections took 11% CPU time recently (threshold: 10%)
2023-08-04 06:36:33,163 - distributed.utils_perf - WARNING - full garbage collections took 12% CPU time recently (threshold: 10%)
2023-08-04 06:36:39,779 - distributed.utils_perf - WARNING - full garbage collections took 12% CPU time recently (threshold: 10%)
2023-08-04 06:37:56,856 - distributed.utils_perf - WARNING - full garbage collections took 12% CPU time recently (threshold: 10%)
2023-08-04 06:38:14,543 - distributed.utils_perf - WARNING - full garbage collections took 12% CPU time recently (threshold: 10%)
2023-08-04 06:38:17,885 - distributed.utils_perf - WARNING - full garbage collections took 12% CPU time recently (threshold: 10%)
[I 2023-08-04 06:38:18,142] Trial 52 finished with value: 0.9121701647229228 and parameters: {'max_depth': 7, 'max_features': 0.1998021706696263, 'n_estimators': 170, 'criterion': 'entropy', 'min_samples_split': 6}. Best is trial 23 with value: 0.9225092310002317.
2023-08-04 06:38:19,385 - distributed.utils_perf - WARNING - full garbage collections took 11% CPU time recently (threshold: 10%)
2023-08-04 06:38:20,611 - distributed.utils_perf - WARNING - full garbage collections took 12% CPU time recently (threshold: 10%)
2023-08-04 06:38:21,963 - distributed.utils_perf - WARNING - full garbage collections took 12% CPU time recently (threshold: 10%)
2023-08-04 06:38:27,055 - distributed.utils_perf - WARNING - full garbage collections took 12% CPU time recently (threshold: 10%)
2023-08-04 06:38:31,975 - distributed.utils_perf - WARNING - full garbage collections took 13% CPU time recently (threshold: 10%)
2023-08-04 06:39:25,074 - distributed.utils_perf - WARNING - full garbage collections took 12% CPU time recently (threshold: 10%)
2023-08-04 06:40:01,355 - distributed.utils_perf - WARNING - full garbage collections took 12% CPU time recently (threshold: 10%)
2023-08-04 06:40:38,295 - distributed.utils_perf - WARNING - full garbage collections took 11% CPU time recently (threshold: 10%)
2023-08-04 06:42:04,639 - distributed.utils_perf - WARNING - full garbage collections took 11% CPU time recently (threshold: 10%)
2023-08-04 06:42:44,238 - distributed.utils_perf - WARNING - full garbage collections took 11% CPU time recently (threshold: 10%)
2023-08-04 06:43:23,446 - distributed.utils_perf - WARNING - full garbage collections took 11% CPU time recently (threshold: 10%)
2023-08-04 06:44:29,470 - distributed.utils_perf - WARNING - full garbage collections took 11% CPU time recently (threshold: 10%)
2023-08-04 06:44:51,197 - distributed.utils_perf - WARNING - full garbage collections took 10% CPU time recently (threshold: 10%)
2023-08-04 06:45:11,408 - distributed.utils_perf - WARNING - full garbage collections took 10% CPU time recently (threshold: 10%)
2023-08-04 06:45:30,702 - distributed.utils_perf - WARNING - full garbage collections took 10% CPU time recently (threshold: 10%)
2023-08-04 06:46:13,994 - distributed.utils_perf - WARNING - full garbage collections took 10% CPU time recently (threshold: 10%)
2023-08-04 06:46:15,487 - distributed.utils_perf - WARNING - full garbage collections took 10% CPU time recently (threshold: 10%)
2023-08-04 06:46:20,104 - distributed.utils_perf - WARNING - full garbage collections took 10% CPU time recently (threshold: 10%)
2023-08-04 06:46:25,468 - distributed.utils_perf - WARNING - full garbage collections took 10% CPU time recently (threshold: 10%)
[I 2023-08-04 07:17:12,026] Trial 53 finished with value: 0.914574912668795 and parameters: {'max_depth': 7, 'max_features': 0.8665046874427302, 'n_estimators': 270, 'criterion': 'gini', 'min_samples_split': 3}. Best is trial 23 with value: 0.9225092310002317.
[I 2023-08-04 07:37:25,528] Trial 54 finished with value: 0.9167294900019345 and parameters: {'max_depth': 10, 'max_features': 0.5294268883448041, 'n_estimators': 160, 'criterion': 'gini', 'min_samples_split': 106}. Best is trial 23 with value: 0.9225092310002317.
[I 2023-08-04 08:01:03,859] Trial 55 finished with value: 0.9136562360003033 and parameters: {'max_depth': 6, 'max_features': 0.7763750354217195, 'n_estimators': 190, 'criterion': 'entropy', 'min_samples_split': 2}. Best is trial 23 with value: 0.9225092310002317.
[I 2023-08-04 09:11:13,007] Trial 56 finished with value: 0.9154290644477976 and parameters: {'max_depth': 8, 'max_features': 0.8856301387601, 'n_estimators': 440, 'criterion': 'entropy', 'min_samples_split': 722}. Best is trial 23 with value: 0.9225092310002317.
[I 2023-08-04 09:46:11,697] Trial 57 finished with value: 0.9222981543670612 and parameters: {'max_depth': 14, 'max_features': 0.8687038994528848, 'n_estimators': 140, 'criterion': 'entropy', 'min_samples_split': 79}. Best is trial 23 with value: 0.9225092310002317.
2023-08-04 09:59:56,832 - distributed.utils_perf - WARNING - full garbage collections took 10% CPU time recently (threshold: 10%)
2023-08-04 10:01:04,710 - distributed.utils_perf - WARNING - full garbage collections took 10% CPU time recently (threshold: 10%)
2023-08-04 10:02:50,856 - distributed.utils_perf - WARNING - full garbage collections took 10% CPU time recently (threshold: 10%)
2023-08-04 10:03:21,848 - distributed.utils_perf - WARNING - full garbage collections took 10% CPU time recently (threshold: 10%)
2023-08-04 10:03:26,608 - distributed.utils_perf - WARNING - full garbage collections took 10% CPU time recently (threshold: 10%)
2023-08-04 10:03:28,503 - distributed.utils_perf - WARNING - full garbage collections took 10% CPU time recently (threshold: 10%)
2023-08-04 10:03:29,676 - distributed.utils_perf - WARNING - full garbage collections took 10% CPU time recently (threshold: 10%)
2023-08-04 10:03:32,343 - distributed.utils_perf - WARNING - full garbage collections took 10% CPU time recently (threshold: 10%)
2023-08-04 10:03:36,895 - distributed.utils_perf - WARNING - full garbage collections took 10% CPU time recently (threshold: 10%)
2023-08-04 10:03:42,775 - distributed.utils_perf - WARNING - full garbage collections took 10% CPU time recently (threshold: 10%)
2023-08-04 10:05:04,965 - distributed.utils_perf - WARNING - full garbage collections took 10% CPU time recently (threshold: 10%)
2023-08-04 10:06:15,978 - distributed.utils_perf - WARNING - full garbage collections took 10% CPU time recently (threshold: 10%)
2023-08-04 10:07:25,519 - distributed.utils_perf - WARNING - full garbage collections took 10% CPU time recently (threshold: 10%)
2023-08-04 10:07:39,927 - distributed.utils_perf - WARNING - full garbage collections took 10% CPU time recently (threshold: 10%)
[I 2023-08-04 10:07:43,794] Trial 58 finished with value: 0.9140022782129767 and parameters: {'max_depth': 13, 'max_features': 0.13111409788447084, 'n_estimators': 410, 'criterion': 'gini', 'min_samples_split': 8}. Best is trial 23 with value: 0.9225092310002317.
2023-08-04 10:07:44,693 - distributed.utils_perf - WARNING - full garbage collections took 10% CPU time recently (threshold: 10%)
2023-08-04 10:07:45,987 - distributed.utils_perf - WARNING - full garbage collections took 10% CPU time recently (threshold: 10%)
2023-08-04 10:07:47,087 - distributed.utils_perf - WARNING - full garbage collections took 10% CPU time recently (threshold: 10%)
2023-08-04 10:07:51,768 - distributed.utils_perf - WARNING - full garbage collections took 10% CPU time recently (threshold: 10%)
2023-08-04 10:07:56,707 - distributed.utils_perf - WARNING - full garbage collections took 10% CPU time recently (threshold: 10%)
[I 2023-08-04 10:52:48,260] Trial 59 finished with value: 0.9165031316583658 and parameters: {'max_depth': 11, 'max_features': 0.41076771543197343, 'n_estimators': 420, 'criterion': 'entropy', 'min_samples_split': 940}. Best is trial 23 with value: 0.9225092310002317.
2023-08-04 11:06:39,968 - distributed.utils_perf - WARNING - full garbage collections took 10% CPU time recently (threshold: 10%)
2023-08-04 11:08:07,699 - distributed.utils_perf - WARNING - full garbage collections took 10% CPU time recently (threshold: 10%)
2023-08-04 11:10:17,152 - distributed.utils_perf - WARNING - full garbage collections took 10% CPU time recently (threshold: 10%)
2023-08-04 11:10:53,724 - distributed.utils_perf - WARNING - full garbage collections took 10% CPU time recently (threshold: 10%)
2023-08-04 11:10:58,686 - distributed.utils_perf - WARNING - full garbage collections took 10% CPU time recently (threshold: 10%)
2023-08-04 11:11:00,596 - distributed.utils_perf - WARNING - full garbage collections took 10% CPU time recently (threshold: 10%)
2023-08-04 11:11:01,870 - distributed.utils_perf - WARNING - full garbage collections took 10% CPU time recently (threshold: 10%)
2023-08-04 11:11:04,551 - distributed.utils_perf - WARNING - full garbage collections took 10% CPU time recently (threshold: 10%)
2023-08-04 11:11:09,277 - distributed.utils_perf - WARNING - full garbage collections took 10% CPU time recently (threshold: 10%)
2023-08-04 11:11:44,515 - distributed.utils_perf - WARNING - full garbage collections took 11% CPU time recently (threshold: 10%)
2023-08-04 11:13:04,018 - distributed.utils_perf - WARNING - full garbage collections took 11% CPU time recently (threshold: 10%)
2023-08-04 11:15:11,661 - distributed.utils_perf - WARNING - full garbage collections took 11% CPU time recently (threshold: 10%)
2023-08-04 11:15:30,970 - distributed.utils_perf - WARNING - full garbage collections took 10% CPU time recently (threshold: 10%)
2023-08-04 11:15:36,108 - distributed.utils_perf - WARNING - full garbage collections took 10% CPU time recently (threshold: 10%)
