[I 2023-08-04 21:26:40,883] Trial 77 finished with value: 0.9122845674391847 and parameters: {'max_depth': 6, 'max_features': 0.3378677344542106, 'n_estimators': 430, 'criterion': 'entropy', 'min_samples_split': 8}. Best is trial 74 with value: 0.9240477087189687.
2023-08-04 21:26:43,253 - distributed.utils_perf - WARNING - full garbage collections took 10% CPU time recently (threshold: 10%)
2023-08-04 21:26:44,264 - distributed.utils_perf - WARNING - full garbage collections took 10% CPU time recently (threshold: 10%)
2023-08-04 21:26:47,731 - distributed.utils_perf - WARNING - full garbage collections took 10% CPU time recently (threshold: 10%)
2023-08-04 21:26:53,647 - distributed.utils_perf - WARNING - full garbage collections took 10% CPU time recently (threshold: 10%)
2023-08-04 21:27:39,536 - distributed.utils_perf - WARNING - full garbage collections took 10% CPU time recently (threshold: 10%)
2023-08-04 21:28:15,494 - distributed.utils_perf - WARNING - full garbage collections took 10% CPU time recently (threshold: 10%)
2023-08-04 21:29:28,370 - distributed.utils_perf - WARNING - full garbage collections took 10% CPU time recently (threshold: 10%)
2023-08-04 21:30:43,560 - distributed.utils_perf - WARNING - full garbage collections took 10% CPU time recently (threshold: 10%)
2023-08-04 21:31:27,148 - distributed.utils_perf - WARNING - full garbage collections took 10% CPU time recently (threshold: 10%)
2023-08-04 21:32:42,851 - distributed.utils_perf - WARNING - full garbage collections took 10% CPU time recently (threshold: 10%)
2023-08-04 21:33:50,325 - distributed.utils_perf - WARNING - full garbage collections took 10% CPU time recently (threshold: 10%)
2023-08-04 21:34:10,634 - distributed.utils_perf - WARNING - full garbage collections took 10% CPU time recently (threshold: 10%)
[I 2023-08-04 22:06:55,579] Trial 78 finished with value: 0.9152899263469572 and parameters: {'max_depth': 10, 'max_features': 0.38302031006726467, 'n_estimators': 470, 'criterion': 'entropy', 'min_samples_split': 42}. Best is trial 74 with value: 0.9240477087189687.
2023-08-04 22:20:24,991 - distributed.utils_perf - WARNING - full garbage collections took 10% CPU time recently (threshold: 10%)
2023-08-04 22:20:29,375 - distributed.utils_perf - WARNING - full garbage collections took 10% CPU time recently (threshold: 10%)
2023-08-04 22:21:09,507 - distributed.utils_perf - WARNING - full garbage collections took 10% CPU time recently (threshold: 10%)
2023-08-04 22:22:12,695 - distributed.utils_perf - WARNING - full garbage collections took 10% CPU time recently (threshold: 10%)
2023-08-04 22:23:22,715 - distributed.utils_perf - WARNING - full garbage collections took 10% CPU time recently (threshold: 10%)
2023-08-04 22:24:59,117 - distributed.utils_perf - WARNING - full garbage collections took 10% CPU time recently (threshold: 10%)
2023-08-04 22:25:40,837 - distributed.utils_perf - WARNING - full garbage collections took 10% CPU time recently (threshold: 10%)
2023-08-04 22:26:44,731 - distributed.utils_perf - WARNING - full garbage collections took 10% CPU time recently (threshold: 10%)
[I 2023-08-04 22:29:15,077] Trial 79 finished with value: 0.9146229564865271 and parameters: {'max_depth': 15, 'max_features': 0.12785410564403565, 'n_estimators': 390, 'criterion': 'gini', 'min_samples_split': 45}. Best is trial 74 with value: 0.9240477087189687.
2023-08-04 22:29:20,515 - distributed.utils_perf - WARNING - full garbage collections took 10% CPU time recently (threshold: 10%)
2023-08-04 22:29:25,658 - distributed.utils_perf - WARNING - full garbage collections took 10% CPU time recently (threshold: 10%)
2023-08-04 22:30:14,859 - distributed.utils_perf - WARNING - full garbage collections took 10% CPU time recently (threshold: 10%)
2023-08-04 22:30:53,323 - distributed.utils_perf - WARNING - full garbage collections took 10% CPU time recently (threshold: 10%)
[I 2023-08-04 23:20:52,709] Trial 80 finished with value: 0.9155812154274034 and parameters: {'max_depth': 8, 'max_features': 0.8735403887790273, 'n_estimators': 320, 'criterion': 'gini', 'min_samples_split': 89}. Best is trial 74 with value: 0.9240477087189687.
2023-08-04 23:29:44,553 - distributed.utils_perf - WARNING - full garbage collections took 10% CPU time recently (threshold: 10%)
2023-08-04 23:31:31,222 - distributed.utils_perf - WARNING - full garbage collections took 10% CPU time recently (threshold: 10%)
2023-08-04 23:31:44,053 - distributed.utils_perf - WARNING - full garbage collections took 10% CPU time recently (threshold: 10%)
2023-08-04 23:31:48,413 - distributed.utils_perf - WARNING - full garbage collections took 10% CPU time recently (threshold: 10%)
2023-08-04 23:31:49,672 - distributed.utils_perf - WARNING - full garbage collections took 10% CPU time recently (threshold: 10%)
2023-08-04 23:31:51,072 - distributed.utils_perf - WARNING - full garbage collections took 11% CPU time recently (threshold: 10%)
2023-08-04 23:31:55,879 - distributed.utils_perf - WARNING - full garbage collections took 11% CPU time recently (threshold: 10%)
2023-08-04 23:32:00,915 - distributed.utils_perf - WARNING - full garbage collections took 12% CPU time recently (threshold: 10%)
2023-08-04 23:33:24,510 - distributed.utils_perf - WARNING - full garbage collections took 13% CPU time recently (threshold: 10%)
2023-08-04 23:34:25,721 - distributed.utils_perf - WARNING - full garbage collections took 13% CPU time recently (threshold: 10%)
2023-08-04 23:34:29,803 - distributed.utils_perf - WARNING - full garbage collections took 12% CPU time recently (threshold: 10%)
[I 2023-08-04 23:34:29,965] Trial 81 finished with value: 0.9123528659012925 and parameters: {'max_depth': 8, 'max_features': 0.10841372016986421, 'n_estimators': 330, 'criterion': 'entropy', 'min_samples_split': 581}. Best is trial 74 with value: 0.9240477087189687.
2023-08-04 23:34:31,298 - distributed.utils_perf - WARNING - full garbage collections took 12% CPU time recently (threshold: 10%)
2023-08-04 23:34:32,467 - distributed.utils_perf - WARNING - full garbage collections took 13% CPU time recently (threshold: 10%)
2023-08-04 23:34:35,455 - distributed.utils_perf - WARNING - full garbage collections took 12% CPU time recently (threshold: 10%)
2023-08-04 23:34:40,215 - distributed.utils_perf - WARNING - full garbage collections took 12% CPU time recently (threshold: 10%)
2023-08-04 23:35:28,132 - distributed.utils_perf - WARNING - full garbage collections took 12% CPU time recently (threshold: 10%)
2023-08-04 23:36:50,659 - distributed.utils_perf - WARNING - full garbage collections took 12% CPU time recently (threshold: 10%)
2023-08-04 23:37:56,620 - distributed.utils_perf - WARNING - full garbage collections took 12% CPU time recently (threshold: 10%)
2023-08-04 23:38:19,337 - distributed.utils_perf - WARNING - full garbage collections took 11% CPU time recently (threshold: 10%)
2023-08-04 23:38:44,843 - distributed.utils_perf - WARNING - full garbage collections took 11% CPU time recently (threshold: 10%)
2023-08-04 23:38:48,709 - distributed.utils_perf - WARNING - full garbage collections took 11% CPU time recently (threshold: 10%)
2023-08-04 23:38:50,262 - distributed.utils_perf - WARNING - full garbage collections took 11% CPU time recently (threshold: 10%)
2023-08-04 23:38:51,512 - distributed.utils_perf - WARNING - full garbage collections took 12% CPU time recently (threshold: 10%)
2023-08-04 23:38:56,241 - distributed.utils_perf - WARNING - full garbage collections took 12% CPU time recently (threshold: 10%)
2023-08-04 23:39:00,474 - distributed.utils_perf - WARNING - full garbage collections took 11% CPU time recently (threshold: 10%)
2023-08-04 23:39:49,149 - distributed.utils_perf - WARNING - full garbage collections took 11% CPU time recently (threshold: 10%)
2023-08-04 23:41:09,048 - distributed.utils_perf - WARNING - full garbage collections took 11% CPU time recently (threshold: 10%)
2023-08-04 23:41:57,778 - distributed.utils_perf - WARNING - full garbage collections took 11% CPU time recently (threshold: 10%)
2023-08-04 23:42:34,816 - distributed.utils_perf - WARNING - full garbage collections took 11% CPU time recently (threshold: 10%)
2023-08-04 23:42:57,447 - distributed.utils_perf - WARNING - full garbage collections took 10% CPU time recently (threshold: 10%)
2023-08-04 23:43:01,372 - distributed.utils_perf - WARNING - full garbage collections took 10% CPU time recently (threshold: 10%)
2023-08-04 23:43:03,274 - distributed.utils_perf - WARNING - full garbage collections took 10% CPU time recently (threshold: 10%)
2023-08-04 23:43:04,700 - distributed.utils_perf - WARNING - full garbage collections took 10% CPU time recently (threshold: 10%)
2023-08-04 23:43:07,445 - distributed.utils_perf - WARNING - full garbage collections took 10% CPU time recently (threshold: 10%)
2023-08-04 23:43:12,182 - distributed.utils_perf - WARNING - full garbage collections took 10% CPU time recently (threshold: 10%)
2023-08-04 23:43:48,525 - distributed.utils_perf - WARNING - full garbage collections took 11% CPU time recently (threshold: 10%)
2023-08-04 23:44:24,581 - distributed.utils_perf - WARNING - full garbage collections took 10% CPU time recently (threshold: 10%)
2023-08-04 23:45:40,661 - distributed.utils_perf - WARNING - full garbage collections took 10% CPU time recently (threshold: 10%)
2023-08-04 23:46:36,344 - distributed.utils_perf - WARNING - full garbage collections took 10% CPU time recently (threshold: 10%)
2023-08-04 23:46:55,295 - distributed.utils_perf - WARNING - full garbage collections took 10% CPU time recently (threshold: 10%)
2023-08-04 23:47:20,667 - distributed.utils_perf - WARNING - full garbage collections took 10% CPU time recently (threshold: 10%)
2023-08-04 23:47:21,999 - distributed.utils_perf - WARNING - full garbage collections took 10% CPU time recently (threshold: 10%)
2023-08-04 23:47:26,541 - distributed.utils_perf - WARNING - full garbage collections took 10% CPU time recently (threshold: 10%)
2023-08-04 23:47:31,609 - distributed.utils_perf - WARNING - full garbage collections took 10% CPU time recently (threshold: 10%)
2023-08-04 23:48:18,541 - distributed.utils_perf - WARNING - full garbage collections took 10% CPU time recently (threshold: 10%)
[I 2023-08-04 23:55:51,207] Trial 82 finished with value: 0.9145637481663418 and parameters: {'max_depth': 9, 'max_features': 0.32265643294214685, 'n_estimators': 250, 'criterion': 'entropy', 'min_samples_split': 364}. Best is trial 74 with value: 0.9240477087189687.
[I 2023-08-05 00:09:59,051] Trial 83 finished with value: 0.918006540284962 and parameters: {'max_depth': 15, 'max_features': 0.30511026095618526, 'n_estimators': 130, 'criterion': 'entropy', 'min_samples_split': 5}. Best is trial 74 with value: 0.9240477087189687.
[I 2023-08-05 01:02:38,964] Trial 84 finished with value: 0.9173557355096982 and parameters: {'max_depth': 11, 'max_features': 0.47222777350104517, 'n_estimators': 430, 'criterion': 'entropy', 'min_samples_split': 7}. Best is trial 74 with value: 0.9240477087189687.
[I 2023-08-05 01:18:10,629] Trial 85 finished with value: 0.9167531998211554 and parameters: {'max_depth': 11, 'max_features': 0.41408883749870995, 'n_estimators': 120, 'criterion': 'entropy', 'min_samples_split': 38}. Best is trial 74 with value: 0.9240477087189687.
2023-08-05 01:20:18,028 - distributed.utils_perf - WARNING - full garbage collections took 10% CPU time recently (threshold: 10%)
2023-08-05 01:23:12,818 - distributed.utils_perf - WARNING - full garbage collections took 10% CPU time recently (threshold: 10%)
2023-08-05 01:23:17,542 - distributed.utils_perf - WARNING - full garbage collections took 10% CPU time recently (threshold: 10%)
2023-08-05 01:23:51,954 - distributed.utils_perf - WARNING - full garbage collections took 10% CPU time recently (threshold: 10%)
2023-08-05 01:24:28,367 - distributed.utils_perf - WARNING - full garbage collections took 10% CPU time recently (threshold: 10%)
2023-08-05 01:28:05,122 - distributed.utils_perf - WARNING - full garbage collections took 10% CPU time recently (threshold: 10%)
2023-08-05 01:28:10,269 - distributed.utils_perf - WARNING - full garbage collections took 10% CPU time recently (threshold: 10%)
2023-08-05 01:28:15,120 - distributed.utils_perf - WARNING - full garbage collections took 10% CPU time recently (threshold: 10%)
2023-08-05 01:29:04,288 - distributed.utils_perf - WARNING - full garbage collections took 10% CPU time recently (threshold: 10%)
[I 2023-08-05 01:42:38,578] Trial 86 finished with value: 0.9147845354969494 and parameters: {'max_depth': 10, 'max_features': 0.25724813509803024, 'n_estimators': 330, 'criterion': 'gini', 'min_samples_split': 72}. Best is trial 74 with value: 0.9240477087189687.
[I 2023-08-05 03:05:09,251] Trial 87 finished with value: 0.923719896435786 and parameters: {'max_depth': 15, 'max_features': 0.9114063262023891, 'n_estimators': 340, 'criterion': 'entropy', 'min_samples_split': 2}. Best is trial 74 with value: 0.9240477087189687.
[I 2023-08-05 03:50:53,030] Trial 88 finished with value: 0.9151915315293337 and parameters: {'max_depth': 9, 'max_features': 0.43789134985107203, 'n_estimators': 490, 'criterion': 'entropy', 'min_samples_split': 221}. Best is trial 74 with value: 0.9240477087189687.
[I 2023-08-05 04:59:06,441] Trial 89 finished with value: 0.9217775826539043 and parameters: {'max_depth': 14, 'max_features': 0.6693542351001975, 'n_estimators': 370, 'criterion': 'gini', 'min_samples_split': 15}. Best is trial 74 with value: 0.9240477087189687.
[I 2023-08-05 05:47:03,380] Trial 90 finished with value: 0.9176053721954147 and parameters: {'max_depth': 10, 'max_features': 0.7570820899810939, 'n_estimators': 290, 'criterion': 'gini', 'min_samples_split': 2}. Best is trial 74 with value: 0.9240477087189687.
[I 2023-08-05 06:47:12,897] Trial 91 finished with value: 0.9185166781000305 and parameters: {'max_depth': 13, 'max_features': 0.3879575542699105, 'n_estimators': 500, 'criterion': 'entropy', 'min_samples_split': 45}. Best is trial 74 with value: 0.9240477087189687.
[I 2023-08-05 07:09:46,163] Trial 92 finished with value: 0.9191968404757473 and parameters: {'max_depth': 13, 'max_features': 0.5174720055102661, 'n_estimators': 150, 'criterion': 'entropy', 'min_samples_split': 120}. Best is trial 74 with value: 0.9240477087189687.
2023-08-05 07:17:29,146 - distributed.utils_perf - WARNING - full garbage collections took 10% CPU time recently (threshold: 10%)
2023-08-05 07:17:36,568 - distributed.utils_perf - WARNING - full garbage collections took 10% CPU time recently (threshold: 10%)
2023-08-05 07:18:33,324 - distributed.utils_perf - WARNING - full garbage collections took 10% CPU time recently (threshold: 10%)
2023-08-05 07:19:15,048 - distributed.utils_perf - WARNING - full garbage collections took 10% CPU time recently (threshold: 10%)
[I 2023-08-05 07:19:15,471] Trial 93 finished with value: 0.9143321945952506 and parameters: {'max_depth': 13, 'max_features': 0.21730220285891885, 'n_estimators': 100, 'criterion': 'entropy', 'min_samples_split': 2}. Best is trial 74 with value: 0.9240477087189687.
2023-08-05 07:19:16,762 - distributed.utils_perf - WARNING - full garbage collections took 10% CPU time recently (threshold: 10%)
2023-08-05 07:19:17,947 - distributed.utils_perf - WARNING - full garbage collections took 10% CPU time recently (threshold: 10%)
2023-08-05 07:19:19,020 - distributed.utils_perf - WARNING - full garbage collections took 10% CPU time recently (threshold: 10%)
2023-08-05 07:19:23,879 - distributed.utils_perf - WARNING - full garbage collections took 10% CPU time recently (threshold: 10%)
2023-08-05 07:19:28,881 - distributed.utils_perf - WARNING - full garbage collections took 10% CPU time recently (threshold: 10%)
2023-08-05 07:20:24,956 - distributed.utils_perf - WARNING - full garbage collections took 11% CPU time recently (threshold: 10%)
2023-08-05 07:21:01,115 - distributed.utils_perf - WARNING - full garbage collections took 10% CPU time recently (threshold: 10%)
2023-08-05 07:21:38,147 - distributed.utils_perf - WARNING - full garbage collections took 10% CPU time recently (threshold: 10%)
2023-08-05 07:22:13,237 - distributed.utils_perf - WARNING - full garbage collections took 10% CPU time recently (threshold: 10%)
2023-08-05 07:23:34,115 - distributed.utils_perf - WARNING - full garbage collections took 10% CPU time recently (threshold: 10%)
2023-08-05 07:24:14,271 - distributed.utils_perf - WARNING - full garbage collections took 10% CPU time recently (threshold: 10%)
2023-08-05 07:24:52,076 - distributed.utils_perf - WARNING - full garbage collections took 10% CPU time recently (threshold: 10%)
[I 2023-08-05 08:10:12,647] Trial 94 finished with value: 0.9196630225835115 and parameters: {'max_depth': 12, 'max_features': 0.7181274039912926, 'n_estimators': 280, 'criterion': 'gini', 'min_samples_split': 2}. Best is trial 74 with value: 0.9240477087189687.
[I 2023-08-05 09:32:18,314] Trial 95 finished with value: 0.9174537852277383 and parameters: {'max_depth': 10, 'max_features': 0.87338602548784, 'n_estimators': 440, 'criterion': 'entropy', 'min_samples_split': 65}. Best is trial 74 with value: 0.9240477087189687.
[I 2023-08-05 10:13:15,342] Trial 96 finished with value: 0.9150306710717331 and parameters: {'max_depth': 8, 'max_features': 0.6044769914824529, 'n_estimators': 370, 'criterion': 'entropy', 'min_samples_split': 5}. Best is trial 74 with value: 0.9240477087189687.
[I 2023-08-05 10:56:02,892] Trial 97 finished with value: 0.91768647237641 and parameters: {'max_depth': 13, 'max_features': 0.36064247156818974, 'n_estimators': 410, 'criterion': 'entropy', 'min_samples_split': 15}. Best is trial 74 with value: 0.9240477087189687.
[I 2023-08-05 11:27:34,372] Trial 98 finished with value: 0.9146522673032432 and parameters: {'max_depth': 7, 'max_features': 0.7905560575795899, 'n_estimators': 220, 'criterion': 'entropy', 'min_samples_split': 6}. Best is trial 74 with value: 0.9240477087189687.
2023-08-05 11:32:34,515 - distributed.utils_perf - WARNING - full garbage collections took 10% CPU time recently (threshold: 10%)
2023-08-05 11:33:23,054 - distributed.utils_perf - WARNING - full garbage collections took 10% CPU time recently (threshold: 10%)
2023-08-05 11:33:35,622 - distributed.utils_perf - WARNING - full garbage collections took 10% CPU time recently (threshold: 10%)
2023-08-05 11:34:23,464 - distributed.utils_perf - WARNING - full garbage collections took 10% CPU time recently (threshold: 10%)
2023-08-05 11:35:12,774 - distributed.utils_perf - WARNING - full garbage collections took 10% CPU time recently (threshold: 10%)
2023-08-05 11:35:33,331 - distributed.utils_perf - WARNING - full garbage collections took 10% CPU time recently (threshold: 10%)
2023-08-05 11:35:36,472 - distributed.utils_perf - WARNING - full garbage collections took 10% CPU time recently (threshold: 10%)
2023-08-05 11:35:39,317 - distributed.utils_perf - WARNING - full garbage collections took 10% CPU time recently (threshold: 10%)
2023-08-05 11:35:43,220 - distributed.utils_perf - WARNING - full garbage collections took 10% CPU time recently (threshold: 10%)
2023-08-05 11:35:48,714 - distributed.utils_perf - WARNING - full garbage collections took 10% CPU time recently (threshold: 10%)
2023-08-05 11:36:30,684 - distributed.utils_perf - WARNING - full garbage collections took 10% CPU time recently (threshold: 10%)
2023-08-05 11:37:18,976 - distributed.utils_perf - WARNING - full garbage collections took 11% CPU time recently (threshold: 10%)
2023-08-05 11:37:32,032 - distributed.utils_perf - WARNING - full garbage collections took 10% CPU time recently (threshold: 10%)
[I 2023-08-05 11:37:34,100] Trial 99 finished with value: 0.9132753423353636 and parameters: {'max_depth': 7, 'max_features': 0.27905313108436003, 'n_estimators': 150, 'criterion': 'gini', 'min_samples_split': 3}. Best is trial 74 with value: 0.9240477087189687.
Time elapsed: 227551.446731752 sec
