[I 2023-06-29 12:42:20,249] Trial 28 finished with value: 0.9120315555424019 and parameters: {'max_depth': 5, 'max_features': 0.31092587750927847, 'n_estimators': 350, 'criterion': 'entropy', 'min_samples_split': 578}. Best is trial 16 with value: 0.9227844289727691.
2023-06-29 12:42:21,150 - distributed.utils_perf - WARNING - full garbage collections took 12% CPU time recently (threshold: 10%)
2023-06-29 12:42:22,513 - distributed.utils_perf - WARNING - full garbage collections took 12% CPU time recently (threshold: 10%)
2023-06-29 12:42:23,586 - distributed.utils_perf - WARNING - full garbage collections took 12% CPU time recently (threshold: 10%)
2023-06-29 12:42:27,864 - distributed.utils_perf - WARNING - full garbage collections took 12% CPU time recently (threshold: 10%)
2023-06-29 12:42:37,236 - distributed.utils_perf - WARNING - full garbage collections took 11% CPU time recently (threshold: 10%)
2023-06-29 12:42:46,366 - distributed.utils_perf - WARNING - full garbage collections took 12% CPU time recently (threshold: 10%)
2023-06-29 12:43:30,230 - distributed.utils_perf - WARNING - full garbage collections took 12% CPU time recently (threshold: 10%)
2023-06-29 12:44:06,301 - distributed.utils_perf - WARNING - full garbage collections took 12% CPU time recently (threshold: 10%)
2023-06-29 12:44:42,204 - distributed.utils_perf - WARNING - full garbage collections took 12% CPU time recently (threshold: 10%)
2023-06-29 12:46:16,079 - distributed.utils_perf - WARNING - full garbage collections took 12% CPU time recently (threshold: 10%)
2023-06-29 12:46:53,731 - distributed.utils_perf - WARNING - full garbage collections took 11% CPU time recently (threshold: 10%)
2023-06-29 12:48:17,974 - distributed.utils_perf - WARNING - full garbage collections took 11% CPU time recently (threshold: 10%)
2023-06-29 12:48:59,931 - distributed.utils_perf - WARNING - full garbage collections took 11% CPU time recently (threshold: 10%)
2023-06-29 12:49:35,705 - distributed.utils_perf - WARNING - full garbage collections took 11% CPU time recently (threshold: 10%)
2023-06-29 12:50:09,976 - distributed.utils_perf - WARNING - full garbage collections took 10% CPU time recently (threshold: 10%)
2023-06-29 12:50:14,229 - distributed.utils_perf - WARNING - full garbage collections took 11% CPU time recently (threshold: 10%)
2023-06-29 12:50:15,959 - distributed.utils_perf - WARNING - full garbage collections took 11% CPU time recently (threshold: 10%)
2023-06-29 12:50:17,067 - distributed.utils_perf - WARNING - full garbage collections took 11% CPU time recently (threshold: 10%)
2023-06-29 12:50:19,548 - distributed.utils_perf - WARNING - full garbage collections took 11% CPU time recently (threshold: 10%)
2023-06-29 12:50:23,962 - distributed.utils_perf - WARNING - full garbage collections took 11% CPU time recently (threshold: 10%)
2023-06-29 12:50:30,476 - distributed.utils_perf - WARNING - full garbage collections took 11% CPU time recently (threshold: 10%)
2023-06-29 12:51:30,268 - distributed.utils_perf - WARNING - full garbage collections took 11% CPU time recently (threshold: 10%)
2023-06-29 12:52:05,022 - distributed.utils_perf - WARNING - full garbage collections took 11% CPU time recently (threshold: 10%)
2023-06-29 12:53:30,145 - distributed.utils_perf - WARNING - full garbage collections took 11% CPU time recently (threshold: 10%)
2023-06-29 12:54:06,808 - distributed.utils_perf - WARNING - full garbage collections took 11% CPU time recently (threshold: 10%)
2023-06-29 12:54:46,489 - distributed.utils_perf - WARNING - full garbage collections took 11% CPU time recently (threshold: 10%)
2023-06-29 12:56:13,551 - distributed.utils_perf - WARNING - full garbage collections took 10% CPU time recently (threshold: 10%)
2023-06-29 12:56:48,881 - distributed.utils_perf - WARNING - full garbage collections took 10% CPU time recently (threshold: 10%)
2023-06-29 12:57:10,956 - distributed.utils_perf - WARNING - full garbage collections took 10% CPU time recently (threshold: 10%)
2023-06-29 12:57:43,972 - distributed.utils_perf - WARNING - full garbage collections took 10% CPU time recently (threshold: 10%)
2023-06-29 12:57:48,186 - distributed.utils_perf - WARNING - full garbage collections took 10% CPU time recently (threshold: 10%)
2023-06-29 12:57:50,813 - distributed.utils_perf - WARNING - full garbage collections took 10% CPU time recently (threshold: 10%)
2023-06-29 12:57:55,023 - distributed.utils_perf - WARNING - full garbage collections took 10% CPU time recently (threshold: 10%)
2023-06-29 12:57:59,746 - distributed.utils_perf - WARNING - full garbage collections took 10% CPU time recently (threshold: 10%)
2023-06-29 12:58:40,859 - distributed.utils_perf - WARNING - full garbage collections took 10% CPU time recently (threshold: 10%)
2023-06-29 12:59:20,136 - distributed.utils_perf - WARNING - full garbage collections took 10% CPU time recently (threshold: 10%)
2023-06-29 12:59:59,179 - distributed.utils_perf - WARNING - full garbage collections took 10% CPU time recently (threshold: 10%)
2023-06-29 13:05:29,437 - distributed.utils_perf - WARNING - full garbage collections took 10% CPU time recently (threshold: 10%)
2023-06-29 13:05:35,182 - distributed.utils_perf - WARNING - full garbage collections took 10% CPU time recently (threshold: 10%)
2023-06-29 13:05:40,601 - distributed.utils_perf - WARNING - full garbage collections took 10% CPU time recently (threshold: 10%)
2023-06-29 13:06:35,639 - distributed.utils_perf - WARNING - full garbage collections took 10% CPU time recently (threshold: 10%)
2023-06-29 13:07:10,600 - distributed.utils_perf - WARNING - full garbage collections took 10% CPU time recently (threshold: 10%)
[I 2023-06-29 13:20:26,051] Trial 29 finished with value: 0.9174171525248076 and parameters: {'max_depth': 12, 'max_features': 0.4510069427271216, 'n_estimators': 290, 'criterion': 'log_loss', 'min_samples_split': 590}. Best is trial 16 with value: 0.9227844289727691.
[I 2023-06-29 13:56:39,812] Trial 30 finished with value: 0.9163473416831899 and parameters: {'max_depth': 9, 'max_features': 0.9669362755966406, 'n_estimators': 170, 'criterion': 'log_loss', 'min_samples_split': 2}. Best is trial 16 with value: 0.9227844289727691.
[I 2023-06-29 14:26:39,154] Trial 31 finished with value: 0.922740369907374 and parameters: {'max_depth': 15, 'max_features': 0.8444039240536593, 'n_estimators': 100, 'criterion': 'entropy', 'min_samples_split': 290}. Best is trial 16 with value: 0.9227844289727691.
2023-06-29 14:42:54,355 - distributed.utils_perf - WARNING - full garbage collections took 10% CPU time recently (threshold: 10%)
2023-06-29 14:44:43,774 - distributed.utils_perf - WARNING - full garbage collections took 10% CPU time recently (threshold: 10%)
2023-06-29 14:45:28,183 - distributed.utils_perf - WARNING - full garbage collections took 10% CPU time recently (threshold: 10%)
[I 2023-06-29 15:28:49,620] Trial 32 finished with value: 0.9153677354454132 and parameters: {'max_depth': 8, 'max_features': 0.9460967341000305, 'n_estimators': 330, 'criterion': 'log_loss', 'min_samples_split': 30}. Best is trial 16 with value: 0.9227844289727691.
[I 2023-06-29 16:13:49,224] Trial 33 finished with value: 0.9184963442361921 and parameters: {'max_depth': 11, 'max_features': 0.8187432320368354, 'n_estimators': 210, 'criterion': 'entropy', 'min_samples_split': 71}. Best is trial 16 with value: 0.9227844289727691.
2023-06-29 16:28:31,775 - distributed.utils_perf - WARNING - full garbage collections took 10% CPU time recently (threshold: 10%)
[I 2023-06-29 16:56:30,969] Trial 34 finished with value: 0.9165796207843606 and parameters: {'max_depth': 9, 'max_features': 0.8266244759963572, 'n_estimators': 220, 'criterion': 'gini', 'min_samples_split': 252}. Best is trial 16 with value: 0.9227844289727691.
2023-06-29 17:02:38,716 - distributed.utils_perf - WARNING - full garbage collections took 10% CPU time recently (threshold: 10%)
2023-06-29 17:02:43,802 - distributed.utils_perf - WARNING - full garbage collections took 10% CPU time recently (threshold: 10%)
2023-06-29 17:02:49,049 - distributed.utils_perf - WARNING - full garbage collections took 10% CPU time recently (threshold: 10%)
2023-06-29 17:03:40,852 - distributed.utils_perf - WARNING - full garbage collections took 10% CPU time recently (threshold: 10%)
2023-06-29 17:05:13,661 - distributed.utils_perf - WARNING - full garbage collections took 10% CPU time recently (threshold: 10%)
2023-06-29 17:05:33,702 - distributed.utils_perf - WARNING - full garbage collections took 10% CPU time recently (threshold: 10%)
2023-06-29 17:05:41,809 - distributed.utils_perf - WARNING - full garbage collections took 10% CPU time recently (threshold: 10%)
2023-06-29 17:05:45,547 - distributed.utils_perf - WARNING - full garbage collections took 10% CPU time recently (threshold: 10%)
2023-06-29 17:05:46,839 - distributed.utils_perf - WARNING - full garbage collections took 10% CPU time recently (threshold: 10%)
2023-06-29 17:05:48,036 - distributed.utils_perf - WARNING - full garbage collections took 10% CPU time recently (threshold: 10%)
2023-06-29 17:05:53,673 - distributed.utils_perf - WARNING - full garbage collections took 10% CPU time recently (threshold: 10%)
2023-06-29 17:05:56,791 - distributed.utils_perf - WARNING - full garbage collections took 10% CPU time recently (threshold: 10%)
2023-06-29 17:06:39,923 - distributed.utils_perf - WARNING - full garbage collections took 10% CPU time recently (threshold: 10%)
2023-06-29 17:08:18,478 - distributed.utils_perf - WARNING - full garbage collections took 10% CPU time recently (threshold: 10%)
2023-06-29 17:08:38,248 - distributed.utils_perf - WARNING - full garbage collections took 11% CPU time recently (threshold: 10%)
2023-06-29 17:08:47,685 - distributed.utils_perf - WARNING - full garbage collections took 11% CPU time recently (threshold: 10%)
2023-06-29 17:08:51,732 - distributed.utils_perf - WARNING - full garbage collections took 11% CPU time recently (threshold: 10%)
2023-06-29 17:08:52,918 - distributed.utils_perf - WARNING - full garbage collections took 11% CPU time recently (threshold: 10%)
2023-06-29 17:08:54,198 - distributed.utils_perf - WARNING - full garbage collections took 11% CPU time recently (threshold: 10%)
2023-06-29 17:08:59,741 - distributed.utils_perf - WARNING - full garbage collections took 11% CPU time recently (threshold: 10%)
2023-06-29 17:09:03,296 - distributed.utils_perf - WARNING - full garbage collections took 11% CPU time recently (threshold: 10%)
2023-06-29 17:09:46,602 - distributed.utils_perf - WARNING - full garbage collections took 11% CPU time recently (threshold: 10%)
2023-06-29 17:11:24,359 - distributed.utils_perf - WARNING - full garbage collections took 11% CPU time recently (threshold: 10%)
2023-06-29 17:11:42,706 - distributed.utils_perf - WARNING - full garbage collections took 10% CPU time recently (threshold: 10%)
2023-06-29 17:11:51,235 - distributed.utils_perf - WARNING - full garbage collections took 10% CPU time recently (threshold: 10%)
[I 2023-06-29 17:11:52,055] Trial 35 finished with value: 0.9127120467931487 and parameters: {'max_depth': 11, 'max_features': 0.14851834486637766, 'n_estimators': 270, 'criterion': 'entropy', 'min_samples_split': 860}. Best is trial 16 with value: 0.9227844289727691.
2023-06-29 17:11:52,836 - distributed.utils_perf - WARNING - full garbage collections took 10% CPU time recently (threshold: 10%)
2023-06-29 17:11:54,110 - distributed.utils_perf - WARNING - full garbage collections took 10% CPU time recently (threshold: 10%)
2023-06-29 17:11:55,503 - distributed.utils_perf - WARNING - full garbage collections took 11% CPU time recently (threshold: 10%)
2023-06-29 17:11:57,861 - distributed.utils_perf - WARNING - full garbage collections took 11% CPU time recently (threshold: 10%)
2023-06-29 17:12:03,222 - distributed.utils_perf - WARNING - full garbage collections took 11% CPU time recently (threshold: 10%)
2023-06-29 17:12:14,081 - distributed.utils_perf - WARNING - full garbage collections took 11% CPU time recently (threshold: 10%)
2023-06-29 17:13:08,967 - distributed.utils_perf - WARNING - full garbage collections took 11% CPU time recently (threshold: 10%)
2023-06-29 17:13:47,265 - distributed.utils_perf - WARNING - full garbage collections took 10% CPU time recently (threshold: 10%)
2023-06-29 17:14:27,479 - distributed.utils_perf - WARNING - full garbage collections took 10% CPU time recently (threshold: 10%)
2023-06-29 17:15:04,647 - distributed.utils_perf - WARNING - full garbage collections took 10% CPU time recently (threshold: 10%)
2023-06-29 17:16:46,328 - distributed.utils_perf - WARNING - full garbage collections took 10% CPU time recently (threshold: 10%)
2023-06-29 17:17:24,568 - distributed.utils_perf - WARNING - full garbage collections took 10% CPU time recently (threshold: 10%)
2023-06-29 17:18:07,643 - distributed.utils_perf - WARNING - full garbage collections took 10% CPU time recently (threshold: 10%)
2023-06-29 17:18:54,100 - distributed.utils_perf - WARNING - full garbage collections took 10% CPU time recently (threshold: 10%)
2023-06-29 17:20:38,066 - distributed.utils_perf - WARNING - full garbage collections took 10% CPU time recently (threshold: 10%)
2023-06-29 17:40:26,557 - distributed.utils_perf - WARNING - full garbage collections took 10% CPU time recently (threshold: 10%)
2023-06-29 17:54:36,061 - distributed.utils_perf - WARNING - full garbage collections took 10% CPU time recently (threshold: 10%)
2023-06-29 17:54:41,333 - distributed.utils_perf - WARNING - full garbage collections took 10% CPU time recently (threshold: 10%)
2023-06-29 17:55:43,991 - distributed.utils_perf - WARNING - full garbage collections took 10% CPU time recently (threshold: 10%)
2023-06-29 17:56:27,964 - distributed.utils_perf - WARNING - full garbage collections took 10% CPU time recently (threshold: 10%)
2023-06-29 17:57:10,319 - distributed.utils_perf - WARNING - full garbage collections took 10% CPU time recently (threshold: 10%)
[I 2023-06-29 18:21:40,061] Trial 36 finished with value: 0.9167633825048036 and parameters: {'max_depth': 9, 'max_features': 0.9764051845224903, 'n_estimators': 340, 'criterion': 'gini', 'min_samples_split': 10}. Best is trial 16 with value: 0.9227844289727691.
[I 2023-06-29 19:51:39,287] Trial 37 finished with value: 0.9185226964995241 and parameters: {'max_depth': 11, 'max_features': 0.775019587332394, 'n_estimators': 450, 'criterion': 'log_loss', 'min_samples_split': 12}. Best is trial 16 with value: 0.9227844289727691.
2023-06-29 20:06:29,788 - distributed.utils_perf - WARNING - full garbage collections took 10% CPU time recently (threshold: 10%)
2023-06-29 20:06:51,183 - distributed.utils_perf - WARNING - full garbage collections took 10% CPU time recently (threshold: 10%)
2023-06-29 20:07:06,942 - distributed.utils_perf - WARNING - full garbage collections took 10% CPU time recently (threshold: 10%)
2023-06-29 20:07:08,801 - distributed.utils_perf - WARNING - full garbage collections took 10% CPU time recently (threshold: 10%)
[I 2023-06-29 20:29:26,552] Trial 38 finished with value: 0.918497679207168 and parameters: {'max_depth': 12, 'max_features': 0.5057865427720143, 'n_estimators': 250, 'criterion': 'gini', 'min_samples_split': 86}. Best is trial 16 with value: 0.9227844289727691.
[I 2023-06-29 21:41:38,490] Trial 39 finished with value: 0.9163392473659127 and parameters: {'max_depth': 9, 'max_features': 0.9764218701345271, 'n_estimators': 370, 'criterion': 'entropy', 'min_samples_split': 268}. Best is trial 16 with value: 0.9227844289727691.
2023-06-29 21:58:16,765 - distributed.utils_perf - WARNING - full garbage collections took 10% CPU time recently (threshold: 10%)
2023-06-29 21:58:37,364 - distributed.utils_perf - WARNING - full garbage collections took 10% CPU time recently (threshold: 10%)
2023-06-29 21:58:58,066 - distributed.utils_perf - WARNING - full garbage collections took 10% CPU time recently (threshold: 10%)
2023-06-29 21:59:16,276 - distributed.utils_perf - WARNING - full garbage collections took 10% CPU time recently (threshold: 10%)
2023-06-29 21:59:34,463 - distributed.utils_perf - WARNING - full garbage collections took 10% CPU time recently (threshold: 10%)
2023-06-29 21:59:52,647 - distributed.utils_perf - WARNING - full garbage collections took 10% CPU time recently (threshold: 10%)
2023-06-29 22:00:11,226 - distributed.utils_perf - WARNING - full garbage collections took 10% CPU time recently (threshold: 10%)
[I 2023-06-29 23:13:32,691] Trial 40 finished with value: 0.9223714924819063 and parameters: {'max_depth': 14, 'max_features': 0.9134577602437347, 'n_estimators': 370, 'criterion': 'log_loss', 'min_samples_split': 46}. Best is trial 16 with value: 0.9227844289727691.
2023-06-29 23:32:02,691 - distributed.utils_perf - WARNING - full garbage collections took 10% CPU time recently (threshold: 10%)
2023-06-29 23:32:35,439 - distributed.utils_perf - WARNING - full garbage collections took 10% CPU time recently (threshold: 10%)
[I 2023-06-30 00:21:13,521] Trial 41 finished with value: 0.9198392735405043 and parameters: {'max_depth': 13, 'max_features': 0.6152396654724457, 'n_estimators': 400, 'criterion': 'entropy', 'min_samples_split': 31}. Best is trial 16 with value: 0.9227844289727691.
2023-06-30 00:30:17,717 - distributed.utils_perf - WARNING - full garbage collections took 10% CPU time recently (threshold: 10%)
2023-06-30 00:30:22,034 - distributed.utils_perf - WARNING - full garbage collections took 10% CPU time recently (threshold: 10%)
2023-06-30 00:30:26,954 - distributed.utils_perf - WARNING - full garbage collections took 10% CPU time recently (threshold: 10%)
2023-06-30 00:31:16,463 - distributed.utils_perf - WARNING - full garbage collections took 10% CPU time recently (threshold: 10%)
2023-06-30 00:32:43,709 - distributed.utils_perf - WARNING - full garbage collections took 10% CPU time recently (threshold: 10%)
2023-06-30 00:33:02,998 - distributed.utils_perf - WARNING - full garbage collections took 10% CPU time recently (threshold: 10%)
2023-06-30 00:33:06,937 - distributed.utils_perf - WARNING - full garbage collections took 11% CPU time recently (threshold: 10%)
2023-06-30 00:33:08,350 - distributed.utils_perf - WARNING - full garbage collections took 11% CPU time recently (threshold: 10%)
2023-06-30 00:33:09,581 - distributed.utils_perf - WARNING - full garbage collections took 11% CPU time recently (threshold: 10%)
2023-06-30 00:33:12,946 - distributed.utils_perf - WARNING - full garbage collections took 11% CPU time recently (threshold: 10%)
2023-06-30 00:33:17,626 - distributed.utils_perf - WARNING - full garbage collections took 11% CPU time recently (threshold: 10%)
2023-06-30 00:33:24,469 - distributed.utils_perf - WARNING - full garbage collections took 11% CPU time recently (threshold: 10%)
2023-06-30 00:35:06,274 - distributed.utils_perf - WARNING - full garbage collections took 11% CPU time recently (threshold: 10%)
2023-06-30 00:35:57,394 - distributed.utils_perf - WARNING - full garbage collections took 10% CPU time recently (threshold: 10%)
2023-06-30 00:36:13,311 - distributed.utils_perf - WARNING - full garbage collections took 10% CPU time recently (threshold: 10%)
[I 2023-06-30 00:36:16,576] Trial 42 finished with value: 0.9123079591877066 and parameters: {'max_depth': 8, 'max_features': 0.16138841357503372, 'n_estimators': 250, 'criterion': 'entropy', 'min_samples_split': 294}. Best is trial 16 with value: 0.9227844289727691.
2023-06-30 00:36:17,235 - distributed.utils_perf - WARNING - full garbage collections took 10% CPU time recently (threshold: 10%)
2023-06-30 00:36:18,689 - distributed.utils_perf - WARNING - full garbage collections took 10% CPU time recently (threshold: 10%)
2023-06-30 00:36:19,957 - distributed.utils_perf - WARNING - full garbage collections took 11% CPU time recently (threshold: 10%)
2023-06-30 00:36:22,446 - distributed.utils_perf - WARNING - full garbage collections took 11% CPU time recently (threshold: 10%)
2023-06-30 00:36:27,604 - distributed.utils_perf - WARNING - full garbage collections took 11% CPU time recently (threshold: 10%)
2023-06-30 00:36:33,177 - distributed.utils_perf - WARNING - full garbage collections took 11% CPU time recently (threshold: 10%)
2023-06-30 00:37:24,752 - distributed.utils_perf - WARNING - full garbage collections took 11% CPU time recently (threshold: 10%)
2023-06-30 00:38:10,592 - distributed.utils_perf - WARNING - full garbage collections took 11% CPU time recently (threshold: 10%)
2023-06-30 00:38:50,106 - distributed.utils_perf - WARNING - full garbage collections took 11% CPU time recently (threshold: 10%)
2023-06-30 00:39:27,647 - distributed.utils_perf - WARNING - full garbage collections took 11% CPU time recently (threshold: 10%)
2023-06-30 00:40:12,555 - distributed.utils_perf - WARNING - full garbage collections took 11% CPU time recently (threshold: 10%)
2023-06-30 00:41:56,501 - distributed.utils_perf - WARNING - full garbage collections took 10% CPU time recently (threshold: 10%)
2023-06-30 00:42:39,696 - distributed.utils_perf - WARNING - full garbage collections took 10% CPU time recently (threshold: 10%)
2023-06-30 00:43:18,423 - distributed.utils_perf - WARNING - full garbage collections took 10% CPU time recently (threshold: 10%)
2023-06-30 00:44:04,363 - distributed.utils_perf - WARNING - full garbage collections took 10% CPU time recently (threshold: 10%)
2023-06-30 00:45:43,302 - distributed.utils_perf - WARNING - full garbage collections took 10% CPU time recently (threshold: 10%)
2023-06-30 00:46:26,827 - distributed.utils_perf - WARNING - full garbage collections took 10% CPU time recently (threshold: 10%)
2023-06-30 00:47:05,808 - distributed.utils_perf - WARNING - full garbage collections took 10% CPU time recently (threshold: 10%)
