[I 2023-06-29 07:56:30,725] Trial 18 finished with value: 0.9186434798875387 and parameters: {'max_depth': 11, 'max_features': 0.8578278031236451, 'n_estimators': 150, 'criterion': 'log_loss', 'min_samples_split': 58}. Best is trial 16 with value: 0.9227844289727691.
2023-06-29 08:06:12,834 - distributed.utils_perf - WARNING - full garbage collections took 10% CPU time recently (threshold: 10%)
2023-06-29 08:06:22,196 - distributed.utils_perf - WARNING - full garbage collections took 10% CPU time recently (threshold: 10%)
2023-06-29 08:06:31,316 - distributed.utils_perf - WARNING - full garbage collections took 10% CPU time recently (threshold: 10%)
2023-06-29 08:06:36,365 - distributed.utils_perf - WARNING - full garbage collections took 10% CPU time recently (threshold: 10%)
2023-06-29 08:07:27,227 - distributed.utils_perf - WARNING - full garbage collections took 11% CPU time recently (threshold: 10%)
2023-06-29 08:08:08,696 - distributed.utils_perf - WARNING - full garbage collections took 12% CPU time recently (threshold: 10%)
2023-06-29 08:09:33,692 - distributed.utils_perf - WARNING - full garbage collections took 11% CPU time recently (threshold: 10%)
2023-06-29 08:10:06,870 - distributed.utils_perf - WARNING - full garbage collections took 11% CPU time recently (threshold: 10%)
2023-06-29 08:10:26,246 - distributed.utils_perf - WARNING - full garbage collections took 11% CPU time recently (threshold: 10%)
2023-06-29 08:10:38,198 - distributed.utils_perf - WARNING - full garbage collections took 11% CPU time recently (threshold: 10%)
2023-06-29 08:10:43,874 - distributed.utils_perf - WARNING - full garbage collections took 11% CPU time recently (threshold: 10%)
2023-06-29 08:10:46,624 - distributed.utils_perf - WARNING - full garbage collections took 10% CPU time recently (threshold: 10%)
2023-06-29 08:10:48,283 - distributed.utils_perf - WARNING - full garbage collections took 10% CPU time recently (threshold: 10%)
2023-06-29 08:10:51,447 - distributed.utils_perf - WARNING - full garbage collections took 11% CPU time recently (threshold: 10%)
2023-06-29 08:10:55,539 - distributed.utils_perf - WARNING - full garbage collections took 11% CPU time recently (threshold: 10%)
2023-06-29 08:11:02,239 - distributed.utils_perf - WARNING - full garbage collections took 11% CPU time recently (threshold: 10%)
2023-06-29 08:12:04,269 - distributed.utils_perf - WARNING - full garbage collections took 11% CPU time recently (threshold: 10%)
2023-06-29 08:13:23,207 - distributed.utils_perf - WARNING - full garbage collections took 11% CPU time recently (threshold: 10%)
2023-06-29 08:14:09,938 - distributed.utils_perf - WARNING - full garbage collections took 11% CPU time recently (threshold: 10%)
2023-06-29 08:14:38,956 - distributed.utils_perf - WARNING - full garbage collections took 11% CPU time recently (threshold: 10%)
2023-06-29 08:14:50,541 - distributed.utils_perf - WARNING - full garbage collections took 11% CPU time recently (threshold: 10%)
2023-06-29 08:14:53,981 - distributed.utils_perf - WARNING - full garbage collections took 11% CPU time recently (threshold: 10%)
2023-06-29 08:14:55,100 - distributed.utils_perf - WARNING - full garbage collections took 11% CPU time recently (threshold: 10%)
2023-06-29 08:14:56,441 - distributed.utils_perf - WARNING - full garbage collections took 11% CPU time recently (threshold: 10%)
2023-06-29 08:15:02,229 - distributed.utils_perf - WARNING - full garbage collections took 11% CPU time recently (threshold: 10%)
2023-06-29 08:15:07,151 - distributed.utils_perf - WARNING - full garbage collections took 10% CPU time recently (threshold: 10%)
2023-06-29 08:16:07,653 - distributed.utils_perf - WARNING - full garbage collections took 10% CPU time recently (threshold: 10%)
2023-06-29 08:16:47,042 - distributed.utils_perf - WARNING - full garbage collections took 10% CPU time recently (threshold: 10%)
2023-06-29 08:18:05,044 - distributed.utils_perf - WARNING - full garbage collections took 10% CPU time recently (threshold: 10%)
2023-06-29 08:18:41,792 - distributed.utils_perf - WARNING - full garbage collections took 10% CPU time recently (threshold: 10%)
2023-06-29 08:19:06,151 - distributed.utils_perf - WARNING - full garbage collections took 10% CPU time recently (threshold: 10%)
2023-06-29 08:19:18,741 - distributed.utils_perf - WARNING - full garbage collections took 10% CPU time recently (threshold: 10%)
[I 2023-06-29 08:19:19,582] Trial 19 finished with value: 0.9131345847431886 and parameters: {'max_depth': 5, 'max_features': 0.8205694054125547, 'n_estimators': 190, 'criterion': 'log_loss', 'min_samples_split': 193}. Best is trial 16 with value: 0.9227844289727691.
2023-06-29 08:19:20,379 - distributed.utils_perf - WARNING - full garbage collections took 10% CPU time recently (threshold: 10%)
2023-06-29 08:19:21,749 - distributed.utils_perf - WARNING - full garbage collections took 11% CPU time recently (threshold: 10%)
2023-06-29 08:19:23,437 - distributed.utils_perf - WARNING - full garbage collections took 11% CPU time recently (threshold: 10%)
2023-06-29 08:19:26,792 - distributed.utils_perf - WARNING - full garbage collections took 11% CPU time recently (threshold: 10%)
2023-06-29 08:19:33,814 - distributed.utils_perf - WARNING - full garbage collections took 10% CPU time recently (threshold: 10%)
2023-06-29 08:19:40,000 - distributed.utils_perf - WARNING - full garbage collections took 10% CPU time recently (threshold: 10%)
2023-06-29 08:20:20,459 - distributed.utils_perf - WARNING - full garbage collections took 10% CPU time recently (threshold: 10%)
2023-06-29 08:21:07,448 - distributed.utils_perf - WARNING - full garbage collections took 10% CPU time recently (threshold: 10%)
2023-06-29 08:21:30,607 - distributed.utils_perf - WARNING - full garbage collections took 10% CPU time recently (threshold: 10%)
2023-06-29 08:21:35,139 - distributed.utils_perf - WARNING - full garbage collections took 10% CPU time recently (threshold: 10%)
2023-06-29 08:25:52,843 - distributed.utils_perf - WARNING - full garbage collections took 10% CPU time recently (threshold: 10%)
2023-06-29 08:25:57,311 - distributed.utils_perf - WARNING - full garbage collections took 10% CPU time recently (threshold: 10%)
2023-06-29 08:26:02,854 - distributed.utils_perf - WARNING - full garbage collections took 10% CPU time recently (threshold: 10%)
2023-06-29 08:27:04,250 - distributed.utils_perf - WARNING - full garbage collections took 10% CPU time recently (threshold: 10%)
2023-06-29 08:27:58,539 - distributed.utils_perf - WARNING - full garbage collections took 10% CPU time recently (threshold: 10%)
2023-06-29 08:28:04,635 - distributed.utils_perf - WARNING - full garbage collections took 10% CPU time recently (threshold: 10%)
2023-06-29 08:28:08,496 - distributed.utils_perf - WARNING - full garbage collections took 10% CPU time recently (threshold: 10%)
2023-06-29 08:28:56,159 - distributed.utils_perf - WARNING - full garbage collections took 10% CPU time recently (threshold: 10%)
[I 2023-06-29 08:30:05,357] Trial 20 finished with value: 0.91419002847895 and parameters: {'max_depth': 11, 'max_features': 0.2228097030946165, 'n_estimators': 120, 'criterion': 'gini', 'min_samples_split': 7}. Best is trial 16 with value: 0.9227844289727691.
2023-06-29 08:34:18,759 - distributed.utils_perf - WARNING - full garbage collections took 10% CPU time recently (threshold: 10%)
2023-06-29 08:34:23,924 - distributed.utils_perf - WARNING - full garbage collections took 10% CPU time recently (threshold: 10%)
2023-06-29 08:35:23,591 - distributed.utils_perf - WARNING - full garbage collections took 10% CPU time recently (threshold: 10%)
2023-06-29 08:36:07,471 - distributed.utils_perf - WARNING - full garbage collections took 10% CPU time recently (threshold: 10%)
2023-06-29 08:44:48,243 - distributed.utils_perf - WARNING - full garbage collections took 10% CPU time recently (threshold: 10%)
2023-06-29 08:45:24,768 - distributed.utils_perf - WARNING - full garbage collections took 10% CPU time recently (threshold: 10%)
[I 2023-06-29 08:50:39,948] Trial 21 finished with value: 0.9187032300096292 and parameters: {'max_depth': 12, 'max_features': 0.6037452838487282, 'n_estimators': 100, 'criterion': 'entropy', 'min_samples_split': 6}. Best is trial 16 with value: 0.9227844289727691.
2023-06-29 09:05:11,080 - distributed.utils_perf - WARNING - full garbage collections took 10% CPU time recently (threshold: 10%)
2023-06-29 09:05:45,591 - distributed.utils_perf - WARNING - full garbage collections took 10% CPU time recently (threshold: 10%)
2023-06-29 09:15:19,929 - distributed.utils_perf - WARNING - full garbage collections took 10% CPU time recently (threshold: 10%)
[I 2023-06-29 09:18:05,192] Trial 22 finished with value: 0.9146420001185641 and parameters: {'max_depth': 7, 'max_features': 0.7694432686675836, 'n_estimators': 180, 'criterion': 'entropy', 'min_samples_split': 7}. Best is trial 16 with value: 0.9227844289727691.
2023-06-29 09:19:17,687 - distributed.utils_perf - WARNING - full garbage collections took 10% CPU time recently (threshold: 10%)
2023-06-29 09:19:58,356 - distributed.utils_perf - WARNING - full garbage collections took 10% CPU time recently (threshold: 10%)
2023-06-29 09:30:21,607 - distributed.utils_perf - WARNING - full garbage collections took 10% CPU time recently (threshold: 10%)
2023-06-29 09:30:41,889 - distributed.utils_perf - WARNING - full garbage collections took 10% CPU time recently (threshold: 10%)
2023-06-29 09:48:14,147 - distributed.utils_perf - WARNING - full garbage collections took 10% CPU time recently (threshold: 10%)
2023-06-29 09:48:50,666 - distributed.utils_perf - WARNING - full garbage collections took 10% CPU time recently (threshold: 10%)
2023-06-29 09:50:36,886 - distributed.utils_perf - WARNING - full garbage collections took 10% CPU time recently (threshold: 10%)
2023-06-29 09:51:19,861 - distributed.utils_perf - WARNING - full garbage collections took 10% CPU time recently (threshold: 10%)
2023-06-29 09:52:50,321 - distributed.utils_perf - WARNING - full garbage collections took 10% CPU time recently (threshold: 10%)
2023-06-29 09:53:56,228 - distributed.utils_perf - WARNING - full garbage collections took 10% CPU time recently (threshold: 10%)
2023-06-29 09:54:45,580 - distributed.utils_perf - WARNING - full garbage collections took 10% CPU time recently (threshold: 10%)
2023-06-29 10:08:01,993 - distributed.utils_perf - WARNING - full garbage collections took 10% CPU time recently (threshold: 10%)
[I 2023-06-29 10:27:28,012] Trial 23 finished with value: 0.9173673321825214 and parameters: {'max_depth': 10, 'max_features': 0.6579601465432418, 'n_estimators': 430, 'criterion': 'gini', 'min_samples_split': 35}. Best is trial 16 with value: 0.9227844289727691.
[I 2023-06-29 11:03:23,328] Trial 24 finished with value: 0.9180408003595074 and parameters: {'max_depth': 11, 'max_features': 0.6119662933778331, 'n_estimators': 230, 'criterion': 'gini', 'min_samples_split': 54}. Best is trial 16 with value: 0.9227844289727691.
[I 2023-06-29 11:48:04,461] Trial 25 finished with value: 0.9206744083178448 and parameters: {'max_depth': 13, 'max_features': 0.7023096041078661, 'n_estimators': 200, 'criterion': 'log_loss', 'min_samples_split': 6}. Best is trial 16 with value: 0.9227844289727691.
2023-06-29 12:01:23,466 - distributed.utils_perf - WARNING - full garbage collections took 10% CPU time recently (threshold: 10%)
2023-06-29 12:01:24,925 - distributed.utils_perf - WARNING - full garbage collections took 10% CPU time recently (threshold: 10%)
2023-06-29 12:01:28,552 - distributed.utils_perf - WARNING - full garbage collections took 10% CPU time recently (threshold: 10%)
2023-06-29 12:01:33,048 - distributed.utils_perf - WARNING - full garbage collections took 10% CPU time recently (threshold: 10%)
2023-06-29 12:02:10,280 - distributed.utils_perf - WARNING - full garbage collections took 10% CPU time recently (threshold: 10%)
2023-06-29 12:02:45,217 - distributed.utils_perf - WARNING - full garbage collections took 10% CPU time recently (threshold: 10%)
2023-06-29 12:03:58,930 - distributed.utils_perf - WARNING - full garbage collections took 10% CPU time recently (threshold: 10%)
[I 2023-06-29 12:04:36,063] Trial 26 finished with value: 0.9151076785180086 and parameters: {'max_depth': 13, 'max_features': 0.15988283321870345, 'n_estimators': 200, 'criterion': 'gini', 'min_samples_split': 45}. Best is trial 16 with value: 0.9227844289727691.
2023-06-29 12:04:37,399 - distributed.utils_perf - WARNING - full garbage collections took 10% CPU time recently (threshold: 10%)
2023-06-29 12:04:38,498 - distributed.utils_perf - WARNING - full garbage collections took 10% CPU time recently (threshold: 10%)
2023-06-29 12:04:39,555 - distributed.utils_perf - WARNING - full garbage collections took 10% CPU time recently (threshold: 10%)
2023-06-29 12:04:43,781 - distributed.utils_perf - WARNING - full garbage collections took 10% CPU time recently (threshold: 10%)
2023-06-29 12:04:49,766 - distributed.utils_perf - WARNING - full garbage collections took 10% CPU time recently (threshold: 10%)
2023-06-29 12:05:37,971 - distributed.utils_perf - WARNING - full garbage collections took 11% CPU time recently (threshold: 10%)
2023-06-29 12:06:15,539 - distributed.utils_perf - WARNING - full garbage collections took 11% CPU time recently (threshold: 10%)
2023-06-29 12:07:07,055 - distributed.utils_perf - WARNING - full garbage collections took 10% CPU time recently (threshold: 10%)
2023-06-29 12:07:52,925 - distributed.utils_perf - WARNING - full garbage collections took 10% CPU time recently (threshold: 10%)
2023-06-29 12:08:06,726 - distributed.utils_perf - WARNING - full garbage collections took 10% CPU time recently (threshold: 10%)
2023-06-29 12:08:12,735 - distributed.utils_perf - WARNING - full garbage collections took 10% CPU time recently (threshold: 10%)
2023-06-29 12:09:15,996 - distributed.utils_perf - WARNING - full garbage collections took 10% CPU time recently (threshold: 10%)
2023-06-29 12:09:52,704 - distributed.utils_perf - WARNING - full garbage collections took 10% CPU time recently (threshold: 10%)
[I 2023-06-29 12:21:23,179] Trial 27 finished with value: 0.9182618114855791 and parameters: {'max_depth': 15, 'max_features': 0.3369670934383999, 'n_estimators': 120, 'criterion': 'log_loss', 'min_samples_split': 643}. Best is trial 16 with value: 0.9227844289727691.
2023-06-29 12:29:43,585 - distributed.utils_perf - WARNING - full garbage collections took 10% CPU time recently (threshold: 10%)
2023-06-29 12:29:45,282 - distributed.utils_perf - WARNING - full garbage collections took 10% CPU time recently (threshold: 10%)
2023-06-29 12:29:46,488 - distributed.utils_perf - WARNING - full garbage collections took 10% CPU time recently (threshold: 10%)
2023-06-29 12:29:49,776 - distributed.utils_perf - WARNING - full garbage collections took 10% CPU time recently (threshold: 10%)
2023-06-29 12:29:54,031 - distributed.utils_perf - WARNING - full garbage collections took 10% CPU time recently (threshold: 10%)
2023-06-29 12:30:00,793 - distributed.utils_perf - WARNING - full garbage collections took 10% CPU time recently (threshold: 10%)
2023-06-29 12:31:43,856 - distributed.utils_perf - WARNING - full garbage collections took 11% CPU time recently (threshold: 10%)
2023-06-29 12:33:29,486 - distributed.utils_perf - WARNING - full garbage collections took 12% CPU time recently (threshold: 10%)
2023-06-29 12:33:50,042 - distributed.utils_perf - WARNING - full garbage collections took 11% CPU time recently (threshold: 10%)
2023-06-29 12:33:54,537 - distributed.utils_perf - WARNING - full garbage collections took 11% CPU time recently (threshold: 10%)
2023-06-29 12:33:56,197 - distributed.utils_perf - WARNING - full garbage collections took 11% CPU time recently (threshold: 10%)
2023-06-29 12:33:57,407 - distributed.utils_perf - WARNING - full garbage collections took 11% CPU time recently (threshold: 10%)
2023-06-29 12:34:02,444 - distributed.utils_perf - WARNING - full garbage collections took 12% CPU time recently (threshold: 10%)
2023-06-29 12:34:10,811 - distributed.utils_perf - WARNING - full garbage collections took 12% CPU time recently (threshold: 10%)
2023-06-29 12:34:15,375 - distributed.utils_perf - WARNING - full garbage collections took 13% CPU time recently (threshold: 10%)
2023-06-29 12:35:02,231 - distributed.utils_perf - WARNING - full garbage collections took 13% CPU time recently (threshold: 10%)
2023-06-29 12:37:35,554 - distributed.utils_perf - WARNING - full garbage collections took 13% CPU time recently (threshold: 10%)
2023-06-29 12:37:58,741 - distributed.utils_perf - WARNING - full garbage collections took 12% CPU time recently (threshold: 10%)
2023-06-29 12:38:08,831 - distributed.utils_perf - WARNING - full garbage collections took 12% CPU time recently (threshold: 10%)
2023-06-29 12:38:11,567 - distributed.utils_perf - WARNING - full garbage collections took 12% CPU time recently (threshold: 10%)
2023-06-29 12:38:12,780 - distributed.utils_perf - WARNING - full garbage collections took 12% CPU time recently (threshold: 10%)
2023-06-29 12:38:13,925 - distributed.utils_perf - WARNING - full garbage collections took 12% CPU time recently (threshold: 10%)
2023-06-29 12:38:20,003 - distributed.utils_perf - WARNING - full garbage collections took 12% CPU time recently (threshold: 10%)
2023-06-29 12:38:25,086 - distributed.utils_perf - WARNING - full garbage collections took 12% CPU time recently (threshold: 10%)
2023-06-29 12:39:12,936 - distributed.utils_perf - WARNING - full garbage collections took 12% CPU time recently (threshold: 10%)
2023-06-29 12:41:24,826 - distributed.utils_perf - WARNING - full garbage collections took 12% CPU time recently (threshold: 10%)
2023-06-29 12:42:06,576 - distributed.utils_perf - WARNING - full garbage collections took 12% CPU time recently (threshold: 10%)
2023-06-29 12:42:16,831 - distributed.utils_perf - WARNING - full garbage collections took 12% CPU time recently (threshold: 10%)
