[I 2023-06-30 22:58:52,293] Trial 72 finished with value: 0.9173461234494373 and parameters: {'max_depth': 11, 'max_features': 0.47222777350104517, 'n_estimators': 430, 'criterion': 'entropy', 'min_samples_split': 63}. Best is trial 52 with value: 0.9230759308741325.
2023-06-30 23:01:07,004 - distributed.utils_perf - WARNING - full garbage collections took 10% CPU time recently (threshold: 10%)
2023-06-30 23:01:10,121 - distributed.utils_perf - WARNING - full garbage collections took 10% CPU time recently (threshold: 10%)
2023-06-30 23:01:12,300 - distributed.utils_perf - WARNING - full garbage collections took 10% CPU time recently (threshold: 10%)
2023-06-30 23:01:14,347 - distributed.utils_perf - WARNING - full garbage collections took 10% CPU time recently (threshold: 10%)
2023-06-30 23:01:20,799 - distributed.utils_perf - WARNING - full garbage collections took 11% CPU time recently (threshold: 10%)
2023-06-30 23:01:24,683 - distributed.utils_perf - WARNING - full garbage collections took 11% CPU time recently (threshold: 10%)
2023-06-30 23:02:01,999 - distributed.utils_perf - WARNING - full garbage collections took 11% CPU time recently (threshold: 10%)
2023-06-30 23:03:04,158 - distributed.utils_perf - WARNING - full garbage collections took 11% CPU time recently (threshold: 10%)
2023-06-30 23:03:13,382 - distributed.utils_perf - WARNING - full garbage collections took 11% CPU time recently (threshold: 10%)
2023-06-30 23:03:19,208 - distributed.utils_perf - WARNING - full garbage collections took 11% CPU time recently (threshold: 10%)
2023-06-30 23:03:21,724 - distributed.utils_perf - WARNING - full garbage collections took 11% CPU time recently (threshold: 10%)
2023-06-30 23:03:23,611 - distributed.utils_perf - WARNING - full garbage collections took 11% CPU time recently (threshold: 10%)
2023-06-30 23:03:28,101 - distributed.utils_perf - WARNING - full garbage collections took 11% CPU time recently (threshold: 10%)
2023-06-30 23:03:32,316 - distributed.utils_perf - WARNING - full garbage collections took 11% CPU time recently (threshold: 10%)
2023-06-30 23:04:10,257 - distributed.utils_perf - WARNING - full garbage collections took 11% CPU time recently (threshold: 10%)
2023-06-30 23:05:10,342 - distributed.utils_perf - WARNING - full garbage collections took 11% CPU time recently (threshold: 10%)
2023-06-30 23:05:18,400 - distributed.utils_perf - WARNING - full garbage collections took 11% CPU time recently (threshold: 10%)
2023-06-30 23:05:20,290 - distributed.utils_perf - WARNING - full garbage collections took 11% CPU time recently (threshold: 10%)
2023-06-30 23:05:21,503 - distributed.utils_perf - WARNING - full garbage collections took 11% CPU time recently (threshold: 10%)
2023-06-30 23:05:22,778 - distributed.utils_perf - WARNING - full garbage collections took 11% CPU time recently (threshold: 10%)
2023-06-30 23:05:30,095 - distributed.utils_perf - WARNING - full garbage collections took 11% CPU time recently (threshold: 10%)
2023-06-30 23:05:33,993 - distributed.utils_perf - WARNING - full garbage collections took 11% CPU time recently (threshold: 10%)
2023-06-30 23:06:17,465 - distributed.utils_perf - WARNING - full garbage collections took 12% CPU time recently (threshold: 10%)
2023-06-30 23:07:09,262 - distributed.utils_perf - WARNING - full garbage collections took 12% CPU time recently (threshold: 10%)
2023-06-30 23:07:12,817 - distributed.utils_perf - WARNING - full garbage collections took 12% CPU time recently (threshold: 10%)
2023-06-30 23:07:14,555 - distributed.utils_perf - WARNING - full garbage collections took 12% CPU time recently (threshold: 10%)
2023-06-30 23:07:15,791 - distributed.utils_perf - WARNING - full garbage collections took 13% CPU time recently (threshold: 10%)
2023-06-30 23:07:18,790 - distributed.utils_perf - WARNING - full garbage collections took 14% CPU time recently (threshold: 10%)
2023-06-30 23:07:23,327 - distributed.utils_perf - WARNING - full garbage collections took 14% CPU time recently (threshold: 10%)
2023-06-30 23:07:28,530 - distributed.utils_perf - WARNING - full garbage collections took 14% CPU time recently (threshold: 10%)
2023-06-30 23:08:55,042 - distributed.utils_perf - WARNING - full garbage collections took 14% CPU time recently (threshold: 10%)
2023-06-30 23:09:08,490 - distributed.utils_perf - WARNING - full garbage collections took 14% CPU time recently (threshold: 10%)
[I 2023-06-30 23:09:11,099] Trial 73 finished with value: 0.9128865507453039 and parameters: {'max_depth': 8, 'max_features': 0.15126795953454947, 'n_estimators': 190, 'criterion': 'gini', 'min_samples_split': 5}. Best is trial 52 with value: 0.9230759308741325.
2023-06-30 23:09:11,793 - distributed.utils_perf - WARNING - full garbage collections took 14% CPU time recently (threshold: 10%)
2023-06-30 23:09:13,195 - distributed.utils_perf - WARNING - full garbage collections took 14% CPU time recently (threshold: 10%)
2023-06-30 23:09:14,714 - distributed.utils_perf - WARNING - full garbage collections took 14% CPU time recently (threshold: 10%)
2023-06-30 23:09:17,335 - distributed.utils_perf - WARNING - full garbage collections took 13% CPU time recently (threshold: 10%)
2023-06-30 23:09:22,806 - distributed.utils_perf - WARNING - full garbage collections took 13% CPU time recently (threshold: 10%)
2023-06-30 23:10:00,195 - distributed.utils_perf - WARNING - full garbage collections took 14% CPU time recently (threshold: 10%)
2023-06-30 23:10:37,998 - distributed.utils_perf - WARNING - full garbage collections took 13% CPU time recently (threshold: 10%)
2023-06-30 23:11:22,623 - distributed.utils_perf - WARNING - full garbage collections took 13% CPU time recently (threshold: 10%)
2023-06-30 23:12:05,275 - distributed.utils_perf - WARNING - full garbage collections took 13% CPU time recently (threshold: 10%)
2023-06-30 23:12:44,380 - distributed.utils_perf - WARNING - full garbage collections took 13% CPU time recently (threshold: 10%)
2023-06-30 23:13:34,784 - distributed.utils_perf - WARNING - full garbage collections took 12% CPU time recently (threshold: 10%)
2023-06-30 23:15:17,427 - distributed.utils_perf - WARNING - full garbage collections took 12% CPU time recently (threshold: 10%)
2023-06-30 23:15:54,391 - distributed.utils_perf - WARNING - full garbage collections took 11% CPU time recently (threshold: 10%)
2023-06-30 23:16:30,292 - distributed.utils_perf - WARNING - full garbage collections took 11% CPU time recently (threshold: 10%)
2023-06-30 23:17:07,904 - distributed.utils_perf - WARNING - full garbage collections took 11% CPU time recently (threshold: 10%)
2023-06-30 23:18:53,755 - distributed.utils_perf - WARNING - full garbage collections took 11% CPU time recently (threshold: 10%)
2023-06-30 23:19:31,774 - distributed.utils_perf - WARNING - full garbage collections took 11% CPU time recently (threshold: 10%)
2023-06-30 23:20:13,062 - distributed.utils_perf - WARNING - full garbage collections took 10% CPU time recently (threshold: 10%)
2023-06-30 23:20:52,250 - distributed.utils_perf - WARNING - full garbage collections took 10% CPU time recently (threshold: 10%)
2023-06-30 23:22:33,459 - distributed.utils_perf - WARNING - full garbage collections took 10% CPU time recently (threshold: 10%)
2023-06-30 23:23:16,731 - distributed.utils_perf - WARNING - full garbage collections took 10% CPU time recently (threshold: 10%)
2023-06-30 23:23:54,823 - distributed.utils_perf - WARNING - full garbage collections took 10% CPU time recently (threshold: 10%)
2023-06-30 23:24:36,436 - distributed.utils_perf - WARNING - full garbage collections took 10% CPU time recently (threshold: 10%)
2023-06-30 23:25:36,780 - distributed.utils_perf - WARNING - full garbage collections took 10% CPU time recently (threshold: 10%)
2023-06-30 23:26:16,471 - distributed.utils_perf - WARNING - full garbage collections took 10% CPU time recently (threshold: 10%)
2023-06-30 23:26:34,986 - distributed.utils_perf - WARNING - full garbage collections took 10% CPU time recently (threshold: 10%)
[I 2023-07-01 00:47:03,822] Trial 74 finished with value: 0.9186716910882856 and parameters: {'max_depth': 11, 'max_features': 0.997078082687389, 'n_estimators': 430, 'criterion': 'entropy', 'min_samples_split': 72}. Best is trial 52 with value: 0.9230759308741325.
2023-07-01 00:50:14,547 - distributed.utils_perf - WARNING - full garbage collections took 10% CPU time recently (threshold: 10%)
2023-07-01 00:50:16,663 - distributed.utils_perf - WARNING - full garbage collections took 10% CPU time recently (threshold: 10%)
2023-07-01 00:50:21,331 - distributed.utils_perf - WARNING - full garbage collections took 10% CPU time recently (threshold: 10%)
2023-07-01 00:50:26,388 - distributed.utils_perf - WARNING - full garbage collections took 10% CPU time recently (threshold: 10%)
2023-07-01 00:51:29,474 - distributed.utils_perf - WARNING - full garbage collections took 10% CPU time recently (threshold: 10%)
2023-07-01 00:51:44,956 - distributed.utils_perf - WARNING - full garbage collections took 10% CPU time recently (threshold: 10%)
2023-07-01 00:51:47,932 - distributed.utils_perf - WARNING - full garbage collections took 10% CPU time recently (threshold: 10%)
2023-07-01 00:51:49,560 - distributed.utils_perf - WARNING - full garbage collections took 10% CPU time recently (threshold: 10%)
2023-07-01 00:51:50,770 - distributed.utils_perf - WARNING - full garbage collections took 11% CPU time recently (threshold: 10%)
2023-07-01 00:51:53,498 - distributed.utils_perf - WARNING - full garbage collections took 11% CPU time recently (threshold: 10%)
2023-07-01 00:51:57,771 - distributed.utils_perf - WARNING - full garbage collections took 11% CPU time recently (threshold: 10%)
2023-07-01 00:52:03,036 - distributed.utils_perf - WARNING - full garbage collections took 12% CPU time recently (threshold: 10%)
2023-07-01 00:53:05,731 - distributed.utils_perf - WARNING - full garbage collections took 12% CPU time recently (threshold: 10%)
2023-07-01 00:53:19,321 - distributed.utils_perf - WARNING - full garbage collections took 13% CPU time recently (threshold: 10%)
2023-07-01 00:53:22,583 - distributed.utils_perf - WARNING - full garbage collections took 13% CPU time recently (threshold: 10%)
2023-07-01 00:53:24,123 - distributed.utils_perf - WARNING - full garbage collections took 15% CPU time recently (threshold: 10%)
2023-07-01 00:53:25,356 - distributed.utils_perf - WARNING - full garbage collections took 15% CPU time recently (threshold: 10%)
2023-07-01 00:53:28,847 - distributed.utils_perf - WARNING - full garbage collections took 15% CPU time recently (threshold: 10%)
2023-07-01 00:53:33,526 - distributed.utils_perf - WARNING - full garbage collections took 15% CPU time recently (threshold: 10%)
2023-07-01 00:54:05,368 - distributed.utils_perf - WARNING - full garbage collections took 15% CPU time recently (threshold: 10%)
2023-07-01 00:54:37,430 - distributed.utils_perf - WARNING - full garbage collections took 15% CPU time recently (threshold: 10%)
2023-07-01 00:54:42,585 - distributed.utils_perf - WARNING - full garbage collections took 15% CPU time recently (threshold: 10%)
[I 2023-07-01 00:54:42,598] Trial 75 finished with value: 0.9120307389121013 and parameters: {'max_depth': 5, 'max_features': 0.1842193862357327, 'n_estimators': 120, 'criterion': 'log_loss', 'min_samples_split': 4}. Best is trial 52 with value: 0.9230759308741325.
2023-07-01 00:54:45,327 - distributed.utils_perf - WARNING - full garbage collections took 15% CPU time recently (threshold: 10%)
2023-07-01 00:54:47,867 - distributed.utils_perf - WARNING - full garbage collections took 15% CPU time recently (threshold: 10%)
2023-07-01 00:54:51,069 - distributed.utils_perf - WARNING - full garbage collections took 17% CPU time recently (threshold: 10%)
2023-07-01 00:54:59,554 - distributed.utils_perf - WARNING - full garbage collections took 17% CPU time recently (threshold: 10%)
2023-07-01 00:55:10,190 - distributed.utils_perf - WARNING - full garbage collections took 16% CPU time recently (threshold: 10%)
2023-07-01 00:55:15,512 - distributed.utils_perf - WARNING - full garbage collections took 16% CPU time recently (threshold: 10%)
2023-07-01 00:56:09,367 - distributed.utils_perf - WARNING - full garbage collections took 16% CPU time recently (threshold: 10%)
2023-07-01 00:56:52,590 - distributed.utils_perf - WARNING - full garbage collections took 15% CPU time recently (threshold: 10%)
2023-07-01 00:57:31,669 - distributed.utils_perf - WARNING - full garbage collections took 15% CPU time recently (threshold: 10%)
2023-07-01 00:58:10,915 - distributed.utils_perf - WARNING - full garbage collections took 14% CPU time recently (threshold: 10%)
2023-07-01 00:58:49,687 - distributed.utils_perf - WARNING - full garbage collections took 14% CPU time recently (threshold: 10%)
2023-07-01 01:00:36,663 - distributed.utils_perf - WARNING - full garbage collections took 13% CPU time recently (threshold: 10%)
2023-07-01 01:01:22,007 - distributed.utils_perf - WARNING - full garbage collections took 13% CPU time recently (threshold: 10%)
2023-07-01 01:02:03,927 - distributed.utils_perf - WARNING - full garbage collections took 12% CPU time recently (threshold: 10%)
2023-07-01 01:02:43,963 - distributed.utils_perf - WARNING - full garbage collections took 12% CPU time recently (threshold: 10%)
2023-07-01 01:03:30,179 - distributed.utils_perf - WARNING - full garbage collections took 12% CPU time recently (threshold: 10%)
2023-07-01 01:05:10,616 - distributed.utils_perf - WARNING - full garbage collections took 12% CPU time recently (threshold: 10%)
2023-07-01 01:05:55,589 - distributed.utils_perf - WARNING - full garbage collections took 12% CPU time recently (threshold: 10%)
2023-07-01 01:06:32,747 - distributed.utils_perf - WARNING - full garbage collections took 11% CPU time recently (threshold: 10%)
2023-07-01 01:07:10,596 - distributed.utils_perf - WARNING - full garbage collections took 11% CPU time recently (threshold: 10%)
2023-07-01 01:08:41,736 - distributed.utils_perf - WARNING - full garbage collections took 11% CPU time recently (threshold: 10%)
2023-07-01 01:09:41,999 - distributed.utils_perf - WARNING - full garbage collections took 11% CPU time recently (threshold: 10%)
2023-07-01 01:10:22,119 - distributed.utils_perf - WARNING - full garbage collections took 10% CPU time recently (threshold: 10%)
2023-07-01 01:11:02,247 - distributed.utils_perf - WARNING - full garbage collections took 10% CPU time recently (threshold: 10%)
2023-07-01 01:11:59,767 - distributed.utils_perf - WARNING - full garbage collections took 10% CPU time recently (threshold: 10%)
2023-07-01 01:12:53,722 - distributed.utils_perf - WARNING - full garbage collections took 10% CPU time recently (threshold: 10%)
2023-07-01 01:13:12,711 - distributed.utils_perf - WARNING - full garbage collections took 10% CPU time recently (threshold: 10%)
2023-07-01 01:13:31,164 - distributed.utils_perf - WARNING - full garbage collections took 10% CPU time recently (threshold: 10%)
[I 2023-07-01 02:35:57,273] Trial 76 finished with value: 0.9234791054625651 and parameters: {'max_depth': 15, 'max_features': 0.7907273819767118, 'n_estimators': 430, 'criterion': 'entropy', 'min_samples_split': 2}. Best is trial 76 with value: 0.9234791054625651.
2023-07-01 03:04:15,455 - distributed.utils_perf - WARNING - full garbage collections took 10% CPU time recently (threshold: 10%)
2023-07-01 03:04:20,871 - distributed.utils_perf - WARNING - full garbage collections took 10% CPU time recently (threshold: 10%)
2023-07-01 03:04:27,841 - distributed.utils_perf - WARNING - full garbage collections took 10% CPU time recently (threshold: 10%)
2023-07-01 03:04:32,674 - distributed.utils_perf - WARNING - full garbage collections took 10% CPU time recently (threshold: 10%)
2023-07-01 03:05:19,827 - distributed.utils_perf - WARNING - full garbage collections took 10% CPU time recently (threshold: 10%)
2023-07-01 03:06:01,219 - distributed.utils_perf - WARNING - full garbage collections took 10% CPU time recently (threshold: 10%)
2023-07-01 03:07:36,208 - distributed.utils_perf - WARNING - full garbage collections took 10% CPU time recently (threshold: 10%)
2023-07-01 03:08:15,927 - distributed.utils_perf - WARNING - full garbage collections took 10% CPU time recently (threshold: 10%)
2023-07-01 03:10:01,217 - distributed.utils_perf - WARNING - full garbage collections took 10% CPU time recently (threshold: 10%)
2023-07-01 03:10:44,611 - distributed.utils_perf - WARNING - full garbage collections took 10% CPU time recently (threshold: 10%)
2023-07-01 03:12:26,942 - distributed.utils_perf - WARNING - full garbage collections took 10% CPU time recently (threshold: 10%)
2023-07-01 03:13:11,116 - distributed.utils_perf - WARNING - full garbage collections took 10% CPU time recently (threshold: 10%)
2023-07-01 03:14:08,855 - distributed.utils_perf - WARNING - full garbage collections took 10% CPU time recently (threshold: 10%)
2023-07-01 03:14:16,586 - distributed.utils_perf - WARNING - full garbage collections took 10% CPU time recently (threshold: 10%)
2023-07-01 03:14:27,391 - distributed.utils_perf - WARNING - full garbage collections took 10% CPU time recently (threshold: 10%)
2023-07-01 03:14:31,014 - distributed.utils_perf - WARNING - full garbage collections took 10% CPU time recently (threshold: 10%)
2023-07-01 03:15:15,675 - distributed.utils_perf - WARNING - full garbage collections took 10% CPU time recently (threshold: 10%)
2023-07-01 03:15:54,662 - distributed.utils_perf - WARNING - full garbage collections took 10% CPU time recently (threshold: 10%)
2023-07-01 03:17:24,891 - distributed.utils_perf - WARNING - full garbage collections took 10% CPU time recently (threshold: 10%)
2023-07-01 03:18:05,230 - distributed.utils_perf - WARNING - full garbage collections took 10% CPU time recently (threshold: 10%)
2023-07-01 03:19:39,887 - distributed.utils_perf - WARNING - full garbage collections took 10% CPU time recently (threshold: 10%)
2023-07-01 03:20:23,823 - distributed.utils_perf - WARNING - full garbage collections took 10% CPU time recently (threshold: 10%)
2023-07-01 03:21:09,566 - distributed.utils_perf - WARNING - full garbage collections took 10% CPU time recently (threshold: 10%)
2023-07-01 03:22:46,859 - distributed.utils_perf - WARNING - full garbage collections took 10% CPU time recently (threshold: 10%)
2023-07-01 03:23:31,432 - distributed.utils_perf - WARNING - full garbage collections took 10% CPU time recently (threshold: 10%)
[I 2023-07-01 03:24:22,967] Trial 77 finished with value: 0.9153242547657016 and parameters: {'max_depth': 8, 'max_features': 0.5428646213442027, 'n_estimators': 390, 'criterion': 'gini', 'min_samples_split': 2}. Best is trial 76 with value: 0.9234791054625651.
2023-07-01 03:24:26,473 - distributed.utils_perf - WARNING - full garbage collections took 10% CPU time recently (threshold: 10%)
2023-07-01 03:24:29,141 - distributed.utils_perf - WARNING - full garbage collections took 10% CPU time recently (threshold: 10%)
2023-07-01 03:24:34,216 - distributed.utils_perf - WARNING - full garbage collections took 10% CPU time recently (threshold: 10%)
2023-07-01 03:24:39,340 - distributed.utils_perf - WARNING - full garbage collections took 10% CPU time recently (threshold: 10%)
2023-07-01 03:58:00,832 - distributed.utils_perf - WARNING - full garbage collections took 10% CPU time recently (threshold: 10%)
2023-07-01 03:59:33,653 - distributed.utils_perf - WARNING - full garbage collections took 10% CPU time recently (threshold: 10%)
2023-07-01 04:00:21,723 - distributed.utils_perf - WARNING - full garbage collections took 10% CPU time recently (threshold: 10%)
[I 2023-07-01 04:30:35,359] Trial 78 finished with value: 0.9184092359862539 and parameters: {'max_depth': 13, 'max_features': 0.3879575542699105, 'n_estimators': 500, 'criterion': 'log_loss', 'min_samples_split': 203}. Best is trial 76 with value: 0.9234791054625651.
2023-07-01 04:42:57,002 - distributed.utils_perf - WARNING - full garbage collections took 10% CPU time recently (threshold: 10%)
2023-07-01 04:43:47,273 - distributed.utils_perf - WARNING - full garbage collections took 10% CPU time recently (threshold: 10%)
2023-07-01 04:45:11,119 - distributed.utils_perf - WARNING - full garbage collections took 10% CPU time recently (threshold: 10%)
