[I 2023-07-01 04:45:48,175] Trial 79 finished with value: 0.9129142193275989 and parameters: {'max_depth': 10, 'max_features': 0.21234028880050865, 'n_estimators': 220, 'criterion': 'log_loss', 'min_samples_split': 4}. Best is trial 76 with value: 0.9234791054625651.
2023-07-01 04:45:58,552 - distributed.utils_perf - WARNING - full garbage collections took 10% CPU time recently (threshold: 10%)
2023-07-01 04:46:03,615 - distributed.utils_perf - WARNING - full garbage collections took 10% CPU time recently (threshold: 10%)
2023-07-01 04:47:15,639 - distributed.utils_perf - WARNING - full garbage collections took 10% CPU time recently (threshold: 10%)
2023-07-01 04:52:58,515 - distributed.utils_perf - WARNING - full garbage collections took 10% CPU time recently (threshold: 10%)
2023-07-01 04:57:03,573 - distributed.utils_perf - WARNING - full garbage collections took 10% CPU time recently (threshold: 10%)
2023-07-01 04:59:06,721 - distributed.utils_perf - WARNING - full garbage collections took 10% CPU time recently (threshold: 10%)
2023-07-01 04:59:59,203 - distributed.utils_perf - WARNING - full garbage collections took 10% CPU time recently (threshold: 10%)
2023-07-01 05:00:03,980 - distributed.utils_perf - WARNING - full garbage collections took 10% CPU time recently (threshold: 10%)
2023-07-01 05:00:09,062 - distributed.utils_perf - WARNING - full garbage collections took 10% CPU time recently (threshold: 10%)
2023-07-01 05:13:28,175 - distributed.utils_perf - WARNING - full garbage collections took 10% CPU time recently (threshold: 10%)
2023-07-01 05:14:10,344 - distributed.utils_perf - WARNING - full garbage collections took 10% CPU time recently (threshold: 10%)
2023-07-01 05:14:57,698 - distributed.utils_perf - WARNING - full garbage collections took 10% CPU time recently (threshold: 10%)
2023-07-01 05:15:02,316 - distributed.utils_perf - WARNING - full garbage collections took 10% CPU time recently (threshold: 10%)
2023-07-01 05:15:07,206 - distributed.utils_perf - WARNING - full garbage collections took 10% CPU time recently (threshold: 10%)
2023-07-01 05:16:06,400 - distributed.utils_perf - WARNING - full garbage collections took 10% CPU time recently (threshold: 10%)
2023-07-01 05:17:32,684 - distributed.utils_perf - WARNING - full garbage collections took 10% CPU time recently (threshold: 10%)
2023-07-01 05:19:00,863 - distributed.utils_perf - WARNING - full garbage collections took 10% CPU time recently (threshold: 10%)
2023-07-01 05:20:44,870 - distributed.utils_perf - WARNING - full garbage collections took 11% CPU time recently (threshold: 10%)
2023-07-01 05:21:33,845 - distributed.utils_perf - WARNING - full garbage collections took 10% CPU time recently (threshold: 10%)
2023-07-01 05:21:56,561 - distributed.utils_perf - WARNING - full garbage collections took 10% CPU time recently (threshold: 10%)
2023-07-01 05:22:01,490 - distributed.utils_perf - WARNING - full garbage collections took 10% CPU time recently (threshold: 10%)
[I 2023-07-01 05:22:02,252] Trial 80 finished with value: 0.9128453552756455 and parameters: {'max_depth': 5, 'max_features': 0.5671740899907906, 'n_estimators': 430, 'criterion': 'log_loss', 'min_samples_split': 28}. Best is trial 76 with value: 0.9234791054625651.
2023-07-01 05:22:03,253 - distributed.utils_perf - WARNING - full garbage collections took 10% CPU time recently (threshold: 10%)
2023-07-01 05:22:04,596 - distributed.utils_perf - WARNING - full garbage collections took 10% CPU time recently (threshold: 10%)
2023-07-01 05:22:05,854 - distributed.utils_perf - WARNING - full garbage collections took 10% CPU time recently (threshold: 10%)
2023-07-01 05:22:09,072 - distributed.utils_perf - WARNING - full garbage collections took 10% CPU time recently (threshold: 10%)
2023-07-01 05:22:14,482 - distributed.utils_perf - WARNING - full garbage collections took 10% CPU time recently (threshold: 10%)
2023-07-01 05:22:55,737 - distributed.utils_perf - WARNING - full garbage collections took 10% CPU time recently (threshold: 10%)
2023-07-01 05:23:34,638 - distributed.utils_perf - WARNING - full garbage collections took 10% CPU time recently (threshold: 10%)
2023-07-01 05:24:11,940 - distributed.utils_perf - WARNING - full garbage collections took 10% CPU time recently (threshold: 10%)
2023-07-01 05:24:47,332 - distributed.utils_perf - WARNING - full garbage collections took 11% CPU time recently (threshold: 10%)
2023-07-01 05:25:25,347 - distributed.utils_perf - WARNING - full garbage collections took 10% CPU time recently (threshold: 10%)
2023-07-01 05:25:54,636 - distributed.utils_perf - WARNING - full garbage collections took 10% CPU time recently (threshold: 10%)
2023-07-01 05:30:27,537 - distributed.utils_perf - WARNING - full garbage collections took 10% CPU time recently (threshold: 10%)
[I 2023-07-01 05:46:55,333] Trial 81 finished with value: 0.9225735539924272 and parameters: {'max_depth': 15, 'max_features': 0.6799249762812937, 'n_estimators': 100, 'criterion': 'entropy', 'min_samples_split': 102}. Best is trial 76 with value: 0.9234791054625651.
[I 2023-07-01 06:27:59,684] Trial 82 finished with value: 0.9189436881158048 and parameters: {'max_depth': 12, 'max_features': 0.6206496218102805, 'n_estimators': 210, 'criterion': 'entropy', 'min_samples_split': 392}. Best is trial 76 with value: 0.9234791054625651.
2023-07-01 06:41:10,771 - distributed.utils_perf - WARNING - full garbage collections took 10% CPU time recently (threshold: 10%)
2023-07-01 06:42:04,851 - distributed.utils_perf - WARNING - full garbage collections took 10% CPU time recently (threshold: 10%)
2023-07-01 06:42:46,543 - distributed.utils_perf - WARNING - full garbage collections took 10% CPU time recently (threshold: 10%)
2023-07-01 06:43:27,083 - distributed.utils_perf - WARNING - full garbage collections took 10% CPU time recently (threshold: 10%)
2023-07-01 06:45:02,300 - distributed.utils_perf - WARNING - full garbage collections took 10% CPU time recently (threshold: 10%)
2023-07-01 06:48:51,567 - distributed.utils_perf - WARNING - full garbage collections took 10% CPU time recently (threshold: 10%)
2023-07-01 06:49:33,162 - distributed.utils_perf - WARNING - full garbage collections took 10% CPU time recently (threshold: 10%)
[I 2023-07-01 07:01:07,476] Trial 83 finished with value: 0.9146588262613445 and parameters: {'max_depth': 7, 'max_features': 0.7725887292987309, 'n_estimators': 210, 'criterion': 'log_loss', 'min_samples_split': 15}. Best is trial 76 with value: 0.9234791054625651.
2023-07-01 07:15:51,383 - distributed.utils_perf - WARNING - full garbage collections took 10% CPU time recently (threshold: 10%)
2023-07-01 07:15:56,686 - distributed.utils_perf - WARNING - full garbage collections took 10% CPU time recently (threshold: 10%)
[I 2023-07-01 07:35:43,222] Trial 84 finished with value: 0.9146754479599309 and parameters: {'max_depth': 7, 'max_features': 0.7905560575795899, 'n_estimators': 220, 'criterion': 'entropy', 'min_samples_split': 6}. Best is trial 76 with value: 0.9234791054625651.
2023-07-01 07:44:04,873 - distributed.utils_perf - WARNING - full garbage collections took 10% CPU time recently (threshold: 10%)
2023-07-01 07:44:14,993 - distributed.utils_perf - WARNING - full garbage collections took 10% CPU time recently (threshold: 10%)
2023-07-01 07:44:18,775 - distributed.utils_perf - WARNING - full garbage collections took 10% CPU time recently (threshold: 10%)
2023-07-01 07:44:20,130 - distributed.utils_perf - WARNING - full garbage collections took 10% CPU time recently (threshold: 10%)
2023-07-01 07:44:21,259 - distributed.utils_perf - WARNING - full garbage collections took 10% CPU time recently (threshold: 10%)
2023-07-01 07:45:09,087 - distributed.utils_perf - WARNING - full garbage collections took 10% CPU time recently (threshold: 10%)
2023-07-01 07:47:13,415 - distributed.utils_perf - WARNING - full garbage collections took 10% CPU time recently (threshold: 10%)
2023-07-01 07:47:18,244 - distributed.utils_perf - WARNING - full garbage collections took 10% CPU time recently (threshold: 10%)
2023-07-01 07:47:50,797 - distributed.utils_perf - WARNING - full garbage collections took 11% CPU time recently (threshold: 10%)
2023-07-01 07:49:26,227 - distributed.utils_perf - WARNING - full garbage collections took 12% CPU time recently (threshold: 10%)
2023-07-01 07:49:46,833 - distributed.utils_perf - WARNING - full garbage collections took 11% CPU time recently (threshold: 10%)
2023-07-01 07:49:50,827 - distributed.utils_perf - WARNING - full garbage collections took 11% CPU time recently (threshold: 10%)
[I 2023-07-01 07:49:51,560] Trial 85 finished with value: 0.9121806644261294 and parameters: {'max_depth': 7, 'max_features': 0.2282665039892602, 'n_estimators': 250, 'criterion': 'log_loss', 'min_samples_split': 272}. Best is trial 76 with value: 0.9234791054625651.
2023-07-01 07:49:52,690 - distributed.utils_perf - WARNING - full garbage collections took 11% CPU time recently (threshold: 10%)
2023-07-01 07:49:54,037 - distributed.utils_perf - WARNING - full garbage collections took 11% CPU time recently (threshold: 10%)
2023-07-01 07:49:55,137 - distributed.utils_perf - WARNING - full garbage collections took 11% CPU time recently (threshold: 10%)
2023-07-01 07:49:58,457 - distributed.utils_perf - WARNING - full garbage collections took 12% CPU time recently (threshold: 10%)
2023-07-01 07:50:04,050 - distributed.utils_perf - WARNING - full garbage collections took 12% CPU time recently (threshold: 10%)
2023-07-01 07:50:43,288 - distributed.utils_perf - WARNING - full garbage collections took 12% CPU time recently (threshold: 10%)
2023-07-01 07:51:57,574 - distributed.utils_perf - WARNING - full garbage collections took 12% CPU time recently (threshold: 10%)
2023-07-01 07:52:16,171 - distributed.utils_perf - WARNING - full garbage collections took 11% CPU time recently (threshold: 10%)
2023-07-01 07:52:19,646 - distributed.utils_perf - WARNING - full garbage collections took 11% CPU time recently (threshold: 10%)
2023-07-01 07:52:21,240 - distributed.utils_perf - WARNING - full garbage collections took 12% CPU time recently (threshold: 10%)
2023-07-01 07:52:22,410 - distributed.utils_perf - WARNING - full garbage collections took 13% CPU time recently (threshold: 10%)
2023-07-01 07:52:26,208 - distributed.utils_perf - WARNING - full garbage collections took 13% CPU time recently (threshold: 10%)
2023-07-01 07:52:30,404 - distributed.utils_perf - WARNING - full garbage collections took 12% CPU time recently (threshold: 10%)
2023-07-01 07:52:35,721 - distributed.utils_perf - WARNING - full garbage collections took 12% CPU time recently (threshold: 10%)
2023-07-01 07:54:06,843 - distributed.utils_perf - WARNING - full garbage collections took 12% CPU time recently (threshold: 10%)
2023-07-01 07:54:29,295 - distributed.utils_perf - WARNING - full garbage collections took 11% CPU time recently (threshold: 10%)
2023-07-01 07:54:36,569 - distributed.utils_perf - WARNING - full garbage collections took 11% CPU time recently (threshold: 10%)
2023-07-01 07:54:38,450 - distributed.utils_perf - WARNING - full garbage collections took 11% CPU time recently (threshold: 10%)
2023-07-01 07:54:39,735 - distributed.utils_perf - WARNING - full garbage collections took 12% CPU time recently (threshold: 10%)
2023-07-01 07:54:40,919 - distributed.utils_perf - WARNING - full garbage collections took 13% CPU time recently (threshold: 10%)
2023-07-01 07:54:46,877 - distributed.utils_perf - WARNING - full garbage collections took 13% CPU time recently (threshold: 10%)
2023-07-01 07:54:52,092 - distributed.utils_perf - WARNING - full garbage collections took 12% CPU time recently (threshold: 10%)
2023-07-01 07:55:47,849 - distributed.utils_perf - WARNING - full garbage collections took 12% CPU time recently (threshold: 10%)
2023-07-01 07:56:47,090 - distributed.utils_perf - WARNING - full garbage collections took 11% CPU time recently (threshold: 10%)
2023-07-01 07:56:57,371 - distributed.utils_perf - WARNING - full garbage collections took 11% CPU time recently (threshold: 10%)
2023-07-01 07:57:00,460 - distributed.utils_perf - WARNING - full garbage collections took 11% CPU time recently (threshold: 10%)
2023-07-01 07:57:01,715 - distributed.utils_perf - WARNING - full garbage collections took 12% CPU time recently (threshold: 10%)
2023-07-01 07:57:02,976 - distributed.utils_perf - WARNING - full garbage collections took 12% CPU time recently (threshold: 10%)
2023-07-01 07:57:08,783 - distributed.utils_perf - WARNING - full garbage collections took 12% CPU time recently (threshold: 10%)
2023-07-01 07:57:13,830 - distributed.utils_perf - WARNING - full garbage collections took 12% CPU time recently (threshold: 10%)
2023-07-01 07:58:07,634 - distributed.utils_perf - WARNING - full garbage collections took 12% CPU time recently (threshold: 10%)
2023-07-01 07:59:09,403 - distributed.utils_perf - WARNING - full garbage collections took 11% CPU time recently (threshold: 10%)
2023-07-01 07:59:22,029 - distributed.utils_perf - WARNING - full garbage collections took 11% CPU time recently (threshold: 10%)
2023-07-01 07:59:25,336 - distributed.utils_perf - WARNING - full garbage collections took 11% CPU time recently (threshold: 10%)
2023-07-01 07:59:26,772 - distributed.utils_perf - WARNING - full garbage collections took 11% CPU time recently (threshold: 10%)
2023-07-01 07:59:28,018 - distributed.utils_perf - WARNING - full garbage collections took 11% CPU time recently (threshold: 10%)
2023-07-01 07:59:32,902 - distributed.utils_perf - WARNING - full garbage collections took 11% CPU time recently (threshold: 10%)
2023-07-01 07:59:36,946 - distributed.utils_perf - WARNING - full garbage collections took 11% CPU time recently (threshold: 10%)
2023-07-01 08:00:20,944 - distributed.utils_perf - WARNING - full garbage collections took 12% CPU time recently (threshold: 10%)
2023-07-01 08:01:30,656 - distributed.utils_perf - WARNING - full garbage collections took 12% CPU time recently (threshold: 10%)
2023-07-01 08:01:50,261 - distributed.utils_perf - WARNING - full garbage collections took 11% CPU time recently (threshold: 10%)
2023-07-01 08:01:53,936 - distributed.utils_perf - WARNING - full garbage collections took 11% CPU time recently (threshold: 10%)
[I 2023-07-01 08:01:54,434] Trial 86 finished with value: 0.9126486503545668 and parameters: {'max_depth': 5, 'max_features': 0.30853207943721284, 'n_estimators': 180, 'criterion': 'gini', 'min_samples_split': 11}. Best is trial 76 with value: 0.9234791054625651.
2023-07-01 08:01:55,801 - distributed.utils_perf - WARNING - full garbage collections took 11% CPU time recently (threshold: 10%)
2023-07-01 08:01:56,923 - distributed.utils_perf - WARNING - full garbage collections took 11% CPU time recently (threshold: 10%)
2023-07-01 08:01:58,368 - distributed.utils_perf - WARNING - full garbage collections took 11% CPU time recently (threshold: 10%)
2023-07-01 08:02:03,782 - distributed.utils_perf - WARNING - full garbage collections took 11% CPU time recently (threshold: 10%)
2023-07-01 08:02:08,743 - distributed.utils_perf - WARNING - full garbage collections took 12% CPU time recently (threshold: 10%)
2023-07-01 08:03:01,260 - distributed.utils_perf - WARNING - full garbage collections took 12% CPU time recently (threshold: 10%)
2023-07-01 08:03:39,424 - distributed.utils_perf - WARNING - full garbage collections took 11% CPU time recently (threshold: 10%)
2023-07-01 08:04:14,988 - distributed.utils_perf - WARNING - full garbage collections took 11% CPU time recently (threshold: 10%)
2023-07-01 08:04:49,410 - distributed.utils_perf - WARNING - full garbage collections took 11% CPU time recently (threshold: 10%)
2023-07-01 08:06:22,535 - distributed.utils_perf - WARNING - full garbage collections took 10% CPU time recently (threshold: 10%)
2023-07-01 08:06:59,351 - distributed.utils_perf - WARNING - full garbage collections took 10% CPU time recently (threshold: 10%)
2023-07-01 08:08:44,771 - distributed.utils_perf - WARNING - full garbage collections took 11% CPU time recently (threshold: 10%)
2023-07-01 08:09:29,780 - distributed.utils_perf - WARNING - full garbage collections took 10% CPU time recently (threshold: 10%)
2023-07-01 08:10:19,916 - distributed.utils_perf - WARNING - full garbage collections took 10% CPU time recently (threshold: 10%)
2023-07-01 08:11:53,667 - distributed.utils_perf - WARNING - full garbage collections took 10% CPU time recently (threshold: 10%)
2023-07-01 08:12:40,020 - distributed.utils_perf - WARNING - full garbage collections took 10% CPU time recently (threshold: 10%)
2023-07-01 08:14:13,454 - distributed.utils_perf - WARNING - full garbage collections took 10% CPU time recently (threshold: 10%)
2023-07-01 08:14:43,897 - distributed.utils_perf - WARNING - full garbage collections took 10% CPU time recently (threshold: 10%)
2023-07-01 08:15:02,980 - distributed.utils_perf - WARNING - full garbage collections took 10% CPU time recently (threshold: 10%)
2023-07-01 08:15:22,380 - distributed.utils_perf - WARNING - full garbage collections took 10% CPU time recently (threshold: 10%)
2023-07-01 08:15:56,844 - distributed.utils_perf - WARNING - full garbage collections took 10% CPU time recently (threshold: 10%)
2023-07-01 08:15:57,982 - distributed.utils_perf - WARNING - full garbage collections took 10% CPU time recently (threshold: 10%)
2023-07-01 08:16:00,815 - distributed.utils_perf - WARNING - full garbage collections took 10% CPU time recently (threshold: 10%)
2023-07-01 08:16:06,268 - distributed.utils_perf - WARNING - full garbage collections took 10% CPU time recently (threshold: 10%)
2023-07-01 08:16:10,953 - distributed.utils_perf - WARNING - full garbage collections took 10% CPU time recently (threshold: 10%)
2023-07-01 08:17:09,770 - distributed.utils_perf - WARNING - full garbage collections took 10% CPU time recently (threshold: 10%)
2023-07-01 08:17:51,483 - distributed.utils_perf - WARNING - full garbage collections took 10% CPU time recently (threshold: 10%)
2023-07-01 08:18:26,050 - distributed.utils_perf - WARNING - full garbage collections took 10% CPU time recently (threshold: 10%)
2023-07-01 08:20:03,217 - distributed.utils_perf - WARNING - full garbage collections took 10% CPU time recently (threshold: 10%)
2023-07-01 08:20:45,787 - distributed.utils_perf - WARNING - full garbage collections took 10% CPU time recently (threshold: 10%)
2023-07-01 08:48:25,548 - distributed.utils_perf - WARNING - full garbage collections took 10% CPU time recently (threshold: 10%)
2023-07-01 08:49:03,445 - distributed.utils_perf - WARNING - full garbage collections took 10% CPU time recently (threshold: 10%)
2023-07-01 08:58:15,535 - distributed.utils_perf - WARNING - full garbage collections took 10% CPU time recently (threshold: 10%)
2023-07-01 08:58:20,573 - distributed.utils_perf - WARNING - full garbage collections took 10% CPU time recently (threshold: 10%)
2023-07-01 08:59:24,635 - distributed.utils_perf - WARNING - full garbage collections took 10% CPU time recently (threshold: 10%)
2023-07-01 09:00:04,827 - distributed.utils_perf - WARNING - full garbage collections took 10% CPU time recently (threshold: 10%)
2023-07-01 09:00:43,651 - distributed.utils_perf - WARNING - full garbage collections took 10% CPU time recently (threshold: 10%)
2023-07-01 09:02:23,589 - distributed.utils_perf - WARNING - full garbage collections took 10% CPU time recently (threshold: 10%)
[I 2023-07-01 09:12:02,923] Trial 87 finished with value: 0.9192427393045796 and parameters: {'max_depth': 14, 'max_features': 0.491775361866568, 'n_estimators': 470, 'criterion': 'gini', 'min_samples_split': 856}. Best is trial 76 with value: 0.9234791054625651.
2023-07-01 09:15:10,936 - distributed.utils_perf - WARNING - full garbage collections took 10% CPU time recently (threshold: 10%)
2023-07-01 09:15:15,635 - distributed.utils_perf - WARNING - full garbage collections took 10% CPU time recently (threshold: 10%)
2023-07-01 09:15:20,569 - distributed.utils_perf - WARNING - full garbage collections took 10% CPU time recently (threshold: 10%)
2023-07-01 09:22:19,774 - distributed.utils_perf - WARNING - full garbage collections took 10% CPU time recently (threshold: 10%)
2023-07-01 09:24:34,917 - distributed.utils_perf - WARNING - full garbage collections took 10% CPU time recently (threshold: 10%)
2023-07-01 09:24:38,526 - distributed.utils_perf - WARNING - full garbage collections took 10% CPU time recently (threshold: 10%)
2023-07-01 09:24:39,587 - distributed.utils_perf - WARNING - full garbage collections took 10% CPU time recently (threshold: 10%)
2023-07-01 09:24:41,193 - distributed.utils_perf - WARNING - full garbage collections took 11% CPU time recently (threshold: 10%)
2023-07-01 09:24:46,497 - distributed.utils_perf - WARNING - full garbage collections took 11% CPU time recently (threshold: 10%)
2023-07-01 09:24:51,651 - distributed.utils_perf - WARNING - full garbage collections took 11% CPU time recently (threshold: 10%)
2023-07-01 09:25:46,260 - distributed.utils_perf - WARNING - full garbage collections took 11% CPU time recently (threshold: 10%)
2023-07-01 09:27:22,589 - distributed.utils_perf - WARNING - full garbage collections took 10% CPU time recently (threshold: 10%)
2023-07-01 09:27:42,364 - distributed.utils_perf - WARNING - full garbage collections took 10% CPU time recently (threshold: 10%)
2023-07-01 09:27:46,375 - distributed.utils_perf - WARNING - full garbage collections took 10% CPU time recently (threshold: 10%)
