[I 2023-07-01 12:11:13,657] Trial 93 finished with value: 0.9137933330488425 and parameters: {'max_depth': 6, 'max_features': 0.8087966556872564, 'n_estimators': 140, 'criterion': 'gini', 'min_samples_split': 2}. Best is trial 76 with value: 0.9234791054625651.
2023-07-01 12:11:15,686 - distributed.utils_perf - WARNING - full garbage collections took 10% CPU time recently (threshold: 10%)
2023-07-01 12:11:17,574 - distributed.utils_perf - WARNING - full garbage collections took 10% CPU time recently (threshold: 10%)
2023-07-01 12:11:19,549 - distributed.utils_perf - WARNING - full garbage collections took 10% CPU time recently (threshold: 10%)
2023-07-01 12:11:27,552 - distributed.utils_perf - WARNING - full garbage collections took 10% CPU time recently (threshold: 10%)
2023-07-01 12:11:37,134 - distributed.utils_perf - WARNING - full garbage collections took 11% CPU time recently (threshold: 10%)
2023-07-01 12:11:46,303 - distributed.utils_perf - WARNING - full garbage collections took 11% CPU time recently (threshold: 10%)
2023-07-01 12:12:26,012 - distributed.utils_perf - WARNING - full garbage collections took 11% CPU time recently (threshold: 10%)
2023-07-01 12:13:07,900 - distributed.utils_perf - WARNING - full garbage collections took 11% CPU time recently (threshold: 10%)
2023-07-01 12:14:42,296 - distributed.utils_perf - WARNING - full garbage collections took 11% CPU time recently (threshold: 10%)
2023-07-01 12:16:13,883 - distributed.utils_perf - WARNING - full garbage collections took 10% CPU time recently (threshold: 10%)
2023-07-01 12:16:54,596 - distributed.utils_perf - WARNING - full garbage collections took 10% CPU time recently (threshold: 10%)
2023-07-01 12:17:14,557 - distributed.utils_perf - WARNING - full garbage collections took 10% CPU time recently (threshold: 10%)
2023-07-01 12:17:32,595 - distributed.utils_perf - WARNING - full garbage collections took 10% CPU time recently (threshold: 10%)
2023-07-01 12:17:43,283 - distributed.utils_perf - WARNING - full garbage collections took 10% CPU time recently (threshold: 10%)
2023-07-01 12:17:47,539 - distributed.utils_perf - WARNING - full garbage collections took 10% CPU time recently (threshold: 10%)
2023-07-01 12:17:54,327 - distributed.utils_perf - WARNING - full garbage collections took 10% CPU time recently (threshold: 10%)
2023-07-01 12:17:59,038 - distributed.utils_perf - WARNING - full garbage collections took 10% CPU time recently (threshold: 10%)
2023-07-01 12:18:37,919 - distributed.utils_perf - WARNING - full garbage collections took 10% CPU time recently (threshold: 10%)
2023-07-01 12:19:16,617 - distributed.utils_perf - WARNING - full garbage collections took 10% CPU time recently (threshold: 10%)
2023-07-01 12:20:36,331 - distributed.utils_perf - WARNING - full garbage collections took 10% CPU time recently (threshold: 10%)
2023-07-01 12:21:59,988 - distributed.utils_perf - WARNING - full garbage collections took 10% CPU time recently (threshold: 10%)
2023-07-01 12:22:49,340 - distributed.utils_perf - WARNING - full garbage collections took 10% CPU time recently (threshold: 10%)
2023-07-01 12:23:45,331 - distributed.utils_perf - WARNING - full garbage collections took 10% CPU time recently (threshold: 10%)
2023-07-01 12:24:42,959 - distributed.utils_perf - WARNING - full garbage collections took 10% CPU time recently (threshold: 10%)
2023-07-01 12:26:05,801 - distributed.utils_perf - WARNING - full garbage collections took 10% CPU time recently (threshold: 10%)
2023-07-01 12:26:49,880 - distributed.utils_perf - WARNING - full garbage collections took 10% CPU time recently (threshold: 10%)
2023-07-01 12:28:16,953 - distributed.utils_perf - WARNING - full garbage collections took 10% CPU time recently (threshold: 10%)
[I 2023-07-01 12:41:15,090] Trial 94 finished with value: 0.9167605146618358 and parameters: {'max_depth': 13, 'max_features': 0.27064535303646686, 'n_estimators': 310, 'criterion': 'gini', 'min_samples_split': 6}. Best is trial 76 with value: 0.9234791054625651.
[I 2023-07-01 13:19:32,600] Trial 95 finished with value: 0.9208390606453596 and parameters: {'max_depth': 13, 'max_features': 0.7506236742005923, 'n_estimators': 170, 'criterion': 'gini', 'min_samples_split': 57}. Best is trial 76 with value: 0.9234791054625651.
2023-07-01 13:34:18,703 - distributed.utils_perf - WARNING - full garbage collections took 10% CPU time recently (threshold: 10%)
2023-07-01 13:35:18,375 - distributed.utils_perf - WARNING - full garbage collections took 10% CPU time recently (threshold: 10%)
2023-07-01 13:36:00,876 - distributed.utils_perf - WARNING - full garbage collections took 10% CPU time recently (threshold: 10%)
2023-07-01 13:36:45,546 - distributed.utils_perf - WARNING - full garbage collections took 10% CPU time recently (threshold: 10%)
2023-07-01 13:38:26,934 - distributed.utils_perf - WARNING - full garbage collections took 10% CPU time recently (threshold: 10%)
2023-07-01 13:39:09,542 - distributed.utils_perf - WARNING - full garbage collections took 10% CPU time recently (threshold: 10%)
2023-07-01 13:39:46,635 - distributed.utils_perf - WARNING - full garbage collections took 10% CPU time recently (threshold: 10%)
2023-07-01 13:41:26,306 - distributed.utils_perf - WARNING - full garbage collections took 10% CPU time recently (threshold: 10%)
2023-07-01 13:42:09,287 - distributed.utils_perf - WARNING - full garbage collections took 10% CPU time recently (threshold: 10%)
2023-07-01 13:45:55,367 - distributed.utils_perf - WARNING - full garbage collections took 10% CPU time recently (threshold: 10%)
2023-07-01 14:20:31,246 - distributed.utils_perf - WARNING - full garbage collections took 10% CPU time recently (threshold: 10%)
2023-07-01 14:21:14,272 - distributed.utils_perf - WARNING - full garbage collections took 10% CPU time recently (threshold: 10%)
2023-07-01 14:22:56,684 - distributed.utils_perf - WARNING - full garbage collections took 10% CPU time recently (threshold: 10%)
[I 2023-07-01 14:28:40,183] Trial 96 finished with value: 0.9165948197573137 and parameters: {'max_depth': 9, 'max_features': 0.782872237920103, 'n_estimators': 390, 'criterion': 'gini', 'min_samples_split': 651}. Best is trial 76 with value: 0.9234791054625651.
[I 2023-07-01 15:37:39,629] Trial 97 finished with value: 0.9215610548636579 and parameters: {'max_depth': 14, 'max_features': 0.7559657897673303, 'n_estimators': 310, 'criterion': 'entropy', 'min_samples_split': 225}. Best is trial 76 with value: 0.9234791054625651.
2023-07-01 15:59:00,693 - distributed.utils_perf - WARNING - full garbage collections took 10% CPU time recently (threshold: 10%)
2023-07-01 15:59:35,334 - distributed.utils_perf - WARNING - full garbage collections took 10% CPU time recently (threshold: 10%)
2023-07-01 16:00:15,472 - distributed.utils_perf - WARNING - full garbage collections took 10% CPU time recently (threshold: 10%)
2023-07-01 16:01:59,250 - distributed.utils_perf - WARNING - full garbage collections took 10% CPU time recently (threshold: 10%)
2023-07-01 16:02:40,087 - distributed.utils_perf - WARNING - full garbage collections took 10% CPU time recently (threshold: 10%)
2023-07-01 16:03:20,211 - distributed.utils_perf - WARNING - full garbage collections took 10% CPU time recently (threshold: 10%)
2023-07-01 16:09:53,251 - distributed.utils_perf - WARNING - full garbage collections took 10% CPU time recently (threshold: 10%)
2023-07-01 16:10:33,364 - distributed.utils_perf - WARNING - full garbage collections took 10% CPU time recently (threshold: 10%)
2023-07-01 16:12:04,613 - distributed.utils_perf - WARNING - full garbage collections took 10% CPU time recently (threshold: 10%)
2023-07-01 16:12:45,321 - distributed.utils_perf - WARNING - full garbage collections took 10% CPU time recently (threshold: 10%)
2023-07-01 16:13:22,187 - distributed.utils_perf - WARNING - full garbage collections took 10% CPU time recently (threshold: 10%)
[I 2023-07-01 16:26:54,451] Trial 98 finished with value: 0.9198247287213928 and parameters: {'max_depth': 13, 'max_features': 0.6518900903898337, 'n_estimators': 260, 'criterion': 'log_loss', 'min_samples_split': 510}. Best is trial 76 with value: 0.9234791054625651.
2023-07-01 16:35:41,672 - distributed.utils_perf - WARNING - full garbage collections took 10% CPU time recently (threshold: 10%)
2023-07-01 16:35:42,766 - distributed.utils_perf - WARNING - full garbage collections took 10% CPU time recently (threshold: 10%)
2023-07-01 16:35:44,716 - distributed.utils_perf - WARNING - full garbage collections took 11% CPU time recently (threshold: 10%)
2023-07-01 16:35:49,700 - distributed.utils_perf - WARNING - full garbage collections took 11% CPU time recently (threshold: 10%)
2023-07-01 16:35:55,189 - distributed.utils_perf - WARNING - full garbage collections took 12% CPU time recently (threshold: 10%)
2023-07-01 16:37:22,308 - distributed.utils_perf - WARNING - full garbage collections took 12% CPU time recently (threshold: 10%)
2023-07-01 16:37:47,824 - distributed.utils_perf - WARNING - full garbage collections took 12% CPU time recently (threshold: 10%)
2023-07-01 16:37:51,168 - distributed.utils_perf - WARNING - full garbage collections took 12% CPU time recently (threshold: 10%)
[I 2023-07-01 16:37:51,854] Trial 99 finished with value: 0.9121018962739675 and parameters: {'max_depth': 7, 'max_features': 0.20869046587830675, 'n_estimators': 190, 'criterion': 'entropy', 'min_samples_split': 10}. Best is trial 76 with value: 0.9234791054625651.
2023-07-01 16:37:52,289 - distributed.worker - ERROR - Failed to communicate with scheduler during heartbeat.
Traceback (most recent call last):
  File "/opt/mambaforge/envs/cpu_hpo/lib/python3.9/site-packages/distributed/comm/tcp.py", line 225, in read
    frames_nbytes = await stream.read_bytes(fmt_size)
tornado.iostream.StreamClosedError: Stream is closed

The above exception was the direct cause of the following exception:

Traceback (most recent call last):
  File "/opt/mambaforge/envs/cpu_hpo/lib/python3.9/site-packages/distributed/worker.py", line 1244, in heartbeat
    response = await retry_operation(
  File "/opt/mambaforge/envs/cpu_hpo/lib/python3.9/site-packages/distributed/utils_comm.py", line 434, in retry_operation
    return await retry(
  File "/opt/mambaforge/envs/cpu_hpo/lib/python3.9/site-packages/distributed/utils_comm.py", line 413, in retry
    return await coro()
  File "/opt/mambaforge/envs/cpu_hpo/lib/python3.9/site-packages/distributed/core.py", line 1265, in send_recv_from_rpc
    return await send_recv(comm=comm, op=key, **kwargs)
  File "/opt/mambaforge/envs/cpu_hpo/lib/python3.9/site-packages/distributed/core.py", line 1024, in send_recv
    response = await comm.read(deserializers=deserializers)
  File "/opt/mambaforge/envs/cpu_hpo/lib/python3.9/site-packages/distributed/comm/tcp.py", line 241, in read
    convert_stream_closed_error(self, e)
  File "/opt/mambaforge/envs/cpu_hpo/lib/python3.9/site-packages/distributed/comm/tcp.py", line 144, in convert_stream_closed_error
    raise CommClosedError(f"in {obj}: {exc}") from exc
distributed.comm.core.CommClosedError: in <TCP (closed) ConnectionPool.heartbeat_worker local=tcp://127.0.0.1:39912 remote=tcp://127.0.0.1:35409>: Stream is closed
2023-07-01 16:37:52,295 - distributed.worker - ERROR - Failed to communicate with scheduler during heartbeat.
Traceback (most recent call last):
  File "/opt/mambaforge/envs/cpu_hpo/lib/python3.9/site-packages/distributed/comm/tcp.py", line 225, in read
    frames_nbytes = await stream.read_bytes(fmt_size)
tornado.iostream.StreamClosedError: Stream is closed

The above exception was the direct cause of the following exception:

Traceback (most recent call last):
  File "/opt/mambaforge/envs/cpu_hpo/lib/python3.9/site-packages/distributed/worker.py", line 1244, in heartbeat
    response = await retry_operation(
  File "/opt/mambaforge/envs/cpu_hpo/lib/python3.9/site-packages/distributed/utils_comm.py", line 434, in retry_operation
    return await retry(
  File "/opt/mambaforge/envs/cpu_hpo/lib/python3.9/site-packages/distributed/utils_comm.py", line 413, in retry
    return await coro()
  File "/opt/mambaforge/envs/cpu_hpo/lib/python3.9/site-packages/distributed/core.py", line 1265, in send_recv_from_rpc
    return await send_recv(comm=comm, op=key, **kwargs)
  File "/opt/mambaforge/envs/cpu_hpo/lib/python3.9/site-packages/distributed/core.py", line 1024, in send_recv
    response = await comm.read(deserializers=deserializers)
  File "/opt/mambaforge/envs/cpu_hpo/lib/python3.9/site-packages/distributed/comm/tcp.py", line 241, in read
    convert_stream_closed_error(self, e)
  File "/opt/mambaforge/envs/cpu_hpo/lib/python3.9/site-packages/distributed/comm/tcp.py", line 144, in convert_stream_closed_error
    raise CommClosedError(f"in {obj}: {exc}") from exc
distributed.comm.core.CommClosedError: in <TCP (closed) ConnectionPool.heartbeat_worker local=tcp://127.0.0.1:39914 remote=tcp://127.0.0.1:35409>: Stream is closed
Time elapsed: 238844.164821179 sec
