[I 2023-07-01 09:27:47,102] Trial 88 finished with value: 0.9120918625378087 and parameters: {'max_depth': 6, 'max_features': 0.2823419126976964, 'n_estimators': 270, 'criterion': 'log_loss', 'min_samples_split': 5}. Best is trial 76 with value: 0.9234791054625651.
2023-07-01 09:27:48,354 - distributed.utils_perf - WARNING - full garbage collections took 11% CPU time recently (threshold: 10%)
2023-07-01 09:27:49,505 - distributed.utils_perf - WARNING - full garbage collections took 11% CPU time recently (threshold: 10%)
2023-07-01 09:27:50,828 - distributed.utils_perf - WARNING - full garbage collections took 11% CPU time recently (threshold: 10%)
2023-07-01 09:27:56,287 - distributed.utils_perf - WARNING - full garbage collections took 11% CPU time recently (threshold: 10%)
2023-07-01 09:28:01,526 - distributed.utils_perf - WARNING - full garbage collections took 11% CPU time recently (threshold: 10%)
2023-07-01 09:28:57,099 - distributed.utils_perf - WARNING - full garbage collections took 12% CPU time recently (threshold: 10%)
2023-07-01 09:29:38,483 - distributed.utils_perf - WARNING - full garbage collections took 12% CPU time recently (threshold: 10%)
2023-07-01 09:30:17,471 - distributed.utils_perf - WARNING - full garbage collections took 12% CPU time recently (threshold: 10%)
2023-07-01 09:30:54,111 - distributed.utils_perf - WARNING - full garbage collections took 11% CPU time recently (threshold: 10%)
2023-07-01 09:31:30,657 - distributed.utils_perf - WARNING - full garbage collections took 11% CPU time recently (threshold: 10%)
2023-07-01 09:32:55,087 - distributed.utils_perf - WARNING - full garbage collections took 11% CPU time recently (threshold: 10%)
2023-07-01 09:33:23,899 - distributed.utils_perf - WARNING - full garbage collections took 10% CPU time recently (threshold: 10%)
2023-07-01 09:33:54,234 - distributed.utils_perf - WARNING - full garbage collections took 10% CPU time recently (threshold: 10%)
2023-07-01 09:34:25,900 - distributed.utils_perf - WARNING - full garbage collections took 10% CPU time recently (threshold: 10%)
2023-07-01 09:34:50,056 - distributed.utils_perf - WARNING - full garbage collections took 10% CPU time recently (threshold: 10%)
2023-07-01 09:35:26,053 - distributed.utils_perf - WARNING - full garbage collections took 10% CPU time recently (threshold: 10%)
2023-07-01 09:35:28,560 - distributed.utils_perf - WARNING - full garbage collections took 10% CPU time recently (threshold: 10%)
2023-07-01 09:35:33,416 - distributed.utils_perf - WARNING - full garbage collections took 10% CPU time recently (threshold: 10%)
2023-07-01 09:35:38,657 - distributed.utils_perf - WARNING - full garbage collections took 10% CPU time recently (threshold: 10%)
2023-07-01 09:36:43,909 - distributed.utils_perf - WARNING - full garbage collections took 10% CPU time recently (threshold: 10%)
2023-07-01 09:37:26,688 - distributed.utils_perf - WARNING - full garbage collections took 10% CPU time recently (threshold: 10%)
2023-07-01 09:58:21,911 - distributed.utils_perf - WARNING - full garbage collections took 10% CPU time recently (threshold: 10%)
[I 2023-07-01 10:07:37,625] Trial 89 finished with value: 0.9196383032286286 and parameters: {'max_depth': 12, 'max_features': 0.7788753555186688, 'n_estimators': 180, 'criterion': 'entropy', 'min_samples_split': 73}. Best is trial 76 with value: 0.9234791054625651.
2023-07-01 10:28:36,638 - distributed.utils_perf - WARNING - full garbage collections took 10% CPU time recently (threshold: 10%)
2023-07-01 10:29:25,390 - distributed.utils_perf - WARNING - full garbage collections took 10% CPU time recently (threshold: 10%)
2023-07-01 10:59:03,519 - distributed.utils_perf - WARNING - full garbage collections took 10% CPU time recently (threshold: 10%)
2023-07-01 10:59:55,574 - distributed.utils_perf - WARNING - full garbage collections took 10% CPU time recently (threshold: 10%)
[I 2023-07-01 11:16:04,639] Trial 90 finished with value: 0.9153926599130422 and parameters: {'max_depth': 8, 'max_features': 0.758445824117358, 'n_estimators': 480, 'criterion': 'entropy', 'min_samples_split': 343}. Best is trial 76 with value: 0.9234791054625651.
2023-07-01 11:28:36,209 - distributed.utils_perf - WARNING - full garbage collections took 10% CPU time recently (threshold: 10%)
2023-07-01 11:29:39,162 - distributed.utils_perf - WARNING - full garbage collections took 10% CPU time recently (threshold: 10%)
2023-07-01 11:32:31,819 - distributed.utils_perf - WARNING - full garbage collections took 10% CPU time recently (threshold: 10%)
2023-07-01 11:32:35,249 - distributed.utils_perf - WARNING - full garbage collections took 10% CPU time recently (threshold: 10%)
2023-07-01 11:32:40,984 - distributed.utils_perf - WARNING - full garbage collections took 10% CPU time recently (threshold: 10%)
2023-07-01 11:32:46,272 - distributed.utils_perf - WARNING - full garbage collections took 10% CPU time recently (threshold: 10%)
2023-07-01 11:33:46,726 - distributed.utils_perf - WARNING - full garbage collections took 10% CPU time recently (threshold: 10%)
2023-07-01 11:35:10,555 - distributed.utils_perf - WARNING - full garbage collections took 10% CPU time recently (threshold: 10%)
2023-07-01 11:36:03,812 - distributed.utils_perf - WARNING - full garbage collections took 10% CPU time recently (threshold: 10%)
[I 2023-07-01 11:36:35,564] Trial 91 finished with value: 0.9136657170140907 and parameters: {'max_depth': 7, 'max_features': 0.4555871820009759, 'n_estimators': 220, 'criterion': 'entropy', 'min_samples_split': 47}. Best is trial 76 with value: 0.9234791054625651.
2023-07-01 11:36:38,095 - distributed.utils_perf - WARNING - full garbage collections took 10% CPU time recently (threshold: 10%)
2023-07-01 11:36:39,201 - distributed.utils_perf - WARNING - full garbage collections took 11% CPU time recently (threshold: 10%)
2023-07-01 11:36:42,828 - distributed.utils_perf - WARNING - full garbage collections took 11% CPU time recently (threshold: 10%)
2023-07-01 11:36:47,954 - distributed.utils_perf - WARNING - full garbage collections took 11% CPU time recently (threshold: 10%)
2023-07-01 11:37:29,222 - distributed.utils_perf - WARNING - full garbage collections took 10% CPU time recently (threshold: 10%)
2023-07-01 11:38:43,023 - distributed.utils_perf - WARNING - full garbage collections took 10% CPU time recently (threshold: 10%)
2023-07-01 11:39:05,788 - distributed.utils_perf - WARNING - full garbage collections took 10% CPU time recently (threshold: 10%)
2023-07-01 11:39:12,851 - distributed.utils_perf - WARNING - full garbage collections took 10% CPU time recently (threshold: 10%)
2023-07-01 11:39:14,941 - distributed.utils_perf - WARNING - full garbage collections took 10% CPU time recently (threshold: 10%)
2023-07-01 11:39:16,005 - distributed.utils_perf - WARNING - full garbage collections took 11% CPU time recently (threshold: 10%)
2023-07-01 11:39:17,905 - distributed.utils_perf - WARNING - full garbage collections took 11% CPU time recently (threshold: 10%)
2023-07-01 11:39:23,270 - distributed.utils_perf - WARNING - full garbage collections took 11% CPU time recently (threshold: 10%)
2023-07-01 11:39:28,412 - distributed.utils_perf - WARNING - full garbage collections took 11% CPU time recently (threshold: 10%)
2023-07-01 11:40:21,321 - distributed.utils_perf - WARNING - full garbage collections took 11% CPU time recently (threshold: 10%)
2023-07-01 11:41:30,497 - distributed.utils_perf - WARNING - full garbage collections took 10% CPU time recently (threshold: 10%)
2023-07-01 11:41:49,046 - distributed.utils_perf - WARNING - full garbage collections took 10% CPU time recently (threshold: 10%)
2023-07-01 11:41:52,604 - distributed.utils_perf - WARNING - full garbage collections took 10% CPU time recently (threshold: 10%)
2023-07-01 11:41:54,305 - distributed.utils_perf - WARNING - full garbage collections took 10% CPU time recently (threshold: 10%)
2023-07-01 11:41:55,573 - distributed.utils_perf - WARNING - full garbage collections took 11% CPU time recently (threshold: 10%)
2023-07-01 11:41:58,676 - distributed.utils_perf - WARNING - full garbage collections took 11% CPU time recently (threshold: 10%)
2023-07-01 11:42:03,659 - distributed.utils_perf - WARNING - full garbage collections took 12% CPU time recently (threshold: 10%)
2023-07-01 11:42:09,043 - distributed.utils_perf - WARNING - full garbage collections took 12% CPU time recently (threshold: 10%)
2023-07-01 11:43:05,879 - distributed.utils_perf - WARNING - full garbage collections took 12% CPU time recently (threshold: 10%)
2023-07-01 11:44:08,409 - distributed.utils_perf - WARNING - full garbage collections took 11% CPU time recently (threshold: 10%)
2023-07-01 11:44:25,168 - distributed.utils_perf - WARNING - full garbage collections took 11% CPU time recently (threshold: 10%)
2023-07-01 11:44:28,600 - distributed.utils_perf - WARNING - full garbage collections took 11% CPU time recently (threshold: 10%)
2023-07-01 11:44:30,102 - distributed.utils_perf - WARNING - full garbage collections took 10% CPU time recently (threshold: 10%)
2023-07-01 11:44:31,316 - distributed.utils_perf - WARNING - full garbage collections took 11% CPU time recently (threshold: 10%)
2023-07-01 11:44:35,412 - distributed.utils_perf - WARNING - full garbage collections took 11% CPU time recently (threshold: 10%)
2023-07-01 11:44:39,657 - distributed.utils_perf - WARNING - full garbage collections took 11% CPU time recently (threshold: 10%)
2023-07-01 11:45:14,155 - distributed.utils_perf - WARNING - full garbage collections took 11% CPU time recently (threshold: 10%)
2023-07-01 11:46:31,347 - distributed.utils_perf - WARNING - full garbage collections took 11% CPU time recently (threshold: 10%)
2023-07-01 11:47:00,204 - distributed.utils_perf - WARNING - full garbage collections took 12% CPU time recently (threshold: 10%)
2023-07-01 11:47:10,708 - distributed.utils_perf - WARNING - full garbage collections took 12% CPU time recently (threshold: 10%)
2023-07-01 11:47:13,992 - distributed.utils_perf - WARNING - full garbage collections took 12% CPU time recently (threshold: 10%)
2023-07-01 11:47:15,359 - distributed.utils_perf - WARNING - full garbage collections took 11% CPU time recently (threshold: 10%)
2023-07-01 11:47:16,489 - distributed.utils_perf - WARNING - full garbage collections took 11% CPU time recently (threshold: 10%)
2023-07-01 11:47:20,485 - distributed.utils_perf - WARNING - full garbage collections took 11% CPU time recently (threshold: 10%)
2023-07-01 11:47:24,753 - distributed.utils_perf - WARNING - full garbage collections took 11% CPU time recently (threshold: 10%)
2023-07-01 11:48:01,756 - distributed.utils_perf - WARNING - full garbage collections took 12% CPU time recently (threshold: 10%)
2023-07-01 11:48:46,870 - distributed.utils_perf - WARNING - full garbage collections took 11% CPU time recently (threshold: 10%)
2023-07-01 11:49:41,581 - distributed.utils_perf - WARNING - full garbage collections took 11% CPU time recently (threshold: 10%)
2023-07-01 11:49:56,582 - distributed.utils_perf - WARNING - full garbage collections took 11% CPU time recently (threshold: 10%)
2023-07-01 11:50:00,058 - distributed.utils_perf - WARNING - full garbage collections took 11% CPU time recently (threshold: 10%)
[I 2023-07-01 11:50:00,103] Trial 92 finished with value: 0.9127846919946571 and parameters: {'max_depth': 10, 'max_features': 0.21894502774864433, 'n_estimators': 180, 'criterion': 'entropy', 'min_samples_split': 15}. Best is trial 76 with value: 0.9234791054625651.
2023-07-01 11:50:01,459 - distributed.utils_perf - WARNING - full garbage collections took 11% CPU time recently (threshold: 10%)
2023-07-01 11:50:02,690 - distributed.utils_perf - WARNING - full garbage collections took 12% CPU time recently (threshold: 10%)
2023-07-01 11:50:03,728 - distributed.utils_perf - WARNING - full garbage collections took 12% CPU time recently (threshold: 10%)
2023-07-01 11:50:08,434 - distributed.utils_perf - WARNING - full garbage collections took 11% CPU time recently (threshold: 10%)
2023-07-01 11:50:13,879 - distributed.utils_perf - WARNING - full garbage collections took 11% CPU time recently (threshold: 10%)
2023-07-01 11:51:20,163 - distributed.utils_perf - WARNING - full garbage collections took 12% CPU time recently (threshold: 10%)
2023-07-01 11:52:01,920 - distributed.utils_perf - WARNING - full garbage collections took 11% CPU time recently (threshold: 10%)
2023-07-01 11:53:09,013 - distributed.utils_perf - WARNING - full garbage collections took 11% CPU time recently (threshold: 10%)
2023-07-01 11:53:27,615 - distributed.utils_perf - WARNING - full garbage collections took 11% CPU time recently (threshold: 10%)
2023-07-01 11:53:44,851 - distributed.utils_perf - WARNING - full garbage collections took 11% CPU time recently (threshold: 10%)
2023-07-01 11:54:05,054 - distributed.utils_perf - WARNING - full garbage collections took 10% CPU time recently (threshold: 10%)
2023-07-01 11:54:15,113 - distributed.utils_perf - WARNING - full garbage collections took 10% CPU time recently (threshold: 10%)
2023-07-01 11:54:17,078 - distributed.utils_perf - WARNING - full garbage collections took 10% CPU time recently (threshold: 10%)
2023-07-01 11:54:18,141 - distributed.utils_perf - WARNING - full garbage collections took 10% CPU time recently (threshold: 10%)
2023-07-01 11:54:19,972 - distributed.utils_perf - WARNING - full garbage collections took 11% CPU time recently (threshold: 10%)
2023-07-01 11:54:28,512 - distributed.utils_perf - WARNING - full garbage collections took 11% CPU time recently (threshold: 10%)
2023-07-01 11:54:34,715 - distributed.utils_perf - WARNING - full garbage collections took 11% CPU time recently (threshold: 10%)
2023-07-01 11:54:42,799 - distributed.utils_perf - WARNING - full garbage collections took 11% CPU time recently (threshold: 10%)
2023-07-01 11:55:36,091 - distributed.utils_perf - WARNING - full garbage collections took 11% CPU time recently (threshold: 10%)
2023-07-01 11:56:18,156 - distributed.utils_perf - WARNING - full garbage collections took 11% CPU time recently (threshold: 10%)
2023-07-01 11:57:11,721 - distributed.utils_perf - WARNING - full garbage collections took 11% CPU time recently (threshold: 10%)
2023-07-01 11:57:29,218 - distributed.utils_perf - WARNING - full garbage collections took 11% CPU time recently (threshold: 10%)
2023-07-01 11:57:47,839 - distributed.utils_perf - WARNING - full garbage collections took 11% CPU time recently (threshold: 10%)
2023-07-01 11:58:07,947 - distributed.utils_perf - WARNING - full garbage collections took 10% CPU time recently (threshold: 10%)
2023-07-01 11:58:12,860 - distributed.utils_perf - WARNING - full garbage collections took 10% CPU time recently (threshold: 10%)
2023-07-01 11:58:15,942 - distributed.utils_perf - WARNING - full garbage collections took 11% CPU time recently (threshold: 10%)
2023-07-01 11:58:18,138 - distributed.utils_perf - WARNING - full garbage collections took 11% CPU time recently (threshold: 10%)
2023-07-01 11:58:22,950 - distributed.utils_perf - WARNING - full garbage collections took 11% CPU time recently (threshold: 10%)
2023-07-01 11:58:31,218 - distributed.utils_perf - WARNING - full garbage collections took 11% CPU time recently (threshold: 10%)
2023-07-01 11:58:35,388 - distributed.utils_perf - WARNING - full garbage collections took 11% CPU time recently (threshold: 10%)
2023-07-01 11:59:18,120 - distributed.utils_perf - WARNING - full garbage collections took 11% CPU time recently (threshold: 10%)
2023-07-01 11:59:56,220 - distributed.utils_perf - WARNING - full garbage collections took 11% CPU time recently (threshold: 10%)
2023-07-01 12:01:00,397 - distributed.utils_perf - WARNING - full garbage collections took 11% CPU time recently (threshold: 10%)
2023-07-01 12:01:19,557 - distributed.utils_perf - WARNING - full garbage collections took 11% CPU time recently (threshold: 10%)
2023-07-01 12:01:37,387 - distributed.utils_perf - WARNING - full garbage collections took 10% CPU time recently (threshold: 10%)
2023-07-01 12:01:57,769 - distributed.utils_perf - WARNING - full garbage collections took 10% CPU time recently (threshold: 10%)
2023-07-01 12:02:13,058 - distributed.utils_perf - WARNING - full garbage collections took 10% CPU time recently (threshold: 10%)
2023-07-01 12:02:19,474 - distributed.utils_perf - WARNING - full garbage collections took 10% CPU time recently (threshold: 10%)
2023-07-01 12:02:22,512 - distributed.utils_perf - WARNING - full garbage collections took 11% CPU time recently (threshold: 10%)
2023-07-01 12:02:24,966 - distributed.utils_perf - WARNING - full garbage collections took 11% CPU time recently (threshold: 10%)
2023-07-01 12:02:30,453 - distributed.utils_perf - WARNING - full garbage collections took 12% CPU time recently (threshold: 10%)
2023-07-01 12:02:35,862 - distributed.utils_perf - WARNING - full garbage collections took 12% CPU time recently (threshold: 10%)
2023-07-01 12:02:40,951 - distributed.utils_perf - WARNING - full garbage collections took 12% CPU time recently (threshold: 10%)
2023-07-01 12:03:37,187 - distributed.utils_perf - WARNING - full garbage collections took 12% CPU time recently (threshold: 10%)
2023-07-01 12:04:14,971 - distributed.utils_perf - WARNING - full garbage collections took 12% CPU time recently (threshold: 10%)
2023-07-01 12:05:17,081 - distributed.utils_perf - WARNING - full garbage collections took 11% CPU time recently (threshold: 10%)
2023-07-01 12:05:35,198 - distributed.utils_perf - WARNING - full garbage collections took 11% CPU time recently (threshold: 10%)
2023-07-01 12:05:56,944 - distributed.utils_perf - WARNING - full garbage collections took 11% CPU time recently (threshold: 10%)
2023-07-01 12:06:17,817 - distributed.utils_perf - WARNING - full garbage collections took 11% CPU time recently (threshold: 10%)
2023-07-01 12:06:37,823 - distributed.utils_perf - WARNING - full garbage collections took 10% CPU time recently (threshold: 10%)
2023-07-01 12:06:48,201 - distributed.utils_perf - WARNING - full garbage collections took 10% CPU time recently (threshold: 10%)
2023-07-01 12:06:50,870 - distributed.utils_perf - WARNING - full garbage collections took 10% CPU time recently (threshold: 10%)
2023-07-01 12:06:52,025 - distributed.utils_perf - WARNING - full garbage collections took 11% CPU time recently (threshold: 10%)
2023-07-01 12:06:53,204 - distributed.utils_perf - WARNING - full garbage collections took 11% CPU time recently (threshold: 10%)
2023-07-01 12:06:58,494 - distributed.utils_perf - WARNING - full garbage collections took 11% CPU time recently (threshold: 10%)
2023-07-01 12:07:03,539 - distributed.utils_perf - WARNING - full garbage collections took 11% CPU time recently (threshold: 10%)
2023-07-01 12:08:02,184 - distributed.utils_perf - WARNING - full garbage collections took 11% CPU time recently (threshold: 10%)
2023-07-01 12:08:51,665 - distributed.utils_perf - WARNING - full garbage collections took 11% CPU time recently (threshold: 10%)
2023-07-01 12:10:03,399 - distributed.utils_perf - WARNING - full garbage collections took 11% CPU time recently (threshold: 10%)
2023-07-01 12:10:24,133 - distributed.utils_perf - WARNING - full garbage collections took 10% CPU time recently (threshold: 10%)
2023-07-01 12:10:41,814 - distributed.utils_perf - WARNING - full garbage collections took 10% CPU time recently (threshold: 10%)
2023-07-01 12:11:09,420 - distributed.utils_perf - WARNING - full garbage collections took 10% CPU time recently (threshold: 10%)
2023-07-01 12:11:13,627 - distributed.utils_perf - WARNING - full garbage collections took 10% CPU time recently (threshold: 10%)
