[I 2023-06-30 01:49:07,761] Trial 43 finished with value: 0.9219476203554369 and parameters: {'max_depth': 14, 'max_features': 0.719571927147349, 'n_estimators': 330, 'criterion': 'entropy', 'min_samples_split': 6}. Best is trial 16 with value: 0.9227844289727691.
2023-06-30 02:07:56,641 - distributed.utils_perf - WARNING - full garbage collections took 10% CPU time recently (threshold: 10%)
2023-06-30 02:08:16,590 - distributed.utils_perf - WARNING - full garbage collections took 10% CPU time recently (threshold: 10%)
2023-06-30 02:08:26,647 - distributed.utils_perf - WARNING - full garbage collections took 10% CPU time recently (threshold: 10%)
2023-06-30 02:08:31,656 - distributed.utils_perf - WARNING - full garbage collections took 10% CPU time recently (threshold: 10%)
2023-06-30 02:08:33,014 - distributed.utils_perf - WARNING - full garbage collections took 10% CPU time recently (threshold: 10%)
2023-06-30 02:08:34,285 - distributed.utils_perf - WARNING - full garbage collections took 10% CPU time recently (threshold: 10%)
2023-06-30 02:08:40,057 - distributed.utils_perf - WARNING - full garbage collections took 10% CPU time recently (threshold: 10%)
2023-06-30 02:08:45,492 - distributed.utils_perf - WARNING - full garbage collections took 10% CPU time recently (threshold: 10%)
2023-06-30 02:11:34,503 - distributed.utils_perf - WARNING - full garbage collections took 10% CPU time recently (threshold: 10%)
2023-06-30 02:13:05,259 - distributed.utils_perf - WARNING - full garbage collections took 10% CPU time recently (threshold: 10%)
2023-06-30 02:13:52,377 - distributed.utils_perf - WARNING - full garbage collections took 10% CPU time recently (threshold: 10%)
2023-06-30 02:17:57,713 - distributed.utils_perf - WARNING - full garbage collections took 10% CPU time recently (threshold: 10%)
2023-06-30 02:17:58,835 - distributed.utils_perf - WARNING - full garbage collections took 10% CPU time recently (threshold: 10%)
2023-06-30 02:18:00,189 - distributed.utils_perf - WARNING - full garbage collections took 10% CPU time recently (threshold: 10%)
2023-06-30 02:18:05,345 - distributed.utils_perf - WARNING - full garbage collections took 10% CPU time recently (threshold: 10%)
2023-06-30 02:18:11,017 - distributed.utils_perf - WARNING - full garbage collections took 10% CPU time recently (threshold: 10%)
2023-06-30 02:19:00,405 - distributed.utils_perf - WARNING - full garbage collections took 10% CPU time recently (threshold: 10%)
2023-06-30 02:19:37,011 - distributed.utils_perf - WARNING - full garbage collections took 10% CPU time recently (threshold: 10%)
2023-06-30 02:20:53,791 - distributed.utils_perf - WARNING - full garbage collections took 10% CPU time recently (threshold: 10%)
2023-06-30 02:22:51,480 - distributed.utils_perf - WARNING - full garbage collections took 10% CPU time recently (threshold: 10%)
2023-06-30 02:24:30,218 - distributed.utils_perf - WARNING - full garbage collections took 10% CPU time recently (threshold: 10%)
2023-06-30 02:26:57,322 - distributed.utils_perf - WARNING - full garbage collections took 10% CPU time recently (threshold: 10%)
2023-06-30 02:27:02,450 - distributed.utils_perf - WARNING - full garbage collections took 10% CPU time recently (threshold: 10%)
2023-06-30 02:27:07,630 - distributed.utils_perf - WARNING - full garbage collections took 10% CPU time recently (threshold: 10%)
2023-06-30 02:27:57,755 - distributed.utils_perf - WARNING - full garbage collections took 10% CPU time recently (threshold: 10%)
2023-06-30 02:28:37,252 - distributed.utils_perf - WARNING - full garbage collections took 10% CPU time recently (threshold: 10%)
2023-06-30 02:29:54,629 - distributed.utils_perf - WARNING - full garbage collections took 10% CPU time recently (threshold: 10%)
2023-06-30 02:35:27,652 - distributed.utils_perf - WARNING - full garbage collections took 10% CPU time recently (threshold: 10%)
[I 2023-06-30 02:36:33,211] Trial 44 finished with value: 0.9163939136391205 and parameters: {'max_depth': 11, 'max_features': 0.3810428539317253, 'n_estimators': 470, 'criterion': 'gini', 'min_samples_split': 5}. Best is trial 16 with value: 0.9227844289727691.
2023-06-30 02:36:35,251 - distributed.utils_perf - WARNING - full garbage collections took 10% CPU time recently (threshold: 10%)
2023-06-30 02:36:36,683 - distributed.utils_perf - WARNING - full garbage collections took 10% CPU time recently (threshold: 10%)
2023-06-30 02:36:38,798 - distributed.utils_perf - WARNING - full garbage collections took 10% CPU time recently (threshold: 10%)
2023-06-30 02:36:43,726 - distributed.utils_perf - WARNING - full garbage collections took 10% CPU time recently (threshold: 10%)
2023-06-30 02:36:50,657 - distributed.utils_perf - WARNING - full garbage collections took 10% CPU time recently (threshold: 10%)
2023-06-30 02:37:59,059 - distributed.utils_perf - WARNING - full garbage collections took 10% CPU time recently (threshold: 10%)
2023-06-30 02:38:47,216 - distributed.utils_perf - WARNING - full garbage collections took 10% CPU time recently (threshold: 10%)
2023-06-30 02:43:48,613 - distributed.utils_perf - WARNING - full garbage collections took 10% CPU time recently (threshold: 10%)
2023-06-30 02:44:42,970 - distributed.utils_perf - WARNING - full garbage collections took 10% CPU time recently (threshold: 10%)
2023-06-30 02:56:16,073 - distributed.utils_perf - WARNING - full garbage collections took 10% CPU time recently (threshold: 10%)
2023-06-30 02:56:21,258 - distributed.utils_perf - WARNING - full garbage collections took 10% CPU time recently (threshold: 10%)
2023-06-30 02:57:16,020 - distributed.utils_perf - WARNING - full garbage collections took 10% CPU time recently (threshold: 10%)
2023-06-30 03:02:39,793 - distributed.utils_perf - WARNING - full garbage collections took 10% CPU time recently (threshold: 10%)
2023-06-30 03:02:40,996 - distributed.utils_perf - WARNING - full garbage collections took 10% CPU time recently (threshold: 10%)
2023-06-30 03:02:44,489 - distributed.utils_perf - WARNING - full garbage collections took 10% CPU time recently (threshold: 10%)
2023-06-30 03:02:49,272 - distributed.utils_perf - WARNING - full garbage collections took 10% CPU time recently (threshold: 10%)
2023-06-30 03:03:27,915 - distributed.utils_perf - WARNING - full garbage collections took 10% CPU time recently (threshold: 10%)
2023-06-30 03:04:05,792 - distributed.utils_perf - WARNING - full garbage collections took 10% CPU time recently (threshold: 10%)
2023-06-30 03:04:44,903 - distributed.utils_perf - WARNING - full garbage collections took 10% CPU time recently (threshold: 10%)
2023-06-30 03:05:22,187 - distributed.utils_perf - WARNING - full garbage collections took 10% CPU time recently (threshold: 10%)
2023-06-30 03:06:57,472 - distributed.utils_perf - WARNING - full garbage collections took 10% CPU time recently (threshold: 10%)
2023-06-30 03:07:37,775 - distributed.utils_perf - WARNING - full garbage collections took 10% CPU time recently (threshold: 10%)
2023-06-30 03:08:10,267 - distributed.utils_perf - WARNING - full garbage collections took 10% CPU time recently (threshold: 10%)
2023-06-30 03:08:39,663 - distributed.utils_perf - WARNING - full garbage collections took 10% CPU time recently (threshold: 10%)
2023-06-30 03:08:58,192 - distributed.utils_perf - WARNING - full garbage collections took 10% CPU time recently (threshold: 10%)
2023-06-30 03:09:26,510 - distributed.utils_perf - WARNING - full garbage collections took 10% CPU time recently (threshold: 10%)
2023-06-30 03:09:30,097 - distributed.utils_perf - WARNING - full garbage collections took 10% CPU time recently (threshold: 10%)
[I 2023-06-30 03:09:30,394] Trial 45 finished with value: 0.9172076454225729 and parameters: {'max_depth': 10, 'max_features': 0.7557271011771366, 'n_estimators': 180, 'criterion': 'entropy', 'min_samples_split': 83}. Best is trial 16 with value: 0.9227844289727691.
2023-06-30 03:09:31,742 - distributed.utils_perf - WARNING - full garbage collections took 10% CPU time recently (threshold: 10%)
2023-06-30 03:09:32,773 - distributed.utils_perf - WARNING - full garbage collections took 10% CPU time recently (threshold: 10%)
2023-06-30 03:09:34,117 - distributed.utils_perf - WARNING - full garbage collections took 10% CPU time recently (threshold: 10%)
2023-06-30 03:09:37,464 - distributed.utils_perf - WARNING - full garbage collections took 10% CPU time recently (threshold: 10%)
2023-06-30 03:09:43,151 - distributed.utils_perf - WARNING - full garbage collections took 10% CPU time recently (threshold: 10%)
2023-06-30 03:09:57,581 - distributed.utils_perf - WARNING - full garbage collections took 10% CPU time recently (threshold: 10%)
2023-06-30 03:11:29,404 - distributed.utils_perf - WARNING - full garbage collections took 10% CPU time recently (threshold: 10%)
2023-06-30 03:12:57,241 - distributed.utils_perf - WARNING - full garbage collections took 10% CPU time recently (threshold: 10%)
2023-06-30 03:12:59,206 - distributed.utils_perf - WARNING - full garbage collections took 10% CPU time recently (threshold: 10%)
2023-06-30 03:13:00,323 - distributed.utils_perf - WARNING - full garbage collections took 10% CPU time recently (threshold: 10%)
2023-06-30 03:13:02,607 - distributed.utils_perf - WARNING - full garbage collections took 10% CPU time recently (threshold: 10%)
2023-06-30 03:13:07,528 - distributed.utils_perf - WARNING - full garbage collections took 10% CPU time recently (threshold: 10%)
2023-06-30 03:13:12,897 - distributed.utils_perf - WARNING - full garbage collections took 11% CPU time recently (threshold: 10%)
2023-06-30 03:15:29,103 - distributed.utils_perf - WARNING - full garbage collections took 11% CPU time recently (threshold: 10%)
2023-06-30 03:16:05,060 - distributed.utils_perf - WARNING - full garbage collections took 11% CPU time recently (threshold: 10%)
2023-06-30 03:16:09,439 - distributed.utils_perf - WARNING - full garbage collections took 11% CPU time recently (threshold: 10%)
2023-06-30 03:16:11,149 - distributed.utils_perf - WARNING - full garbage collections took 11% CPU time recently (threshold: 10%)
2023-06-30 03:16:12,356 - distributed.utils_perf - WARNING - full garbage collections took 11% CPU time recently (threshold: 10%)
2023-06-30 03:16:15,464 - distributed.utils_perf - WARNING - full garbage collections took 11% CPU time recently (threshold: 10%)
2023-06-30 03:16:19,577 - distributed.utils_perf - WARNING - full garbage collections took 11% CPU time recently (threshold: 10%)
2023-06-30 03:16:24,745 - distributed.utils_perf - WARNING - full garbage collections took 10% CPU time recently (threshold: 10%)
2023-06-30 03:17:49,905 - distributed.utils_perf - WARNING - full garbage collections took 11% CPU time recently (threshold: 10%)
2023-06-30 03:19:16,076 - distributed.utils_perf - WARNING - full garbage collections took 10% CPU time recently (threshold: 10%)
2023-06-30 03:19:27,590 - distributed.utils_perf - WARNING - full garbage collections took 10% CPU time recently (threshold: 10%)
2023-06-30 03:19:31,605 - distributed.utils_perf - WARNING - full garbage collections took 10% CPU time recently (threshold: 10%)
2023-06-30 03:19:33,001 - distributed.utils_perf - WARNING - full garbage collections took 11% CPU time recently (threshold: 10%)
2023-06-30 03:19:34,183 - distributed.utils_perf - WARNING - full garbage collections took 11% CPU time recently (threshold: 10%)
2023-06-30 03:19:38,921 - distributed.utils_perf - WARNING - full garbage collections took 11% CPU time recently (threshold: 10%)
2023-06-30 03:19:42,934 - distributed.utils_perf - WARNING - full garbage collections took 12% CPU time recently (threshold: 10%)
2023-06-30 03:19:49,740 - distributed.utils_perf - WARNING - full garbage collections took 12% CPU time recently (threshold: 10%)
2023-06-30 03:22:03,501 - distributed.utils_perf - WARNING - full garbage collections took 12% CPU time recently (threshold: 10%)
2023-06-30 03:22:35,868 - distributed.utils_perf - WARNING - full garbage collections took 12% CPU time recently (threshold: 10%)
2023-06-30 03:22:40,174 - distributed.utils_perf - WARNING - full garbage collections took 12% CPU time recently (threshold: 10%)
2023-06-30 03:22:41,768 - distributed.utils_perf - WARNING - full garbage collections took 12% CPU time recently (threshold: 10%)
2023-06-30 03:22:43,268 - distributed.utils_perf - WARNING - full garbage collections took 12% CPU time recently (threshold: 10%)
2023-06-30 03:22:45,664 - distributed.utils_perf - WARNING - full garbage collections took 12% CPU time recently (threshold: 10%)
2023-06-30 03:22:50,029 - distributed.utils_perf - WARNING - full garbage collections took 13% CPU time recently (threshold: 10%)
2023-06-30 03:22:55,216 - distributed.utils_perf - WARNING - full garbage collections took 13% CPU time recently (threshold: 10%)
2023-06-30 03:24:24,749 - distributed.utils_perf - WARNING - full garbage collections took 14% CPU time recently (threshold: 10%)
2023-06-30 03:25:52,154 - distributed.utils_perf - WARNING - full garbage collections took 13% CPU time recently (threshold: 10%)
2023-06-30 03:26:05,044 - distributed.utils_perf - WARNING - full garbage collections took 13% CPU time recently (threshold: 10%)
[I 2023-06-30 03:26:08,588] Trial 46 finished with value: 0.9121998572166262 and parameters: {'max_depth': 7, 'max_features': 0.1917705334832177, 'n_estimators': 310, 'criterion': 'log_loss', 'min_samples_split': 52}. Best is trial 16 with value: 0.9227844289727691.
2023-06-30 03:26:09,335 - distributed.utils_perf - WARNING - full garbage collections took 13% CPU time recently (threshold: 10%)
2023-06-30 03:26:10,819 - distributed.utils_perf - WARNING - full garbage collections took 12% CPU time recently (threshold: 10%)
2023-06-30 03:26:12,055 - distributed.utils_perf - WARNING - full garbage collections took 12% CPU time recently (threshold: 10%)
2023-06-30 03:26:13,330 - distributed.utils_perf - WARNING - full garbage collections took 12% CPU time recently (threshold: 10%)
2023-06-30 03:26:18,734 - distributed.utils_perf - WARNING - full garbage collections took 12% CPU time recently (threshold: 10%)
2023-06-30 03:26:23,625 - distributed.utils_perf - WARNING - full garbage collections took 12% CPU time recently (threshold: 10%)
2023-06-30 03:27:10,380 - distributed.utils_perf - WARNING - full garbage collections took 13% CPU time recently (threshold: 10%)
2023-06-30 03:28:15,146 - distributed.utils_perf - WARNING - full garbage collections took 13% CPU time recently (threshold: 10%)
2023-06-30 03:29:25,047 - distributed.utils_perf - WARNING - full garbage collections took 13% CPU time recently (threshold: 10%)
2023-06-30 03:30:40,995 - distributed.utils_perf - WARNING - full garbage collections took 12% CPU time recently (threshold: 10%)
2023-06-30 03:31:19,498 - distributed.utils_perf - WARNING - full garbage collections took 11% CPU time recently (threshold: 10%)
2023-06-30 03:31:33,350 - distributed.utils_perf - WARNING - full garbage collections took 11% CPU time recently (threshold: 10%)
2023-06-30 03:31:35,196 - distributed.utils_perf - WARNING - full garbage collections took 11% CPU time recently (threshold: 10%)
2023-06-30 03:31:36,451 - distributed.utils_perf - WARNING - full garbage collections took 11% CPU time recently (threshold: 10%)
2023-06-30 03:31:37,685 - distributed.utils_perf - WARNING - full garbage collections took 11% CPU time recently (threshold: 10%)
2023-06-30 03:31:43,870 - distributed.utils_perf - WARNING - full garbage collections took 11% CPU time recently (threshold: 10%)
2023-06-30 03:31:49,078 - distributed.utils_perf - WARNING - full garbage collections took 11% CPU time recently (threshold: 10%)
2023-06-30 03:32:36,199 - distributed.utils_perf - WARNING - full garbage collections took 11% CPU time recently (threshold: 10%)
2023-06-30 03:33:53,778 - distributed.utils_perf - WARNING - full garbage collections took 11% CPU time recently (threshold: 10%)
2023-06-30 03:35:58,600 - distributed.utils_perf - WARNING - full garbage collections took 11% CPU time recently (threshold: 10%)
2023-06-30 03:36:47,731 - distributed.utils_perf - WARNING - full garbage collections took 11% CPU time recently (threshold: 10%)
2023-06-30 03:37:07,705 - distributed.utils_perf - WARNING - full garbage collections took 11% CPU time recently (threshold: 10%)
2023-06-30 03:37:12,525 - distributed.utils_perf - WARNING - full garbage collections took 11% CPU time recently (threshold: 10%)
2023-06-30 03:37:13,921 - distributed.utils_perf - WARNING - full garbage collections took 10% CPU time recently (threshold: 10%)
2023-06-30 03:37:15,219 - distributed.utils_perf - WARNING - full garbage collections took 10% CPU time recently (threshold: 10%)
2023-06-30 03:37:18,682 - distributed.utils_perf - WARNING - full garbage collections took 10% CPU time recently (threshold: 10%)
2023-06-30 03:37:23,621 - distributed.utils_perf - WARNING - full garbage collections took 10% CPU time recently (threshold: 10%)
2023-06-30 03:37:29,683 - distributed.utils_perf - WARNING - full garbage collections took 11% CPU time recently (threshold: 10%)
2023-06-30 03:38:27,203 - distributed.utils_perf - WARNING - full garbage collections took 11% CPU time recently (threshold: 10%)
2023-06-30 03:39:44,587 - distributed.utils_perf - WARNING - full garbage collections took 10% CPU time recently (threshold: 10%)
2023-06-30 03:41:06,244 - distributed.utils_perf - WARNING - full garbage collections took 10% CPU time recently (threshold: 10%)
2023-06-30 03:42:31,840 - distributed.utils_perf - WARNING - full garbage collections took 10% CPU time recently (threshold: 10%)
2023-06-30 03:42:59,698 - distributed.utils_perf - WARNING - full garbage collections took 10% CPU time recently (threshold: 10%)
2023-06-30 03:43:04,620 - distributed.utils_perf - WARNING - full garbage collections took 10% CPU time recently (threshold: 10%)
2023-06-30 03:43:58,432 - distributed.utils_perf - WARNING - full garbage collections took 10% CPU time recently (threshold: 10%)
2023-06-30 03:45:13,659 - distributed.utils_perf - WARNING - full garbage collections took 10% CPU time recently (threshold: 10%)
[I 2023-06-30 03:54:52,954] Trial 47 finished with value: 0.913805966957551 and parameters: {'max_depth': 12, 'max_features': 0.23009098611219383, 'n_estimators': 400, 'criterion': 'log_loss', 'min_samples_split': 2}. Best is trial 16 with value: 0.9227844289727691.
2023-06-30 03:56:02,851 - distributed.utils_perf - WARNING - full garbage collections took 10% CPU time recently (threshold: 10%)
2023-06-30 04:11:05,928 - distributed.utils_perf - WARNING - full garbage collections took 10% CPU time recently (threshold: 10%)
2023-06-30 04:11:43,061 - distributed.utils_perf - WARNING - full garbage collections took 10% CPU time recently (threshold: 10%)
2023-06-30 04:12:25,285 - distributed.utils_perf - WARNING - full garbage collections took 10% CPU time recently (threshold: 10%)
2023-06-30 04:13:00,595 - distributed.utils_perf - WARNING - full garbage collections took 10% CPU time recently (threshold: 10%)
2023-06-30 04:14:29,732 - distributed.utils_perf - WARNING - full garbage collections took 10% CPU time recently (threshold: 10%)
2023-06-30 04:43:39,334 - distributed.utils_perf - WARNING - full garbage collections took 10% CPU time recently (threshold: 10%)
2023-06-30 04:45:18,080 - distributed.utils_perf - WARNING - full garbage collections took 10% CPU time recently (threshold: 10%)
2023-06-30 04:57:25,086 - distributed.utils_perf - WARNING - full garbage collections took 10% CPU time recently (threshold: 10%)
2023-06-30 04:58:15,346 - distributed.utils_perf - WARNING - full garbage collections took 10% CPU time recently (threshold: 10%)
2023-06-30 04:58:55,130 - distributed.utils_perf - WARNING - full garbage collections took 10% CPU time recently (threshold: 10%)
2023-06-30 04:59:33,615 - distributed.utils_perf - WARNING - full garbage collections took 10% CPU time recently (threshold: 10%)
2023-06-30 05:00:15,232 - distributed.utils_perf - WARNING - full garbage collections took 10% CPU time recently (threshold: 10%)
2023-06-30 05:01:55,304 - distributed.utils_perf - WARNING - full garbage collections took 10% CPU time recently (threshold: 10%)
2023-06-30 05:02:35,888 - distributed.utils_perf - WARNING - full garbage collections took 10% CPU time recently (threshold: 10%)
2023-06-30 05:03:16,922 - distributed.utils_perf - WARNING - full garbage collections took 10% CPU time recently (threshold: 10%)
2023-06-30 05:05:00,899 - distributed.utils_perf - WARNING - full garbage collections took 10% CPU time recently (threshold: 10%)
2023-06-30 05:05:45,251 - distributed.utils_perf - WARNING - full garbage collections took 10% CPU time recently (threshold: 10%)
2023-06-30 05:06:35,411 - distributed.utils_perf - WARNING - full garbage collections took 10% CPU time recently (threshold: 10%)
2023-06-30 05:08:06,438 - distributed.utils_perf - WARNING - full garbage collections took 10% CPU time recently (threshold: 10%)
2023-06-30 05:08:51,092 - distributed.utils_perf - WARNING - full garbage collections took 10% CPU time recently (threshold: 10%)
2023-06-30 05:10:06,106 - distributed.utils_perf - WARNING - full garbage collections took 10% CPU time recently (threshold: 10%)
