[I 2023-06-29 04:21:56,223] Trial 11 finished with value: 0.9155979459828817 and parameters: {'max_depth': 8, 'max_features': 0.7757308928225399, 'n_estimators': 390, 'criterion': 'gini', 'min_samples_split': 15}. Best is trial 3 with value: 0.9195696361350809.
2023-06-29 04:28:38,577 - distributed.utils_perf - WARNING - full garbage collections took 10% CPU time recently (threshold: 10%)
2023-06-29 04:31:01,885 - distributed.utils_perf - WARNING - full garbage collections took 10% CPU time recently (threshold: 10%)
2023-06-29 04:31:38,315 - distributed.utils_perf - WARNING - full garbage collections took 10% CPU time recently (threshold: 10%)
2023-06-29 04:34:05,385 - distributed.utils_perf - WARNING - full garbage collections took 10% CPU time recently (threshold: 10%)
2023-06-29 04:34:48,214 - distributed.utils_perf - WARNING - full garbage collections took 10% CPU time recently (threshold: 10%)
2023-06-29 04:35:31,880 - distributed.utils_perf - WARNING - full garbage collections took 10% CPU time recently (threshold: 10%)
2023-06-29 04:37:09,455 - distributed.utils_perf - WARNING - full garbage collections took 10% CPU time recently (threshold: 10%)
2023-06-29 04:37:39,689 - distributed.utils_perf - WARNING - full garbage collections took 10% CPU time recently (threshold: 10%)
2023-06-29 04:37:58,597 - distributed.utils_perf - WARNING - full garbage collections took 10% CPU time recently (threshold: 10%)
2023-06-29 04:38:16,568 - distributed.utils_perf - WARNING - full garbage collections took 10% CPU time recently (threshold: 10%)
2023-06-29 04:39:11,696 - distributed.utils_perf - WARNING - full garbage collections took 10% CPU time recently (threshold: 10%)
2023-06-29 04:39:19,239 - distributed.utils_perf - WARNING - full garbage collections took 10% CPU time recently (threshold: 10%)
2023-06-29 04:39:23,403 - distributed.utils_perf - WARNING - full garbage collections took 10% CPU time recently (threshold: 10%)
2023-06-29 04:40:05,443 - distributed.utils_perf - WARNING - full garbage collections took 10% CPU time recently (threshold: 10%)
2023-06-29 04:40:48,780 - distributed.utils_perf - WARNING - full garbage collections took 10% CPU time recently (threshold: 10%)
2023-06-29 04:41:28,954 - distributed.utils_perf - WARNING - full garbage collections took 10% CPU time recently (threshold: 10%)
2023-06-29 04:43:07,587 - distributed.utils_perf - WARNING - full garbage collections took 10% CPU time recently (threshold: 10%)
2023-06-29 04:43:48,674 - distributed.utils_perf - WARNING - full garbage collections took 10% CPU time recently (threshold: 10%)
2023-06-29 04:45:29,738 - distributed.utils_perf - WARNING - full garbage collections took 10% CPU time recently (threshold: 10%)
2023-06-29 04:45:54,894 - distributed.utils_perf - WARNING - full garbage collections took 10% CPU time recently (threshold: 10%)
2023-06-29 04:46:17,969 - distributed.utils_perf - WARNING - full garbage collections took 10% CPU time recently (threshold: 10%)
2023-06-29 04:46:36,796 - distributed.utils_perf - WARNING - full garbage collections took 10% CPU time recently (threshold: 10%)
[I 2023-06-29 05:04:25,745] Trial 12 finished with value: 0.9145762279083754 and parameters: {'max_depth': 7, 'max_features': 0.9062975963764601, 'n_estimators': 270, 'criterion': 'gini', 'min_samples_split': 3}. Best is trial 3 with value: 0.9195696361350809.
[I 2023-06-29 05:57:20,532] Trial 13 finished with value: 0.9215094271931911 and parameters: {'max_depth': 15, 'max_features': 0.5049209201319464, 'n_estimators': 330, 'criterion': 'log_loss', 'min_samples_split': 63}. Best is trial 13 with value: 0.9215094271931911.
2023-06-29 06:07:59,908 - distributed.utils_perf - WARNING - full garbage collections took 10% CPU time recently (threshold: 10%)
2023-06-29 06:09:34,481 - distributed.utils_perf - WARNING - full garbage collections took 10% CPU time recently (threshold: 10%)
2023-06-29 06:10:36,284 - distributed.utils_perf - WARNING - full garbage collections took 10% CPU time recently (threshold: 10%)
2023-06-29 06:10:56,558 - distributed.utils_perf - WARNING - full garbage collections took 10% CPU time recently (threshold: 10%)
2023-06-29 06:11:14,160 - distributed.utils_perf - WARNING - full garbage collections took 10% CPU time recently (threshold: 10%)
2023-06-29 06:11:17,780 - distributed.utils_perf - WARNING - full garbage collections took 10% CPU time recently (threshold: 10%)
2023-06-29 06:11:24,647 - distributed.utils_perf - WARNING - full garbage collections took 10% CPU time recently (threshold: 10%)
2023-06-29 06:11:28,583 - distributed.utils_perf - WARNING - full garbage collections took 10% CPU time recently (threshold: 10%)
2023-06-29 06:12:15,841 - distributed.utils_perf - WARNING - full garbage collections took 10% CPU time recently (threshold: 10%)
2023-06-29 06:16:00,921 - distributed.utils_perf - WARNING - full garbage collections took 10% CPU time recently (threshold: 10%)
2023-06-29 06:16:03,402 - distributed.utils_perf - WARNING - full garbage collections took 10% CPU time recently (threshold: 10%)
2023-06-29 06:16:10,373 - distributed.utils_perf - WARNING - full garbage collections took 10% CPU time recently (threshold: 10%)
2023-06-29 06:16:18,477 - distributed.utils_perf - WARNING - full garbage collections took 10% CPU time recently (threshold: 10%)
2023-06-29 06:16:22,363 - distributed.utils_perf - WARNING - full garbage collections took 10% CPU time recently (threshold: 10%)
2023-06-29 06:17:09,004 - distributed.utils_perf - WARNING - full garbage collections took 10% CPU time recently (threshold: 10%)
[I 2023-06-29 06:20:44,268] Trial 14 finished with value: 0.9131404691646832 and parameters: {'max_depth': 5, 'max_features': 0.6554304222586514, 'n_estimators': 230, 'criterion': 'entropy', 'min_samples_split': 552}. Best is trial 13 with value: 0.9215094271931911.
2023-06-29 06:20:49,645 - distributed.utils_perf - WARNING - full garbage collections took 10% CPU time recently (threshold: 10%)
2023-06-29 06:20:54,557 - distributed.utils_perf - WARNING - full garbage collections took 10% CPU time recently (threshold: 10%)
2023-06-29 06:20:59,335 - distributed.utils_perf - WARNING - full garbage collections took 10% CPU time recently (threshold: 10%)
2023-06-29 06:21:46,047 - distributed.utils_perf - WARNING - full garbage collections took 10% CPU time recently (threshold: 10%)
2023-06-29 06:23:23,851 - distributed.utils_perf - WARNING - full garbage collections took 10% CPU time recently (threshold: 10%)
2023-06-29 06:25:49,236 - distributed.utils_perf - WARNING - full garbage collections took 10% CPU time recently (threshold: 10%)
2023-06-29 06:25:50,687 - distributed.utils_perf - WARNING - full garbage collections took 10% CPU time recently (threshold: 10%)
2023-06-29 06:25:56,045 - distributed.utils_perf - WARNING - full garbage collections took 10% CPU time recently (threshold: 10%)
2023-06-29 06:25:59,993 - distributed.utils_perf - WARNING - full garbage collections took 10% CPU time recently (threshold: 10%)
2023-06-29 06:26:44,848 - distributed.utils_perf - WARNING - full garbage collections took 10% CPU time recently (threshold: 10%)
2023-06-29 06:28:25,505 - distributed.utils_perf - WARNING - full garbage collections took 10% CPU time recently (threshold: 10%)
2023-06-29 06:30:14,084 - distributed.utils_perf - WARNING - full garbage collections took 10% CPU time recently (threshold: 10%)
2023-06-29 06:30:32,664 - distributed.utils_perf - WARNING - full garbage collections took 10% CPU time recently (threshold: 10%)
2023-06-29 06:30:37,870 - distributed.utils_perf - WARNING - full garbage collections took 10% CPU time recently (threshold: 10%)
2023-06-29 06:30:39,806 - distributed.utils_perf - WARNING - full garbage collections took 10% CPU time recently (threshold: 10%)
2023-06-29 06:30:40,891 - distributed.utils_perf - WARNING - full garbage collections took 11% CPU time recently (threshold: 10%)
2023-06-29 06:30:43,320 - distributed.utils_perf - WARNING - full garbage collections took 11% CPU time recently (threshold: 10%)
2023-06-29 06:30:48,255 - distributed.utils_perf - WARNING - full garbage collections took 11% CPU time recently (threshold: 10%)
2023-06-29 06:30:53,341 - distributed.utils_perf - WARNING - full garbage collections took 11% CPU time recently (threshold: 10%)
2023-06-29 06:31:46,047 - distributed.utils_perf - WARNING - full garbage collections took 11% CPU time recently (threshold: 10%)
2023-06-29 06:33:27,631 - distributed.utils_perf - WARNING - full garbage collections took 11% CPU time recently (threshold: 10%)
2023-06-29 06:35:06,869 - distributed.utils_perf - WARNING - full garbage collections took 11% CPU time recently (threshold: 10%)
2023-06-29 06:35:22,289 - distributed.utils_perf - WARNING - full garbage collections took 11% CPU time recently (threshold: 10%)
2023-06-29 06:35:27,556 - distributed.utils_perf - WARNING - full garbage collections took 11% CPU time recently (threshold: 10%)
2023-06-29 06:35:28,935 - distributed.utils_perf - WARNING - full garbage collections took 10% CPU time recently (threshold: 10%)
2023-06-29 06:35:30,110 - distributed.utils_perf - WARNING - full garbage collections took 11% CPU time recently (threshold: 10%)
2023-06-29 06:35:33,352 - distributed.utils_perf - WARNING - full garbage collections took 11% CPU time recently (threshold: 10%)
2023-06-29 06:35:38,203 - distributed.utils_perf - WARNING - full garbage collections took 12% CPU time recently (threshold: 10%)
2023-06-29 06:35:44,312 - distributed.utils_perf - WARNING - full garbage collections took 12% CPU time recently (threshold: 10%)
2023-06-29 06:37:10,369 - distributed.utils_perf - WARNING - full garbage collections took 11% CPU time recently (threshold: 10%)
2023-06-29 06:39:45,444 - distributed.utils_perf - WARNING - full garbage collections took 11% CPU time recently (threshold: 10%)
2023-06-29 06:40:07,765 - distributed.utils_perf - WARNING - full garbage collections took 11% CPU time recently (threshold: 10%)
2023-06-29 06:40:15,286 - distributed.utils_perf - WARNING - full garbage collections took 11% CPU time recently (threshold: 10%)
2023-06-29 06:40:20,311 - distributed.utils_perf - WARNING - full garbage collections took 11% CPU time recently (threshold: 10%)
2023-06-29 06:40:21,597 - distributed.utils_perf - WARNING - full garbage collections took 11% CPU time recently (threshold: 10%)
2023-06-29 06:40:22,740 - distributed.utils_perf - WARNING - full garbage collections took 11% CPU time recently (threshold: 10%)
2023-06-29 06:40:28,248 - distributed.utils_perf - WARNING - full garbage collections took 11% CPU time recently (threshold: 10%)
2023-06-29 06:40:31,243 - distributed.utils_perf - WARNING - full garbage collections took 11% CPU time recently (threshold: 10%)
2023-06-29 06:41:14,807 - distributed.utils_perf - WARNING - full garbage collections took 11% CPU time recently (threshold: 10%)
2023-06-29 06:42:22,306 - distributed.utils_perf - WARNING - full garbage collections took 11% CPU time recently (threshold: 10%)
2023-06-29 06:44:43,584 - distributed.utils_perf - WARNING - full garbage collections took 11% CPU time recently (threshold: 10%)
2023-06-29 06:45:06,652 - distributed.utils_perf - WARNING - full garbage collections took 10% CPU time recently (threshold: 10%)
2023-06-29 06:45:13,636 - distributed.utils_perf - WARNING - full garbage collections took 10% CPU time recently (threshold: 10%)
[I 2023-06-29 06:45:14,554] Trial 15 finished with value: 0.9127238441051878 and parameters: {'max_depth': 11, 'max_features': 0.11423911856190067, 'n_estimators': 480, 'criterion': 'entropy', 'min_samples_split': 4}. Best is trial 13 with value: 0.9215094271931911.
2023-06-29 06:45:15,290 - distributed.utils_perf - WARNING - full garbage collections took 10% CPU time recently (threshold: 10%)
2023-06-29 06:45:16,666 - distributed.utils_perf - WARNING - full garbage collections took 10% CPU time recently (threshold: 10%)
2023-06-29 06:45:17,810 - distributed.utils_perf - WARNING - full garbage collections took 10% CPU time recently (threshold: 10%)
2023-06-29 06:45:20,491 - distributed.utils_perf - WARNING - full garbage collections took 10% CPU time recently (threshold: 10%)
2023-06-29 06:45:25,609 - distributed.utils_perf - WARNING - full garbage collections took 10% CPU time recently (threshold: 10%)
2023-06-29 06:45:31,512 - distributed.utils_perf - WARNING - full garbage collections took 10% CPU time recently (threshold: 10%)
2023-06-29 06:46:37,091 - distributed.utils_perf - WARNING - full garbage collections took 10% CPU time recently (threshold: 10%)
2023-06-29 06:47:17,281 - distributed.utils_perf - WARNING - full garbage collections took 10% CPU time recently (threshold: 10%)
2023-06-29 06:47:55,209 - distributed.utils_perf - WARNING - full garbage collections took 10% CPU time recently (threshold: 10%)
2023-06-29 06:48:30,373 - distributed.utils_perf - WARNING - full garbage collections took 10% CPU time recently (threshold: 10%)
2023-06-29 06:49:13,365 - distributed.utils_perf - WARNING - full garbage collections took 10% CPU time recently (threshold: 10%)
[I 2023-06-29 07:15:27,879] Trial 16 finished with value: 0.9227844289727691 and parameters: {'max_depth': 15, 'max_features': 0.7271363453409101, 'n_estimators': 120, 'criterion': 'log_loss', 'min_samples_split': 153}. Best is trial 16 with value: 0.9227844289727691.
2023-06-29 07:18:00,103 - distributed.utils_perf - WARNING - full garbage collections took 11% CPU time recently (threshold: 10%)
2023-06-29 07:18:04,506 - distributed.utils_perf - WARNING - full garbage collections took 11% CPU time recently (threshold: 10%)
2023-06-29 07:18:09,716 - distributed.utils_perf - WARNING - full garbage collections took 11% CPU time recently (threshold: 10%)
2023-06-29 07:19:04,558 - distributed.utils_perf - WARNING - full garbage collections took 10% CPU time recently (threshold: 10%)
2023-06-29 07:19:07,614 - distributed.utils_perf - WARNING - full garbage collections took 10% CPU time recently (threshold: 10%)
2023-06-29 07:19:09,302 - distributed.utils_perf - WARNING - full garbage collections took 10% CPU time recently (threshold: 10%)
2023-06-29 07:19:10,441 - distributed.utils_perf - WARNING - full garbage collections took 10% CPU time recently (threshold: 10%)
2023-06-29 07:19:13,494 - distributed.utils_perf - WARNING - full garbage collections took 10% CPU time recently (threshold: 10%)
2023-06-29 07:19:17,750 - distributed.utils_perf - WARNING - full garbage collections took 11% CPU time recently (threshold: 10%)
2023-06-29 07:19:22,848 - distributed.utils_perf - WARNING - full garbage collections took 11% CPU time recently (threshold: 10%)
2023-06-29 07:20:16,344 - distributed.utils_perf - WARNING - full garbage collections took 11% CPU time recently (threshold: 10%)
2023-06-29 07:20:19,489 - distributed.utils_perf - WARNING - full garbage collections took 12% CPU time recently (threshold: 10%)
2023-06-29 07:20:20,889 - distributed.utils_perf - WARNING - full garbage collections took 12% CPU time recently (threshold: 10%)
2023-06-29 07:20:22,099 - distributed.utils_perf - WARNING - full garbage collections took 19% CPU time recently (threshold: 10%)
2023-06-29 07:20:25,231 - distributed.utils_perf - WARNING - full garbage collections took 19% CPU time recently (threshold: 10%)
2023-06-29 07:20:29,841 - distributed.utils_perf - WARNING - full garbage collections took 18% CPU time recently (threshold: 10%)
2023-06-29 07:20:36,604 - distributed.utils_perf - WARNING - full garbage collections took 18% CPU time recently (threshold: 10%)
2023-06-29 07:21:32,097 - distributed.utils_perf - WARNING - full garbage collections took 16% CPU time recently (threshold: 10%)
2023-06-29 07:21:35,107 - distributed.utils_perf - WARNING - full garbage collections took 16% CPU time recently (threshold: 10%)
[I 2023-06-29 07:21:35,115] Trial 17 finished with value: 0.9125177121667882 and parameters: {'max_depth': 6, 'max_features': 0.11789212045581604, 'n_estimators': 110, 'criterion': 'log_loss', 'min_samples_split': 50}. Best is trial 16 with value: 0.9227844289727691.
2023-06-29 07:21:36,526 - distributed.utils_perf - WARNING - full garbage collections took 16% CPU time recently (threshold: 10%)
2023-06-29 07:21:37,714 - distributed.utils_perf - WARNING - full garbage collections took 17% CPU time recently (threshold: 10%)
2023-06-29 07:21:39,493 - distributed.utils_perf - WARNING - full garbage collections took 17% CPU time recently (threshold: 10%)
2023-06-29 07:21:44,262 - distributed.utils_perf - WARNING - full garbage collections took 18% CPU time recently (threshold: 10%)
2023-06-29 07:21:49,449 - distributed.utils_perf - WARNING - full garbage collections took 18% CPU time recently (threshold: 10%)
2023-06-29 07:22:45,724 - distributed.utils_perf - WARNING - full garbage collections took 17% CPU time recently (threshold: 10%)
2023-06-29 07:23:23,539 - distributed.utils_perf - WARNING - full garbage collections took 15% CPU time recently (threshold: 10%)
2023-06-29 07:24:04,131 - distributed.utils_perf - WARNING - full garbage collections took 14% CPU time recently (threshold: 10%)
2023-06-29 07:24:38,336 - distributed.utils_perf - WARNING - full garbage collections took 14% CPU time recently (threshold: 10%)
2023-06-29 07:25:16,563 - distributed.utils_perf - WARNING - full garbage collections took 13% CPU time recently (threshold: 10%)
2023-06-29 07:26:23,858 - distributed.utils_perf - WARNING - full garbage collections took 13% CPU time recently (threshold: 10%)
2023-06-29 07:26:43,070 - distributed.utils_perf - WARNING - full garbage collections took 12% CPU time recently (threshold: 10%)
2023-06-29 07:27:00,466 - distributed.utils_perf - WARNING - full garbage collections took 12% CPU time recently (threshold: 10%)
2023-06-29 07:27:18,090 - distributed.utils_perf - WARNING - full garbage collections took 11% CPU time recently (threshold: 10%)
2023-06-29 07:27:36,703 - distributed.utils_perf - WARNING - full garbage collections took 11% CPU time recently (threshold: 10%)
2023-06-29 07:27:54,014 - distributed.utils_perf - WARNING - full garbage collections took 10% CPU time recently (threshold: 10%)
2023-06-29 07:28:22,838 - distributed.utils_perf - WARNING - full garbage collections took 10% CPU time recently (threshold: 10%)
2023-06-29 07:28:27,629 - distributed.utils_perf - WARNING - full garbage collections took 10% CPU time recently (threshold: 10%)
2023-06-29 07:28:29,791 - distributed.utils_perf - WARNING - full garbage collections took 10% CPU time recently (threshold: 10%)
2023-06-29 07:28:31,008 - distributed.utils_perf - WARNING - full garbage collections took 10% CPU time recently (threshold: 10%)
2023-06-29 07:28:33,177 - distributed.utils_perf - WARNING - full garbage collections took 10% CPU time recently (threshold: 10%)
2023-06-29 07:28:38,149 - distributed.utils_perf - WARNING - full garbage collections took 10% CPU time recently (threshold: 10%)
2023-06-29 07:28:43,186 - distributed.utils_perf - WARNING - full garbage collections took 10% CPU time recently (threshold: 10%)
2023-06-29 07:29:38,218 - distributed.utils_perf - WARNING - full garbage collections took 10% CPU time recently (threshold: 10%)
2023-06-29 07:30:14,993 - distributed.utils_perf - WARNING - full garbage collections took 10% CPU time recently (threshold: 10%)
2023-06-29 07:30:55,411 - distributed.utils_perf - WARNING - full garbage collections took 10% CPU time recently (threshold: 10%)
2023-06-29 07:31:35,305 - distributed.utils_perf - WARNING - full garbage collections took 10% CPU time recently (threshold: 10%)
