[I 2023-08-27 08:20:41,559] Trial 82 finished with value: 0.9149111939516787 and parameters: {'max_depth': 9, 'max_features': 0.32265643294214685, 'n_estimators': 250, 'min_samples_split': 642, 'criterion': 'gini'}. Best is trial 38 with value: 0.9226818139737695.
[I 2023-08-27 08:39:00,519] Trial 83 finished with value: 0.9184722121391676 and parameters: {'max_depth': 15, 'max_features': 0.30511026095618526, 'n_estimators': 130, 'min_samples_split': 7, 'criterion': 'gini'}. Best is trial 38 with value: 0.9226818139737695.
[I 2023-08-27 09:44:31,058] Trial 84 finished with value: 0.9175873287715757 and parameters: {'max_depth': 11, 'max_features': 0.47222777350104517, 'n_estimators': 430, 'min_samples_split': 5, 'criterion': 'gini'}. Best is trial 38 with value: 0.9226818139737695.
[I 2023-08-27 10:02:27,916] Trial 85 finished with value: 0.9170943891985175 and parameters: {'max_depth': 11, 'max_features': 0.41408883749870995, 'n_estimators': 120, 'min_samples_split': 7, 'criterion': 'gini'}. Best is trial 38 with value: 0.9226818139737695.
[I 2023-08-27 10:32:47,958] Trial 86 finished with value: 0.9147453296106661 and parameters: {'max_depth': 10, 'max_features': 0.25724813509803024, 'n_estimators': 330, 'min_samples_split': 980, 'criterion': 'gini'}. Best is trial 38 with value: 0.9226818139737695.
[I 2023-08-27 12:22:55,773] Trial 87 finished with value: 0.924031197693553 and parameters: {'max_depth': 15, 'max_features': 0.9114063262023891, 'n_estimators': 340, 'min_samples_split': 2, 'criterion': 'gini'}. Best is trial 87 with value: 0.924031197693553.
[I 2023-08-27 13:18:37,027] Trial 88 finished with value: 0.9154746439804586 and parameters: {'max_depth': 9, 'max_features': 0.43789134985107203, 'n_estimators': 490, 'min_samples_split': 4, 'criterion': 'gini'}. Best is trial 87 with value: 0.924031197693553.
[I 2023-08-27 14:42:11,968] Trial 89 finished with value: 0.9214999406673959 and parameters: {'max_depth': 14, 'max_features': 0.6693542351001975, 'n_estimators': 370, 'min_samples_split': 33, 'criterion': 'entropy'}. Best is trial 87 with value: 0.924031197693553.
[I 2023-08-27 15:40:33,634] Trial 90 finished with value: 0.9175666839031216 and parameters: {'max_depth': 10, 'max_features': 0.7570820899810939, 'n_estimators': 290, 'min_samples_split': 29, 'criterion': 'gini'}. Best is trial 87 with value: 0.924031197693553.
[I 2023-08-27 16:54:33,081] Trial 91 finished with value: 0.9185537428462535 and parameters: {'max_depth': 13, 'max_features': 0.3879575542699105, 'n_estimators': 500, 'min_samples_split': 6, 'criterion': 'entropy'}. Best is trial 87 with value: 0.924031197693553.
[I 2023-08-27 17:23:12,452] Trial 92 finished with value: 0.9192357433620005 and parameters: {'max_depth': 13, 'max_features': 0.5174720055102661, 'n_estimators': 150, 'min_samples_split': 11, 'criterion': 'entropy'}. Best is trial 87 with value: 0.924031197693553.
[I 2023-08-27 17:34:06,895] Trial 93 finished with value: 0.9151576262671421 and parameters: {'max_depth': 13, 'max_features': 0.21730220285891885, 'n_estimators': 100, 'min_samples_split': 44, 'criterion': 'gini'}. Best is trial 87 with value: 0.924031197693553.
[I 2023-08-27 18:39:58,962] Trial 94 finished with value: 0.9192613522516467 and parameters: {'max_depth': 12, 'max_features': 0.7181274039912926, 'n_estimators': 280, 'min_samples_split': 575, 'criterion': 'gini'}. Best is trial 87 with value: 0.924031197693553.
[I 2023-08-27 20:21:43,807] Trial 95 finished with value: 0.9178695560200772 and parameters: {'max_depth': 10, 'max_features': 0.87338602548784, 'n_estimators': 440, 'min_samples_split': 102, 'criterion': 'gini'}. Best is trial 87 with value: 0.924031197693553.
[I 2023-08-27 21:11:43,923] Trial 96 finished with value: 0.915338901463622 and parameters: {'max_depth': 8, 'max_features': 0.6044769914824529, 'n_estimators': 370, 'min_samples_split': 15, 'criterion': 'gini'}. Best is trial 87 with value: 0.924031197693553.
[I 2023-08-27 22:04:38,530] Trial 97 finished with value: 0.9180166615010451 and parameters: {'max_depth': 13, 'max_features': 0.36064247156818974, 'n_estimators': 410, 'min_samples_split': 24, 'criterion': 'gini'}. Best is trial 87 with value: 0.924031197693553.
[I 2023-08-27 22:41:52,541] Trial 98 finished with value: 0.9146637789019877 and parameters: {'max_depth': 7, 'max_features': 0.7905560575795899, 'n_estimators': 220, 'min_samples_split': 177, 'criterion': 'gini'}. Best is trial 87 with value: 0.924031197693553.
[I 2023-08-27 22:54:06,001] Trial 99 finished with value: 0.912241412137484 and parameters: {'max_depth': 7, 'max_features': 0.27905313108436003, 'n_estimators': 150, 'min_samples_split': 17, 'criterion': 'entropy'}. Best is trial 87 with value: 0.924031197693553.
Time elapsed: 280783.851993407 sec
