[I 2023-07-15 04:26:49,243] A new study created in memory with name: no-name-41bac7db-00f1-4314-a35c-5505858f78bf
2023-07-15 04:27:05,426 - distributed.worker - ERROR - Exception during execution of task ('repartition-1000-3ec5f199100e2771caafe1c13e0c892e', 918).
Traceback (most recent call last):
  File "/opt/conda/envs/rapids/lib/python3.10/site-packages/zict/buffer.py", line 184, in __getitem__
    return self.fast[key]
  File "/opt/conda/envs/rapids/lib/python3.10/site-packages/zict/common.py", line 127, in wrapper
    return func(*args, **kwargs)
  File "/opt/conda/envs/rapids/lib/python3.10/site-packages/zict/lru.py", line 117, in __getitem__
    result = self.d[key]
KeyError: "('split-ad3d704d6281abd28d4b7e616a61f815', 34)"

During handling of the above exception, another exception occurred:

Traceback (most recent call last):
  File "/opt/conda/envs/rapids/lib/python3.10/site-packages/distributed/worker.py", line 2382, in _prepare_args_for_execution
    data[k] = self.data[k]
  File "/opt/conda/envs/rapids/lib/python3.10/site-packages/distributed/spill.py", line 226, in __getitem__
    return super().__getitem__(key)
  File "/opt/conda/envs/rapids/lib/python3.10/site-packages/zict/common.py", line 127, in wrapper
    return func(*args, **kwargs)
  File "/opt/conda/envs/rapids/lib/python3.10/site-packages/zict/buffer.py", line 186, in __getitem__
    return self.slow_to_fast(key)
  File "/opt/conda/envs/rapids/lib/python3.10/site-packages/zict/buffer.py", line 153, in slow_to_fast
    value = self.slow[key]
  File "/opt/conda/envs/rapids/lib/python3.10/site-packages/zict/common.py", line 127, in wrapper
    return func(*args, **kwargs)
  File "/opt/conda/envs/rapids/lib/python3.10/site-packages/zict/cache.py", line 67, in __getitem__
    gen = self._last_updated[key]
KeyError: "('split-ad3d704d6281abd28d4b7e616a61f815', 34)"

During handling of the above exception, another exception occurred:

Traceback (most recent call last):
  File "/opt/conda/envs/rapids/lib/python3.10/site-packages/distributed/worker.py", line 2259, in execute
    args2, kwargs2 = self._prepare_args_for_execution(ts, args, kwargs)
  File "/opt/conda/envs/rapids/lib/python3.10/site-packages/distributed/worker.py", line 2386, in _prepare_args_for_execution
    data[k] = Actor(type(self.state.actors[k]), self.address, k, self)
KeyError: "('split-ad3d704d6281abd28d4b7e616a61f815', 34)"
2023-07-15 04:27:05,426 - distributed.worker - ERROR - Exception during execution of task ('repartition-1000-3ec5f199100e2771caafe1c13e0c892e', 864).
Traceback (most recent call last):
  File "/opt/conda/envs/rapids/lib/python3.10/site-packages/zict/buffer.py", line 184, in __getitem__
    return self.fast[key]
  File "/opt/conda/envs/rapids/lib/python3.10/site-packages/zict/common.py", line 127, in wrapper
    return func(*args, **kwargs)
  File "/opt/conda/envs/rapids/lib/python3.10/site-packages/zict/lru.py", line 117, in __getitem__
    result = self.d[key]
KeyError: "('split-ad3d704d6281abd28d4b7e616a61f815', 32)"

During handling of the above exception, another exception occurred:

Traceback (most recent call last):
  File "/opt/conda/envs/rapids/lib/python3.10/site-packages/distributed/worker.py", line 2382, in _prepare_args_for_execution
    data[k] = self.data[k]
  File "/opt/conda/envs/rapids/lib/python3.10/site-packages/distributed/spill.py", line 226, in __getitem__
    return super().__getitem__(key)
  File "/opt/conda/envs/rapids/lib/python3.10/site-packages/zict/common.py", line 127, in wrapper
    return func(*args, **kwargs)
  File "/opt/conda/envs/rapids/lib/python3.10/site-packages/zict/buffer.py", line 186, in __getitem__
    return self.slow_to_fast(key)
  File "/opt/conda/envs/rapids/lib/python3.10/site-packages/zict/buffer.py", line 153, in slow_to_fast
    value = self.slow[key]
  File "/opt/conda/envs/rapids/lib/python3.10/site-packages/zict/common.py", line 127, in wrapper
    return func(*args, **kwargs)
  File "/opt/conda/envs/rapids/lib/python3.10/site-packages/zict/cache.py", line 67, in __getitem__
    gen = self._last_updated[key]
KeyError: "('split-ad3d704d6281abd28d4b7e616a61f815', 32)"

During handling of the above exception, another exception occurred:

Traceback (most recent call last):
  File "/opt/conda/envs/rapids/lib/python3.10/site-packages/distributed/worker.py", line 2259, in execute
    args2, kwargs2 = self._prepare_args_for_execution(ts, args, kwargs)
  File "/opt/conda/envs/rapids/lib/python3.10/site-packages/distributed/worker.py", line 2386, in _prepare_args_for_execution
    data[k] = Actor(type(self.state.actors[k]), self.address, k, self)
KeyError: "('split-ad3d704d6281abd28d4b7e616a61f815', 32)"
2023-07-15 04:27:05,426 - distributed.worker - ERROR - Exception during execution of task ('repartition-1000-3ec5f199100e2771caafe1c13e0c892e', 405).
Traceback (most recent call last):
  File "/opt/conda/envs/rapids/lib/python3.10/site-packages/zict/buffer.py", line 184, in __getitem__
    return self.fast[key]
  File "/opt/conda/envs/rapids/lib/python3.10/site-packages/zict/common.py", line 127, in wrapper
    return func(*args, **kwargs)
  File "/opt/conda/envs/rapids/lib/python3.10/site-packages/zict/lru.py", line 117, in __getitem__
    result = self.d[key]
KeyError: "('split-ad3d704d6281abd28d4b7e616a61f815', 15)"

During handling of the above exception, another exception occurred:

Traceback (most recent call last):
  File "/opt/conda/envs/rapids/lib/python3.10/site-packages/distributed/worker.py", line 2382, in _prepare_args_for_execution
    data[k] = self.data[k]
  File "/opt/conda/envs/rapids/lib/python3.10/site-packages/distributed/spill.py", line 226, in __getitem__
    return super().__getitem__(key)
  File "/opt/conda/envs/rapids/lib/python3.10/site-packages/zict/common.py", line 127, in wrapper
    return func(*args, **kwargs)
  File "/opt/conda/envs/rapids/lib/python3.10/site-packages/zict/buffer.py", line 186, in __getitem__
    return self.slow_to_fast(key)
  File "/opt/conda/envs/rapids/lib/python3.10/site-packages/zict/buffer.py", line 153, in slow_to_fast
    value = self.slow[key]
  File "/opt/conda/envs/rapids/lib/python3.10/site-packages/zict/common.py", line 127, in wrapper
    return func(*args, **kwargs)
  File "/opt/conda/envs/rapids/lib/python3.10/site-packages/zict/cache.py", line 67, in __getitem__
    gen = self._last_updated[key]
KeyError: "('split-ad3d704d6281abd28d4b7e616a61f815', 15)"

During handling of the above exception, another exception occurred:

Traceback (most recent call last):
  File "/opt/conda/envs/rapids/lib/python3.10/site-packages/distributed/worker.py", line 2259, in execute
    args2, kwargs2 = self._prepare_args_for_execution(ts, args, kwargs)
  File "/opt/conda/envs/rapids/lib/python3.10/site-packages/distributed/worker.py", line 2386, in _prepare_args_for_execution
    data[k] = Actor(type(self.state.actors[k]), self.address, k, self)
KeyError: "('split-ad3d704d6281abd28d4b7e616a61f815', 15)"
2023-07-15 04:27:05,427 - distributed.worker - ERROR - Exception during execution of task ('repartition-1000-3ec5f199100e2771caafe1c13e0c892e', 297).
Traceback (most recent call last):
  File "/opt/conda/envs/rapids/lib/python3.10/site-packages/zict/buffer.py", line 184, in __getitem__
    return self.fast[key]
  File "/opt/conda/envs/rapids/lib/python3.10/site-packages/zict/common.py", line 127, in wrapper
    return func(*args, **kwargs)
  File "/opt/conda/envs/rapids/lib/python3.10/site-packages/zict/lru.py", line 117, in __getitem__
    result = self.d[key]
KeyError: "('split-ad3d704d6281abd28d4b7e616a61f815', 11)"

During handling of the above exception, another exception occurred:

Traceback (most recent call last):
  File "/opt/conda/envs/rapids/lib/python3.10/site-packages/distributed/worker.py", line 2382, in _prepare_args_for_execution
    data[k] = self.data[k]
  File "/opt/conda/envs/rapids/lib/python3.10/site-packages/distributed/spill.py", line 226, in __getitem__
    return super().__getitem__(key)
  File "/opt/conda/envs/rapids/lib/python3.10/site-packages/zict/common.py", line 127, in wrapper
    return func(*args, **kwargs)
  File "/opt/conda/envs/rapids/lib/python3.10/site-packages/zict/buffer.py", line 186, in __getitem__
    return self.slow_to_fast(key)
  File "/opt/conda/envs/rapids/lib/python3.10/site-packages/zict/buffer.py", line 153, in slow_to_fast
    value = self.slow[key]
  File "/opt/conda/envs/rapids/lib/python3.10/site-packages/zict/common.py", line 127, in wrapper
    return func(*args, **kwargs)
  File "/opt/conda/envs/rapids/lib/python3.10/site-packages/zict/cache.py", line 67, in __getitem__
    gen = self._last_updated[key]
KeyError: "('split-ad3d704d6281abd28d4b7e616a61f815', 11)"

During handling of the above exception, another exception occurred:

Traceback (most recent call last):
  File "/opt/conda/envs/rapids/lib/python3.10/site-packages/distributed/worker.py", line 2259, in execute
    args2, kwargs2 = self._prepare_args_for_execution(ts, args, kwargs)
  File "/opt/conda/envs/rapids/lib/python3.10/site-packages/distributed/worker.py", line 2386, in _prepare_args_for_execution
    data[k] = Actor(type(self.state.actors[k]), self.address, k, self)
KeyError: "('split-ad3d704d6281abd28d4b7e616a61f815', 11)"
2023-07-15 04:27:05,427 - distributed.worker - ERROR - Exception during execution of task ('repartition-1000-3ec5f199100e2771caafe1c13e0c892e', 351).
Traceback (most recent call last):
  File "/opt/conda/envs/rapids/lib/python3.10/site-packages/zict/buffer.py", line 184, in __getitem__
    return self.fast[key]
  File "/opt/conda/envs/rapids/lib/python3.10/site-packages/zict/common.py", line 127, in wrapper
    return func(*args, **kwargs)
  File "/opt/conda/envs/rapids/lib/python3.10/site-packages/zict/lru.py", line 117, in __getitem__
    result = self.d[key]
KeyError: "('split-ad3d704d6281abd28d4b7e616a61f815', 13)"

During handling of the above exception, another exception occurred:

Traceback (most recent call last):
  File "/opt/conda/envs/rapids/lib/python3.10/site-packages/distributed/worker.py", line 2382, in _prepare_args_for_execution
    data[k] = self.data[k]
  File "/opt/conda/envs/rapids/lib/python3.10/site-packages/distributed/spill.py", line 226, in __getitem__
    return super().__getitem__(key)
  File "/opt/conda/envs/rapids/lib/python3.10/site-packages/zict/common.py", line 127, in wrapper
    return func(*args, **kwargs)
  File "/opt/conda/envs/rapids/lib/python3.10/site-packages/zict/buffer.py", line 186, in __getitem__
    return self.slow_to_fast(key)
  File "/opt/conda/envs/rapids/lib/python3.10/site-packages/zict/buffer.py", line 153, in slow_to_fast
    value = self.slow[key]
  File "/opt/conda/envs/rapids/lib/python3.10/site-packages/zict/common.py", line 127, in wrapper
    return func(*args, **kwargs)
  File "/opt/conda/envs/rapids/lib/python3.10/site-packages/zict/cache.py", line 67, in __getitem__
    gen = self._last_updated[key]
KeyError: "('split-ad3d704d6281abd28d4b7e616a61f815', 13)"

During handling of the above exception, another exception occurred:

Traceback (most recent call last):
  File "/opt/conda/envs/rapids/lib/python3.10/site-packages/distributed/worker.py", line 2259, in execute
    args2, kwargs2 = self._prepare_args_for_execution(ts, args, kwargs)
  File "/opt/conda/envs/rapids/lib/python3.10/site-packages/distributed/worker.py", line 2386, in _prepare_args_for_execution
    data[k] = Actor(type(self.state.actors[k]), self.address, k, self)
KeyError: "('split-ad3d704d6281abd28d4b7e616a61f815', 13)"
2023-07-15 04:27:05,429 - distributed.worker - ERROR - Exception during execution of task ('repartition-1000-3ec5f199100e2771caafe1c13e0c892e', 432).
Traceback (most recent call last):
  File "/opt/conda/envs/rapids/lib/python3.10/site-packages/zict/buffer.py", line 184, in __getitem__
    return self.fast[key]
  File "/opt/conda/envs/rapids/lib/python3.10/site-packages/zict/common.py", line 127, in wrapper
    return func(*args, **kwargs)
  File "/opt/conda/envs/rapids/lib/python3.10/site-packages/zict/lru.py", line 117, in __getitem__
    result = self.d[key]
KeyError: "('split-ad3d704d6281abd28d4b7e616a61f815', 16)"

During handling of the above exception, another exception occurred:

Traceback (most recent call last):
  File "/opt/conda/envs/rapids/lib/python3.10/site-packages/distributed/worker.py", line 2382, in _prepare_args_for_execution
    data[k] = self.data[k]
  File "/opt/conda/envs/rapids/lib/python3.10/site-packages/distributed/spill.py", line 226, in __getitem__
    return super().__getitem__(key)
  File "/opt/conda/envs/rapids/lib/python3.10/site-packages/zict/common.py", line 127, in wrapper
    return func(*args, **kwargs)
  File "/opt/conda/envs/rapids/lib/python3.10/site-packages/zict/buffer.py", line 186, in __getitem__
    return self.slow_to_fast(key)
  File "/opt/conda/envs/rapids/lib/python3.10/site-packages/zict/buffer.py", line 153, in slow_to_fast
    value = self.slow[key]
  File "/opt/conda/envs/rapids/lib/python3.10/site-packages/zict/common.py", line 127, in wrapper
    return func(*args, **kwargs)
  File "/opt/conda/envs/rapids/lib/python3.10/site-packages/zict/cache.py", line 67, in __getitem__
    gen = self._last_updated[key]
KeyError: "('split-ad3d704d6281abd28d4b7e616a61f815', 16)"

During handling of the above exception, another exception occurred:

Traceback (most recent call last):
  File "/opt/conda/envs/rapids/lib/python3.10/site-packages/distributed/worker.py", line 2259, in execute
    args2, kwargs2 = self._prepare_args_for_execution(ts, args, kwargs)
  File "/opt/conda/envs/rapids/lib/python3.10/site-packages/distributed/worker.py", line 2386, in _prepare_args_for_execution
    data[k] = Actor(type(self.state.actors[k]), self.address, k, self)
KeyError: "('split-ad3d704d6281abd28d4b7e616a61f815', 16)"
2023-07-15 04:27:05,430 - distributed.worker - ERROR - Exception during execution of task ('repartition-1000-3ec5f199100e2771caafe1c13e0c892e', 486).
Traceback (most recent call last):
  File "/opt/conda/envs/rapids/lib/python3.10/site-packages/zict/buffer.py", line 184, in __getitem__
    return self.fast[key]
  File "/opt/conda/envs/rapids/lib/python3.10/site-packages/zict/common.py", line 127, in wrapper
    return func(*args, **kwargs)
  File "/opt/conda/envs/rapids/lib/python3.10/site-packages/zict/lru.py", line 117, in __getitem__
    result = self.d[key]
KeyError: "('split-ad3d704d6281abd28d4b7e616a61f815', 18)"

During handling of the above exception, another exception occurred:

Traceback (most recent call last):
  File "/opt/conda/envs/rapids/lib/python3.10/site-packages/distributed/worker.py", line 2382, in _prepare_args_for_execution
    data[k] = self.data[k]
  File "/opt/conda/envs/rapids/lib/python3.10/site-packages/distributed/spill.py", line 226, in __getitem__
    return super().__getitem__(key)
  File "/opt/conda/envs/rapids/lib/python3.10/site-packages/zict/common.py", line 127, in wrapper
    return func(*args, **kwargs)
  File "/opt/conda/envs/rapids/lib/python3.10/site-packages/zict/buffer.py", line 186, in __getitem__
    return self.slow_to_fast(key)
  File "/opt/conda/envs/rapids/lib/python3.10/site-packages/zict/buffer.py", line 153, in slow_to_fast
    value = self.slow[key]
  File "/opt/conda/envs/rapids/lib/python3.10/site-packages/zict/common.py", line 127, in wrapper
    return func(*args, **kwargs)
  File "/opt/conda/envs/rapids/lib/python3.10/site-packages/zict/cache.py", line 67, in __getitem__
    gen = self._last_updated[key]
KeyError: "('split-ad3d704d6281abd28d4b7e616a61f815', 18)"

During handling of the above exception, another exception occurred:

Traceback (most recent call last):
  File "/opt/conda/envs/rapids/lib/python3.10/site-packages/distributed/worker.py", line 2259, in execute
    args2, kwargs2 = self._prepare_args_for_execution(ts, args, kwargs)
  File "/opt/conda/envs/rapids/lib/python3.10/site-packages/distributed/worker.py", line 2386, in _prepare_args_for_execution
    data[k] = Actor(type(self.state.actors[k]), self.address, k, self)
KeyError: "('split-ad3d704d6281abd28d4b7e616a61f815', 18)"
2023-07-15 04:27:05,432 - distributed.worker - ERROR - Exception during execution of task ('repartition-1000-3ec5f199100e2771caafe1c13e0c892e', 945).
Traceback (most recent call last):
  File "/opt/conda/envs/rapids/lib/python3.10/site-packages/zict/buffer.py", line 184, in __getitem__
    return self.fast[key]
  File "/opt/conda/envs/rapids/lib/python3.10/site-packages/zict/common.py", line 127, in wrapper
    return func(*args, **kwargs)
  File "/opt/conda/envs/rapids/lib/python3.10/site-packages/zict/lru.py", line 117, in __getitem__
    result = self.d[key]
KeyError: "('split-ad3d704d6281abd28d4b7e616a61f815', 35)"

During handling of the above exception, another exception occurred:

Traceback (most recent call last):
  File "/opt/conda/envs/rapids/lib/python3.10/site-packages/distributed/worker.py", line 2382, in _prepare_args_for_execution
    data[k] = self.data[k]
  File "/opt/conda/envs/rapids/lib/python3.10/site-packages/distributed/spill.py", line 226, in __getitem__
    return super().__getitem__(key)
  File "/opt/conda/envs/rapids/lib/python3.10/site-packages/zict/common.py", line 127, in wrapper
    return func(*args, **kwargs)
  File "/opt/conda/envs/rapids/lib/python3.10/site-packages/zict/buffer.py", line 186, in __getitem__
    return self.slow_to_fast(key)
  File "/opt/conda/envs/rapids/lib/python3.10/site-packages/zict/buffer.py", line 153, in slow_to_fast
    value = self.slow[key]
  File "/opt/conda/envs/rapids/lib/python3.10/site-packages/zict/common.py", line 127, in wrapper
    return func(*args, **kwargs)
  File "/opt/conda/envs/rapids/lib/python3.10/site-packages/zict/cache.py", line 67, in __getitem__
    gen = self._last_updated[key]
KeyError: "('split-ad3d704d6281abd28d4b7e616a61f815', 35)"

During handling of the above exception, another exception occurred:

Traceback (most recent call last):
  File "/opt/conda/envs/rapids/lib/python3.10/site-packages/distributed/worker.py", line 2259, in execute
    args2, kwargs2 = self._prepare_args_for_execution(ts, args, kwargs)
  File "/opt/conda/envs/rapids/lib/python3.10/site-packages/distributed/worker.py", line 2386, in _prepare_args_for_execution
    data[k] = Actor(type(self.state.actors[k]), self.address, k, self)
KeyError: "('split-ad3d704d6281abd28d4b7e616a61f815', 35)"
2023-07-15 04:27:05,433 - distributed.worker - ERROR - Exception during execution of task ('repartition-1000-3ec5f199100e2771caafe1c13e0c892e', 378).
Traceback (most recent call last):
  File "/opt/conda/envs/rapids/lib/python3.10/site-packages/zict/buffer.py", line 184, in __getitem__
    return self.fast[key]
  File "/opt/conda/envs/rapids/lib/python3.10/site-packages/zict/common.py", line 127, in wrapper
    return func(*args, **kwargs)
  File "/opt/conda/envs/rapids/lib/python3.10/site-packages/zict/lru.py", line 117, in __getitem__
    result = self.d[key]
KeyError: "('split-ad3d704d6281abd28d4b7e616a61f815', 14)"

During handling of the above exception, another exception occurred:

Traceback (most recent call last):
  File "/opt/conda/envs/rapids/lib/python3.10/site-packages/distributed/worker.py", line 2382, in _prepare_args_for_execution
    data[k] = self.data[k]
  File "/opt/conda/envs/rapids/lib/python3.10/site-packages/distributed/spill.py", line 226, in __getitem__
    return super().__getitem__(key)
  File "/opt/conda/envs/rapids/lib/python3.10/site-packages/zict/common.py", line 127, in wrapper
    return func(*args, **kwargs)
  File "/opt/conda/envs/rapids/lib/python3.10/site-packages/zict/buffer.py", line 186, in __getitem__
    return self.slow_to_fast(key)
  File "/opt/conda/envs/rapids/lib/python3.10/site-packages/zict/buffer.py", line 153, in slow_to_fast
    value = self.slow[key]
  File "/opt/conda/envs/rapids/lib/python3.10/site-packages/zict/common.py", line 127, in wrapper
    return func(*args, **kwargs)
  File "/opt/conda/envs/rapids/lib/python3.10/site-packages/zict/cache.py", line 67, in __getitem__
    gen = self._last_updated[key]
KeyError: "('split-ad3d704d6281abd28d4b7e616a61f815', 14)"

During handling of the above exception, another exception occurred:

Traceback (most recent call last):
  File "/opt/conda/envs/rapids/lib/python3.10/site-packages/distributed/worker.py", line 2259, in execute
    args2, kwargs2 = self._prepare_args_for_execution(ts, args, kwargs)
  File "/opt/conda/envs/rapids/lib/python3.10/site-packages/distributed/worker.py", line 2386, in _prepare_args_for_execution
    data[k] = Actor(type(self.state.actors[k]), self.address, k, self)
KeyError: "('split-ad3d704d6281abd28d4b7e616a61f815', 14)"
2023-07-15 04:27:05,434 - distributed.worker - ERROR - Exception during execution of task ('repartition-1000-3ec5f199100e2771caafe1c13e0c892e', 702).
Traceback (most recent call last):
  File "/opt/conda/envs/rapids/lib/python3.10/site-packages/zict/buffer.py", line 184, in __getitem__
    return self.fast[key]
  File "/opt/conda/envs/rapids/lib/python3.10/site-packages/zict/common.py", line 127, in wrapper
    return func(*args, **kwargs)
  File "/opt/conda/envs/rapids/lib/python3.10/site-packages/zict/lru.py", line 117, in __getitem__
    result = self.d[key]
KeyError: "('split-ad3d704d6281abd28d4b7e616a61f815', 26)"

During handling of the above exception, another exception occurred:

Traceback (most recent call last):
  File "/opt/conda/envs/rapids/lib/python3.10/site-packages/distributed/worker.py", line 2382, in _prepare_args_for_execution
    data[k] = self.data[k]
  File "/opt/conda/envs/rapids/lib/python3.10/site-packages/distributed/spill.py", line 226, in __getitem__
    return super().__getitem__(key)
  File "/opt/conda/envs/rapids/lib/python3.10/site-packages/zict/common.py", line 127, in wrapper
    return func(*args, **kwargs)
  File "/opt/conda/envs/rapids/lib/python3.10/site-packages/zict/buffer.py", line 186, in __getitem__
    return self.slow_to