[I 2023-08-31 03:08:06,086] Trial 82 finished with value: 0.9148950764430707 and parameters: {'max_depth': 9, 'max_features': 0.32265643294214685, 'n_estimators': 250, 'min_samples_split': 642, 'criterion': 'gini'}. Best is trial 38 with value: 0.9227111001104653.
[I 2023-08-31 03:30:04,151] Trial 83 finished with value: 0.9184167911346229 and parameters: {'max_depth': 15, 'max_features': 0.30511026095618526, 'n_estimators': 130, 'min_samples_split': 7, 'criterion': 'gini'}. Best is trial 38 with value: 0.9227111001104653.
[I 2023-08-31 04:49:11,391] Trial 84 finished with value: 0.9176055935803774 and parameters: {'max_depth': 11, 'max_features': 0.47222777350104517, 'n_estimators': 430, 'min_samples_split': 5, 'criterion': 'gini'}. Best is trial 38 with value: 0.9227111001104653.
[I 2023-08-31 05:10:10,701] Trial 85 finished with value: 0.9170134241366055 and parameters: {'max_depth': 11, 'max_features': 0.41408883749870995, 'n_estimators': 120, 'min_samples_split': 7, 'criterion': 'gini'}. Best is trial 38 with value: 0.9227111001104653.
[I 2023-08-31 05:46:49,517] Trial 86 finished with value: 0.9147364337042838 and parameters: {'max_depth': 10, 'max_features': 0.25724813509803024, 'n_estimators': 330, 'min_samples_split': 980, 'criterion': 'gini'}. Best is trial 38 with value: 0.9227111001104653.
[I 2023-08-31 08:02:16,388] Trial 87 finished with value: 0.9240430149881604 and parameters: {'max_depth': 15, 'max_features': 0.9114063262023891, 'n_estimators': 340, 'min_samples_split': 2, 'criterion': 'gini'}. Best is trial 87 with value: 0.9240430149881604.
[I 2023-08-31 09:09:14,181] Trial 88 finished with value: 0.9154805370319095 and parameters: {'max_depth': 9, 'max_features': 0.43789134985107203, 'n_estimators': 490, 'min_samples_split': 4, 'criterion': 'gini'}. Best is trial 87 with value: 0.9240430149881604.
[I 2023-08-31 10:49:32,662] Trial 89 finished with value: 0.9214973416187148 and parameters: {'max_depth': 14, 'max_features': 0.6693542351001975, 'n_estimators': 370, 'min_samples_split': 33, 'criterion': 'entropy'}. Best is trial 87 with value: 0.9240430149881604.
[I 2023-08-31 12:01:02,813] Trial 90 finished with value: 0.9175791466774115 and parameters: {'max_depth': 10, 'max_features': 0.7570820899810939, 'n_estimators': 290, 'min_samples_split': 29, 'criterion': 'gini'}. Best is trial 87 with value: 0.9240430149881604.
[I 2023-08-31 13:29:26,425] Trial 91 finished with value: 0.9185554867338436 and parameters: {'max_depth': 13, 'max_features': 0.3879575542699105, 'n_estimators': 500, 'min_samples_split': 6, 'criterion': 'entropy'}. Best is trial 87 with value: 0.9240430149881604.
[I 2023-08-31 14:05:23,303] Trial 92 finished with value: 0.9192701351264672 and parameters: {'max_depth': 13, 'max_features': 0.5174720055102661, 'n_estimators': 150, 'min_samples_split': 11, 'criterion': 'entropy'}. Best is trial 87 with value: 0.9240430149881604.
[I 2023-08-31 14:18:00,011] Trial 93 finished with value: 0.9150495601402232 and parameters: {'max_depth': 13, 'max_features': 0.21730220285891885, 'n_estimators': 100, 'min_samples_split': 44, 'criterion': 'gini'}. Best is trial 87 with value: 0.9240430149881604.
[I 2023-08-31 15:39:04,856] Trial 94 finished with value: 0.9192917240034637 and parameters: {'max_depth': 12, 'max_features': 0.7181274039912926, 'n_estimators': 280, 'min_samples_split': 575, 'criterion': 'gini'}. Best is trial 87 with value: 0.9240430149881604.
[I 2023-08-31 17:41:00,921] Trial 95 finished with value: 0.9178678138141911 and parameters: {'max_depth': 10, 'max_features': 0.87338602548784, 'n_estimators': 440, 'min_samples_split': 102, 'criterion': 'gini'}. Best is trial 87 with value: 0.9240430149881604.
[I 2023-08-31 18:40:49,010] Trial 96 finished with value: 0.9152888528301343 and parameters: {'max_depth': 8, 'max_features': 0.6044769914824529, 'n_estimators': 370, 'min_samples_split': 15, 'criterion': 'gini'}. Best is trial 87 with value: 0.9240430149881604.
[I 2023-08-31 19:45:10,562] Trial 97 finished with value: 0.9180127208082467 and parameters: {'max_depth': 13, 'max_features': 0.36064247156818974, 'n_estimators': 410, 'min_samples_split': 24, 'criterion': 'gini'}. Best is trial 87 with value: 0.9240430149881604.
[I 2023-08-31 20:30:47,003] Trial 98 finished with value: 0.9146338355112661 and parameters: {'max_depth': 7, 'max_features': 0.7905560575795899, 'n_estimators': 220, 'min_samples_split': 177, 'criterion': 'gini'}. Best is trial 87 with value: 0.9240430149881604.
[I 2023-08-31 20:45:17,607] Trial 99 finished with value: 0.9123440210090792 and parameters: {'max_depth': 7, 'max_features': 0.27905313108436003, 'n_estimators': 150, 'min_samples_split': 17, 'criterion': 'entropy'}. Best is trial 87 with value: 0.9240430149881604.
Time elapsed: 339988.29793465603 sec
