[I 2023-08-25 18:23:28,874] Trial 82 finished with value: 0.9148758013168766 and parameters: {'max_depth': 9, 'max_features': 0.32265643294214685, 'n_estimators': 250, 'min_samples_split': 642, 'criterion': 'gini'}. Best is trial 38 with value: 0.9226797485571119.
[I 2023-08-25 18:38:43,600] Trial 83 finished with value: 0.9184566789424476 and parameters: {'max_depth': 15, 'max_features': 0.30511026095618526, 'n_estimators': 130, 'min_samples_split': 7, 'criterion': 'gini'}. Best is trial 38 with value: 0.9226797485571119.
[I 2023-08-25 19:35:15,315] Trial 84 finished with value: 0.9175721560709157 and parameters: {'max_depth': 11, 'max_features': 0.47222777350104517, 'n_estimators': 430, 'min_samples_split': 5, 'criterion': 'gini'}. Best is trial 38 with value: 0.9226797485571119.
[I 2023-08-25 19:50:24,819] Trial 85 finished with value: 0.9170754008408466 and parameters: {'max_depth': 11, 'max_features': 0.41408883749870995, 'n_estimators': 120, 'min_samples_split': 7, 'criterion': 'gini'}. Best is trial 38 with value: 0.9226797485571119.
[I 2023-08-25 20:15:50,325] Trial 86 finished with value: 0.9146941987716278 and parameters: {'max_depth': 10, 'max_features': 0.25724813509803024, 'n_estimators': 330, 'min_samples_split': 980, 'criterion': 'gini'}. Best is trial 38 with value: 0.9226797485571119.
[I 2023-08-25 21:49:09,558] Trial 87 finished with value: 0.9240334996091558 and parameters: {'max_depth': 15, 'max_features': 0.9114063262023891, 'n_estimators': 340, 'min_samples_split': 2, 'criterion': 'gini'}. Best is trial 87 with value: 0.9240334996091558.
[I 2023-08-25 22:37:17,291] Trial 88 finished with value: 0.9154932398535868 and parameters: {'max_depth': 9, 'max_features': 0.43789134985107203, 'n_estimators': 490, 'min_samples_split': 4, 'criterion': 'gini'}. Best is trial 87 with value: 0.9240334996091558.
[I 2023-08-25 23:50:39,639] Trial 89 finished with value: 0.9214930744944099 and parameters: {'max_depth': 14, 'max_features': 0.6693542351001975, 'n_estimators': 370, 'min_samples_split': 33, 'criterion': 'entropy'}. Best is trial 87 with value: 0.9240334996091558.
[I 2023-08-26 00:40:20,211] Trial 90 finished with value: 0.9175519254136827 and parameters: {'max_depth': 10, 'max_features': 0.7570820899810939, 'n_estimators': 290, 'min_samples_split': 29, 'criterion': 'gini'}. Best is trial 87 with value: 0.9240334996091558.
[I 2023-08-26 01:43:53,901] Trial 91 finished with value: 0.9185632368893251 and parameters: {'max_depth': 13, 'max_features': 0.3879575542699105, 'n_estimators': 500, 'min_samples_split': 6, 'criterion': 'entropy'}. Best is trial 87 with value: 0.9240334996091558.
[I 2023-08-26 02:07:43,543] Trial 92 finished with value: 0.9192560530826597 and parameters: {'max_depth': 13, 'max_features': 0.5174720055102661, 'n_estimators': 150, 'min_samples_split': 11, 'criterion': 'entropy'}. Best is trial 87 with value: 0.9240334996091558.
[I 2023-08-26 02:16:37,407] Trial 93 finished with value: 0.9151022165202163 and parameters: {'max_depth': 13, 'max_features': 0.21730220285891885, 'n_estimators': 100, 'min_samples_split': 44, 'criterion': 'gini'}. Best is trial 87 with value: 0.9240334996091558.
[I 2023-08-26 03:11:51,271] Trial 94 finished with value: 0.9192760808367885 and parameters: {'max_depth': 12, 'max_features': 0.7181274039912926, 'n_estimators': 280, 'min_samples_split': 575, 'criterion': 'gini'}. Best is trial 87 with value: 0.9240334996091558.
[I 2023-08-26 04:40:12,395] Trial 95 finished with value: 0.9178709736841814 and parameters: {'max_depth': 10, 'max_features': 0.87338602548784, 'n_estimators': 440, 'min_samples_split': 102, 'criterion': 'gini'}. Best is trial 87 with value: 0.9240334996091558.
[I 2023-08-26 05:23:41,993] Trial 96 finished with value: 0.9152992271710734 and parameters: {'max_depth': 8, 'max_features': 0.6044769914824529, 'n_estimators': 370, 'min_samples_split': 15, 'criterion': 'gini'}. Best is trial 87 with value: 0.9240334996091558.
[I 2023-08-26 06:08:24,224] Trial 97 finished with value: 0.9179905510453306 and parameters: {'max_depth': 13, 'max_features': 0.36064247156818974, 'n_estimators': 410, 'min_samples_split': 24, 'criterion': 'gini'}. Best is trial 87 with value: 0.9240334996091558.
[I 2023-08-26 06:40:20,386] Trial 98 finished with value: 0.9146520926356706 and parameters: {'max_depth': 7, 'max_features': 0.7905560575795899, 'n_estimators': 220, 'min_samples_split': 177, 'criterion': 'gini'}. Best is trial 87 with value: 0.9240334996091558.
[I 2023-08-26 06:50:33,192] Trial 99 finished with value: 0.9123273428489143 and parameters: {'max_depth': 7, 'max_features': 0.27905313108436003, 'n_estimators': 150, 'min_samples_split': 17, 'criterion': 'entropy'}. Best is trial 87 with value: 0.9240334996091558.
Time elapsed: 240177.95307550498 sec
